,url,title,content
23,https://oto.detik.com/berita/d-5220373/ada-demo-bem-si-hindari-jalan-ini,"Ada Demo BEM SI, Hindari Jalan Ini"," Hari ini Badan Eksekutif Mahasiswa Seluruh Indonesia (BEM SI) akan melakukan aksi unjuk rasa menuntut pencabutan Omnibus Law Undang-Undang Cipta Kerja. Ribuan massa diperkirakan turun ke jalan dalam aksi demonstrasi ini. Pengendara yang masih beraktivitas hari ini disarankan untuk menghindari kawasan Istana Merdeka. Direktorat Lalu Lintas (Ditlantas) Polda Metro Jaya pun menyiapkan rekayasa lalu lintas karena ada giat demonstrasi hari ini di sekitar Istana Merdeka. ""Hindari kawasan Istana Merdeka,"" kata Dirlantas Polda Metro Jaya Kombes Sambodo Purnomo Yogo. Ada tujuh pengalihan arus lalu lintas di sekitar Istana Merdeka yang disiapkan. Pengendara diharapkan agar memperhatikan pengalihan arus lalu lintas ini. Berikut pengalihan lalu lintas di sekitar Istanda Merdeka: 1. Arus lalu lintas dari Jalan Veteran Raya yang akan menuju Jl Veteran III diluruskan ke TL Harmoni. 2. Arus lalu lintas dari Jalan Medan Merdeka Timur yang akan menuju Jalan Medan Merdeka Utara dibelokkan ke kanan ke Jalan Perwira. 3. Arus lalu lintas dari Jl Ridwan Rais yang akan menuju ke Jalan Medan Merdeka Selatan diluruskan ke Jalan Medan Merdeka Timur. 4. Arus lalu lintas dari Jl MH Thamrin yang akan menuju ke Bundaran Patung Kuda dibelokkan ke kiri atau ke kanan ke Jl Kebon Sirih. 5. Arus lalu lintas dari Jl Abdul Muis yang akan belok kiri ke Jl Budi Kemuliaan diluruskan ke Jl Fachrudin dan arus lalin dari Jl Fachrudin yang akan belok kanan ke Jl Budi Kemuliaan diluruskan ke Jl Abdul Muis. 6. Arus lalu lintas dari Jalan Tanah Abang II yang akan lurus ke Jl Museum dibelokkan ke kiri maupun ke kanan, arus lalu lintas dari Jl Majapahit yang akan belok ke kiri ke Jl Museum diluruskan ke Jl Abdul Muis dan arus lalu lintas dari Jalan Abdul Muis yang akan belok kanan ke Jalan Museum diluruskan ke Jl Majapahit. 7. Arus lalu lintas dari l Hayam Wuruk yang akan lurus ke Jl Majapahit dibelokkan ke kiri ke Jl Juanda dan arus lalu lintas dari Jl Veteran Raya yang akan belok ke kiri ke Jl Majapahit diluruskan ke Jl Suryo Pranoto maupun dibelokkan ke kanan Jl Gajah Mada.  [Gambas:Twitter] "
24,https://oto.detik.com/berita/d-5220307/alasan-honda-belum-jual-mobil-hybrid-atau-listrik-di-indonesia,Alasan Honda Belum Jual Mobil Hybrid atau Listrik di Indonesia," Indonesia merupakan salah satu pasar otomotif yang belum menerima seutuhnya mobil listrik. Regulasi dan infrastrukturnya belum saklek, tapi sudah banyak merek-merek yang menjajakan mobil ini di Indonesia. Mobil listrik yang sudah dipasarkan di Indonesia di antaranya Tesla, BMW i3 dan Hyundai Ioniq. Sementara itu jenis Hybrid juga sudah banyak dari merek Jepang maupun Eropa, namun dijual dengan ketentuan pajak mobil bensin. Dari semua merek yang berjualan di Indonesia, Honda merupakan salah satu pabrikan yang tidak terlihat punya keinginan menuju elektrifikasi. Sampai saat ini belum ada pengenalan mobil listrik atau hybrid Honda di Indonesia. Padahal secara global produk-produk Honda yang di Indonesia ada opsi penggerak hybrid. Saat ditanya, Honda berdalih masih mempelajari dan menunggu semua perangkat ekosistem mobil listrik selesai. ""Kami pelajari regulasi tersebut untuk menentukan teknologi apa yang paling sesuai. Misal infrastruktur dan bagaimana regulasi dari pemerintah,"" jawab Business Innovation and Sales & Marketing Director PT Honda Prospect Motor, Yusak Billy dalam Wawancara Virtual Update Penjualan PT HPM Semester Kedua, Senin (19/10/2020). Seperti yang disebutkan di atas banyak kompetitor Honda yang sudah mulai duluan dengan mobil listrik atau hybrid. Jika harus memilih berdasarkan situasi sekarang, Honda melihat teknologi yang tepat untuk memasukkan elektrifikasi ke Indonesia adalah lewat hybrid. ""Perlu bridging supaya tidak kaget langsung baterai, jadi kalau bagi kami hybrid paling tepat untuk sekarang melihat infrastruktur dan regulasi serta juknis. Karena kalau langsung baterai itu nanti infrastruktur bagaimana suplier bagaimana itu tidak ada nantinya,"" terang Yusak. ""Sekarang saya bilang hybrid paling cocok tapi nanti belum tahu, kita akan pelajari dulu regulasinya seperti apa, insentif seperti apa, infrastruktur seperti apa. Kalau ditanya sekarang hybrid, tapi lihat perkembangan seperti apa dan itu cepat berubah,"" tukasnya. Secara global Honda sudah memiliki Honda E yang dipasarkan di Eropa. Untuk jenis hybrid ada juga Honda C-RV yang barus saja meluncur beberapa minggu lalu."
25,https://oto.detik.com/tips-and-tricks-mobil/d-5220294/tips-beli-mobil-matik-bekas-periksa-lebih-teliti-di-bagian-ini,"Tips Beli Mobil Matik Bekas, Periksa Lebih Teliti di Bagian Ini"," Mobil bertransmisi otomatis alias matik makin digemari masyarakat karena lebih praktis dan mudah dioperasikan. Bila Anda tertarik dan ingin membeli sebuah mobil matik dalam kondisi bekas, ada baiknya melakukan pemeriksaan lebih teliti di bagian transmisi. Sebab sudah menjadi rahasia umum jika transmisi mobil matik punya harga yang sangat mahal. Jadi pastikan part ini masih dalam kondisi bagus saat Anda membeli mobil matik bekas. Saat memutuskan membeli sebuah mobil bekas, Anda harus melakukan inspeksi di beberapa bagian seperti bodi, kaki-kaki hingga kondisi interior dan mesin, kondisi transmisi mobil tentunya juga harus perhatikan. Jangan sampai tidak lama setelah Anda membelinya transmisi mobil lantas bermasalah. Karena itulah, ada beberapa tips ringan yang bisa dilakukan untuk mengetahui kondisi sistem transmisi matik mobil bekas yang Anda incar. Pertama-tama, Anda wajib meminta kesempatan test drive mobil matik kepada si penjual. Bila kesempatannya didapat, Anda bisa melakukan beberapa langkah pemeriksaan. Sebagai awalan, hidupkan mesin mobil matik yang Anda coba. Tidak usah pakai AC. Saat dinyalakan, dengar dengan seksama suara mesin mobil bekas incaran Anda. Bila ada suara 'nging' yang tidak lazim, sangat mungkin umur transmisi itu tidak akan lama lagi. Maka pertimbangkan hal itu sebelum memutuskan untuk meminangnya. Setelah mengecek kondisi mesin, langkah selanjutnya adalah mengecek sistem transmisi. Mulailah pindahkan tuas dari mode Parking (P) ke Netral (N). Ketika Anda memindahkan tuas dari P ke N maka akan lewat modus R. Perhatikan, apakah mobil menghentak dengan tidak lazim. Kalau menghentak dan ada bunyi jedak yang tidak lazim, besar kemungkinan transmisi matiknya mudah bermasalah. Kemudian pindahkan kembali tuas transmisi mobil matik itu dari posisi Netral (N) ke posisi Drive (D). Kembali perhatikan apakah ada hentakan yang tidak lazim atau bunyi jedak yang tidak biasa. Jika ada, kondisi transmisi itu sudah rentan masalah. Ketika Anda menemui masalah itu, pikirkan ulang untuk meminangnya. Dan kalau masih belum yakin, bawa mobil itu ke bengkel kepercayaan Anda untuk dicek lebih lanjut kondisi transmisinya. Di luar pengecekan mesin dan transmisi, tentunya masih ada hal lain yang harus Anda pastikan lagi, seperti apakah mobil tersebut mengalami kebocoran oli atau bekas menerjang banjir? Selain itu cek pula riwayat servisnya, juga kelengkapan dokumennya seperti STNK maupun BPKB."
26,https://oto.detik.com/berita/d-5220295/inka-uji-coba-bus-listrik-sekali-isi-baterai-tempuh-200-km,"INKA Uji Coba Bus Listrik, Sekali Isi Baterai Tempuh 200 Km"," PT. Industri Kereta Api (INKA) melakukan uji coba bus listrik. Bus yang dinamai E-INOBUS hasil karya INKA bekerjasama dengan Tron-E dari Taiwan. ""Ini merupakan pengujian prototype bus listrik ukuran medium di jalan umum jalur arteri area Madiun dan di Jalan tol Madiun - Nganjuk, hari ini. Produk ini merupakan kerjasama PT INKA (Persero) dengan Tron-E dari Taiwan sebagai mitra komponen drive train dan baterai bus serta Piala Mas dari Malang sebagai mitra pembuatan bodi bus listrik,"" Direktur Utama PT INKA (Persero) Budi Noviantoro kepada wartawan usai uji coba Senin sore (19/10/2010). Budi melanjutkan pengujian ini untuk mengetes kemampuan bus listrik sebelum dilakukan produksi massal. Bus yang dinamai E-INOBUS itu sebelumnya telah melakukan uji landasan pada 13 Agustus 2020 dan telah lulus uji dengan mendapatkan Sertifikat Uji Tipe (SUT) kendaraan bermotor pada tanggal 10 September 2020 di Balai Pengujian Laik Jalan dan Sertifikasi Kendaraan Bermotor (BPLJSKB) yang berlokasi di Cibitung, Jawa Barat. ""Sebelumnya telah dilakukan uji landasan pada 13 Agustus 2020 dan telah lulus uji dengan mendapatkan Sertifikat Uji Tipe (SUT). Ini dilakukan sebelum produksi massal,"" katanya. Budi mengatakan, dalam waktu dekat PT INKA (Persero) juga berencana memasarkan produk bus listrik E-INOBUS untuk area dalam negeri, seperti PT TransJakarta. Sedangkan untuk area luar negeri seperti Democratic Republik of the Congo (DRC) yang juga tertarik dan telah mencoba produk ini minggu lalu. ""Waktu yang diperlukan dalam pengisian daya sampai penuh diperlukan waktu 3 - 4 jam. Tingkat kebisingan pada bus listrik jauh lebih baik (rata - rata sebesar 71 dB) jika dibandingkan dengan bus diesel (rata - rata sebesar 85 dB),"" paparnya. Bicara spesifikasi, Budi menambahkan untuk kecepatan maksimal bus E-INOBUs mampu tembus 90 KM/jam dan memiliki maks gradeability (kemampuan kendaraan mendaki tanjakan) 14%.  Sedangkan pengisian daya sekitar 3-4 jam dengan jarak tempuh sekali charging 200 KM. Selayaknya bus listrik yang terkenal senyap, E-INOBUS memiliki tingkat kebisingan rata-rata 71 dB. Keunggulan lain dari bus listrik ialah efisiensi, dari segi perawatan dan konsumsi bahan bakar. Budi menyebut untuk bus listrik lebih efisien 58% lebih efisien dibanding bus diesel. Hal ini didasar dari catatan pengujian yang sudah dilakukan E-INOBUS dari lintas dalam kota dan luar kota (tol) dengan total jarak 122 km. ""Didapatkan pemakaian rata - rata 1,4 km/kwh, maka untuk biaya operasional per kilometer = 0,71 x Rp1650/kwh = Rp1171/km. Pemakaian bus diesel dapat menempuh jarak 3km/liter, dengan harga solar perliter Rp 9.300/liter, maka didapatkan biaya operasional per kilometer = 0,3 x Rp9.300/liter = Rp 2.790/km,"" imbuhnya. ""Pemeliharaan lebih efisien bus listrik sebesar 49% dengan perbandingan pemeliharaan bus diesel dan bus listrik pernah disampaikan pada Maintenance Forum tahun 2018 di Serbia, di mana kedua bus dijalankan sejauh 250 km per hari. Hasil perbandingan biaya pemeliharaan bus Diesel 396 Euro (Rp6,7 juta) bus listrik 201 Euro atau Rp 3,4 juta,"" tandasnya."
27,https://oto.detik.com/oto-galeri/d-5220296/foto-memukau-deretan-mobil-antik-yang-terbengkalai,Foto Memukau Deretan Mobil Antik yang Terbengkalai, Seorang fotografer bernama Dieter Klein mengabadikan foto mobil-mobil lawas yang terlantar di berbagai wilayah di Eropa dan Amerika. Istimewa/Dieter Klein/teNeues via BBC Indonesia.
