,url,title,content
12,https://sport.detik.com/sport-lain/d-5225442/justin-gaethje-tak-takut-gulat-khabib-peringatkan-ini,"Justin Gaethje Tak Takut Gulat, Khabib Peringatkan Ini"," Khabib Nurmagomedov vs Justin Gethje jadi main event di UFC 254. Justin siap meladeni permainan gulat Khabib, tapi 'The Eagle' ingatkan hal ini. UFC 254 Khabib Nurmagomedov vs Justin Gaethje bakal berlangsung pada Minggu, 25 Oktober pukul 01.00 WIB di Fight Island, Abu Dhabi. Khabib 'The Eagle' pemegang sabuk juara kelas ringan bakal coba mempertahankan titel itu dari Justin 'The Highlight' selaku juara interm kelas ringannya. Khabib Nurmagomedov terkenal dengan keahlian gulatnya. Tak ayal, 10 kali dirinya menang lewat submission dari rekor kemenangannya 28-0. Gulat sudah jadi makanan sehari-hari Khabib di kampung halamannya, Dagestan, Rusia. Nama-nama besar petarung UFC sudah merasakan bagaimana rasanya bergulat sama Khabib. Justin Gaethje sendiri merupakan petarung tipe stand up. 'The Highlight' begitu julukannya, begitu berbahaya dengan boxing dan kickboxing-nya. 19 Kali dirinya menang lewat KO cuma sekali pernah menang lewat submission. Rekor kemenangannya sendiri, 22-2. Meski begitu, Justin siap meladeni permainan gulat Khabib. Sejak memasuki dunia tarung bebas di level amatir, justru dia mula-mula sering mengeluarkan jurus gulat Amerikanya. ""Saya bergulat sejak umur empat tahun dan melakukannya selama hidup saya,"" katanya. Bahkan kala masih duduk di bangku sekolah, Justin Gaethje pernah dua kali menjadi juara di level negara bagian AIA (Arizona Interscholastic Association). Kemudian di tingkat mahasiswa, Justin Gaethje pernah mengikuti banyak kejuaraan di Negeri Paman Sam seperti Oregon Wrestling Classic, NCAA Division I, Western Wrestling All-Conference First Team, dan NCAA Western Regional Championships. Kala sesi jumpa pers UFC 254 di Abu Dhabi, Khabib Nurmagomedov dan Justin Gethje duduk bareng menjawab pertanyaan dari media-media internasional. Khabib pun ditanya soal pernyataan Justin yang tidak takut bermain gulat. ""Gulat Amerika berbeda dengan gulat Dagestan,"" tegas Khabib. Khabib tidak merincikan soal teknik atau lainnya. Dia cuma menitikberatkan kepada stamina! ""Bisakah nanti Justin bergulat selama 25 menit? Kita lihat saja,"" ucapnya. Khabib memang selalu mendominasi tiap ronde pertarungannya. Khabib suka menggiring lawan sampai ke pinggir jaring, yang menutup ruang gerak lalu bermain gulat di sana. Sanggupkah, Justin?"
13,https://sport.detik.com/detiktv/d-5225374/line-up-sementara-pembalap-motogp-2021,Line-up Sementara Pembalap MotoGP 2021," Sejumlah pembalap berpindah tim di MotoGP 2021. Ada Vaentino Rossi yang pindah ke Petronas SRT. Ada Pol Espargaro yang akan jadi tandem Marc Marquez di Repsol Honda. Alex Marquez pun harus ikut 'tergusur' ke LCR Team Honda. Namun, masih ada dua kursi kosong di Aprilia dan Avintia."
14,https://sport.detik.com/sport-lain/d-5225302/cristiano-ronaldo-bilang-insya-allah-menang-khabib-jawab-begini,"Cristiano Ronaldo Bilang Insya Allah Menang, Khabib Jawab Begini"," Bilang Insya Allah, Cristiano Ronaldo menyemangati Khabib Nurmagomedov untuk menang lawan Justin Gaethje di UFC 254. Begini jawaban Khabib Nurmagomedov atas kata-kata penyemangat tersebut. UFC 254 akhir pekan ini akan dipanaskan dengan pertarungan Khabib Nurmagomedov Vs Justin Gaethje. Duel akbar itu pun menarik perhatian luas, salah satunya dari CR7. Saat menjawab pertanyaan di Instagram, pesepakbola yang sedang menjalani karantina mandiri karena positif Corona itu menyuarakan dukungannya buat sang petarung asal Dagestan. ""Tentu, tentu saja, Khabib akan menang! Saudaraku! Insya Allah,"" kata Ronaldo. Kini giliran Khabib yang ditanya mengenai kalimat dukungan dari Cristiano Ronaldo tersebut. Itu setelah seorang reporter bertanya apa ia sudah mendengar kata-kata dari Ronaldo beberapa hari lalu itu. ""Ya, aku sudah melihat videonya. Aku pun memang selalu ngobrol dengan dirinya,"" ucap Khabib Nurmagomedov seperti dilansir SportBible.  [Gambas:Youtube]  ""Ia selalu memberiku saran. Aku juga sering bicara dengan Karim Benzema dan Zlatan Ibrahimovic. Aku suka sepakbola dan sedari kecil selalu memantau mereka, dan buatku mereka selalu memberiku energi besar,"" tuturnya. Kisah pertemanan Khabib Nurmagomedov dengan Cristiano Ronaldo sendiri kabarnya bermula pada tahun 2018 lalu. Waktu itu CR7 mulai rutin mengikuti perkembangan Khabib di medsos. ""Ada yang bilang kepadaku soal hal itu, tapi aku pikir cuma kelakar saja. Tapi kemudian aku mengecek dan ia memang mem-follow. Temanku lalu bilang, 'Yuk message dia'. Aku pun langsung melakukannya,"" tutur Khabib Nurmagomedov soal awal pertemanannya dengan Cristiano Ronaldo. UFC 254 Khabib Nurmagomedov vs Justin Gaethje bakal berlangsung pada Minggu, 25 Oktober pukul 01.00 WIB di Fight Island, Abu Dhabi. Khabib 'The Eagle' pemegang sabuk juara kelas ringan bakal coba mempertahankan titel itu dari Justin 'The Highlight' Gaethje selaku juara interim kelas ringannya."
15,https://sport.detik.com/detiktv/d-5225210/ac-milan-menang-brahim-diaz-dan-petter-hauge-bersinar,"AC Milan Menang, Brahim Diaz dan Petter Hauge Bersinar"," AC Milan berhasil menang 3-1 melawan Celtic di matchday pertama Grup H Liga Europa 2020. Gol-gol Rossoneri dicetak Rade Krunic, Brahim Diaz, dan Jens Petter Hauge."
16,https://sport.detik.com/detiktv/d-5225177/sempat-tertinggal-arsenal-menang-2-1-lawan-rapid-wien,"Sempat Tertinggal, Arsenal Menang 2-1 Lawan Rapid Wien"," Arsenal tandai kemenangan di matchday perdana Grup B Liga Europa 2020. The Gunners taklukkan Rapid Wien 2-1, meski sempat tertinggal lebih dulu."
17,https://sport.detik.com/detiktv/d-5225115/bale-starter-tottenham-libas-lask-3-0,"Bale Starter, Tottenham Libas LASK 3-0", Tottenham menang 3-0 melawan LASK di matchday perdana Grup J Liga Europa 2020. Gareth Bale dimainkan sejak menit pertama dalam laga ini.
18,https://sport.detik.com/f1/d-5225077/lewis-hamilton-kok-belum-perpanjang-kontrak-dengan-mercedes,"Lewis Hamilton, Kok Belum Perpanjang Kontrak dengan Mercedes?"," Lewis Hamilton belum memperpanjang kontraknya bersama Mercedes. Juara bertahan Formula 1 asal Inggris itu mengaku sekarang hal tersebut bukanlah prioritasnya. Masa bakti Hamilton untuk Mercedes akan berakhir musim ini. Ia sudah bergabung dengan tim berjuluk Silver Arrows itu sejak 2013, dan berhasil mengantongi lima gelar juara dunia. Hamilton juga berpeluang besar menambah gelar juara dunianya menjadi enam bersama Mercedes di akhir musim F1 2020, mengingat ia sedang memimpin klasemen pebalap dengan 230 poin dan menyisakan enam seri balapan. Namun di tengah semua itu, rupanya Hamilton belum memperpanjang kontraknya bersama Mercedes, padahal rekan setimnya, Valtteri Bottas, sudah melakukannya.   Driver 35 tahun itu sejatinya ingin duduk membahas kelanjutan kontraknya bersama Mercedes. Namun saat ini, ia tak mau fokusnya meraih gelar juara dunia terganggu dengan bahasan non-teknis. ""Bukan apa-apa, saya cuma belum banyak bicara soal itu. Apakah itu (memperpanjang kontrak) hanya tinggal masalah formalitas, ya mungkin saja, saya tak tahu,"" kata Hamilton, dikutip Crash.   ""Mungkin nanti ada saatnya kami harus duduk bersama dan membicarakan hal tersebut, namun itu bukan prioritas sekarang. Yang jadi prioritas adalah menuntaskan musim sebagai juara dunia, itulah fokus saya saat ini,"" sambungnya. Sebelumnya Hamilton sempat mengatakan bahwa ia tak suka membahas kontrak di tengah pandemi COVID-19 saat ini, di mana dunia olahraga juga terdampak krisis keuangan. Namun tampaknya ia juga ingin memahami dulu targetnya di Formula 1, mengingat usianya tak muda lagi.  ""Saya belum membuat keputusan apapun tapi saya ingin bertahan. Biasanya, saat kami duduk bersama, maka ada perpanjangan kontrak tiga tahun,"" kata Hamilton menambahkan. ""Tapi tentu sekarang sudah berbeda. Apakah saya masih mau lanjut balapan selama tiga tahun lagi juga masih menjadi pertanyaan. Masih ada banyak pertanyaan yang harus dijawab."" ""F1 juga akan memakai mobil era baru di 2022. Jadi saya sedikit bersemangat mengenai apa yang mungkin terjadi pada 2022, seperti apa nanti mobilnya,"" jelasnya."
19,https://sport.detik.com/moto-gp/d-5225023/honda-tak-salah-depak-alex-marquez-ke-tim-satelit,Honda Tak Salah 'Depak' Alex Marquez ke Tim Satelit," Melihat Alex Marquez meraih back-to-back podium di dua seri terakhir MotoGP 2020, Honda mungkin menyesal 'mendepak' Alex Marquez ke tim satelit musim depan. Namun Cal Crutchlow menyebut keputusan itu tidak salah. Tampil melempem di tujuh seri awal, Alex Marquez langsung tampil memikat di dua balapan terakhir. Pada MotoGP Prancis (11/10) yang berlangsung di trek basah karena hujan, ia berhasil menjadi runner-up di belakang Danilo Petrucci. Sempat dituding 'beruntung' karena mendapat lintasan basah, rider 24 tahun itu membuktikan ia juga jago di trek kering dengan kembali menyegel posisi kedua di MotoGP Aragon (18/10), kali ini di belakang Alex Rins. Performa Alex Marquez yang 'telat panas' ini diyakini membuat Honda menyesal telah menggesernya dari posisi rider tim pabrikan untuk diisi oleh Pol Espargaro. Apalagi pergantian itu terkesan terburu-buru, sebab diumumkan saat musim 2020 belum dimulai sama sekali. Namun Crutchlow menyebut Honda tak melakukan blunder. Rider LCR Honda itu meyakini adik Marc Marquez itu bisa tetap kompetitif meski pindah ke tim satelit, sebab ia akan dibekali dengan spek mesin yang sama dengan Marc dan Espargaro. ""Tidak, saya pikir Honda mengambil keputusan berdasarkan insting mereka. Mereka menggunakan insting mereka berdasarkan apa yang mereka ketahui tentang kejuaraan ini. Saya pikir tak ada yang salah,"" kata Crutchlow, dikutip dari Motorsport. ""Sekarang, seperti yang kalian lihat, Alex layak tampil di MotoGP, dia juga layak berada di timnya saat ini (Repsol Honda). Dia memiliki kontrak bersama Honda, dia juga akan mendapat mesin pabrikan tahun depan."" ""Saya pikir tim saya (LCR Honda) adalah tim yang bagus dan mau di tim yang manapun dia tetap akan tampil baik. Memang, ada sumber daya tertentu di tim pabrikan, tapi saya yakin dia tak akan khawatir soal itu,"" jelas rider asal Inggris itu. Kontrak Crutchlow bersama LCR Honda akan habis di musim ini. Alex Marquez-lah yang akan mengisi tempatnya musim depan, menemani Takaaki Nakagami. "
20,https://sport.detik.com/moto-gp/d-5224991/takaaki-nakagami-resmi-jadi-tandem-alex-marquez-di-motogp-2021,Takaaki Nakagami Resmi Jadi Tandem Alex Marquez di MotoGP 2021," Takaaki Nakagami dipastikan akan melanjutkan kiprahnya di MotoGP tahun depan bersama LCR Honda. Pebalap Jepang itu akan bertandem dengan Alex Marquez. Sebelumnya, Nakagami memang sudah difavoritkan akan memperpanjang kontraknya bersama tim yang berbasis di Monako itu. Apalagi, performanya di MotoGP 2020 terbilang stabil. Meski belum pernah naik podium, Nakagami selalu finis di posisi 10 besar dari sembilan balapan yang sudah digelar. Ia pun menjadi pebalap Honda dengan koleksi poin tertinggi saat ini dengan 92 poin dan sedang menempati urutan kelima klasemen pebalap. Nakagami juga menjadi satu dari dua pebalap belum pernah crash di musim ini, bersama Alex Marquez. Peningkatan tersebut membuat Honda tak ragu untuk melanjutkan kerja sama dengan rider 28 tahun itu. ""Saya berterima kasih kepada Honda atas dukungannya, mengizinkan saya menunjukkan seluruh potensi yang saya miliki musim ini,"" kata Nakagami, dikutip Crash. ""Saya akan melakukan yang terbaik untuk mendapat hasil bagus di sisa balapan musim ini, dan membangun momentum untuk musim depan. Saya memiliki target tinggi bersama Honda, dan mengharapkan dukungan yang tiada henti dari kalian,"" sambungnya. Senada, Direktur Honda Racing Corporation Tetsuhiro Kuwata juga antusias dengan kesepakatan baru ini. Ia yakin Nakagami dan Alex Marquez akan menjadi duet tangguh untuk LCR Honda. ""Saya senang bisa melanjutkan kerja sama dengan Takaaki Nakagami di MotoGP pada musim depan dan seterusnya. Saya berterima kasih pada penggemar dan Idemitsu (sponsor Nakagami) yang sudah mendukung kariernya hingga saat ini,"" kata Kuwata. ""Dia akan bertandem dengan Alex Marquez mulai tahun depan, dan semoga keduanya bisa saling membantu meningkatkan performa satu sama lain, dan membawa tim ini meraih hasil lebih baik dari sebelumnya,"" sambungnya. Nakagami akan dikontrak selama dua tahun. Ia juga akan mendapat upgrade mesin yang sama dengan Alex Marquez. Musim ini, Nakagami diketahui masih memakai motor RC213V dengan spek mesin 2019, berbeda dengan para pebalap Honda lainnya yang sudah memakai spek 2020."
