,url,title,content
16,https://health.detik.com/berita-detikhealth/d-5234801/5-alur-pemberian-vaksin-covid-19-harus-tunggu-30-menit-sebelum-pulang,"5 Alur Pemberian Vaksin COVID-19, Harus Tunggu 30 Menit Sebelum Pulang"," Pemerintah berencana melakukan vaksinasi COVID-19 di bulan depan. Indonesia juga sudah mengamankan stok vaksin sekitar 6,6 juta dosis yang akan tiba pada November. Kementerian Kesehatan selaku pelaksana program vaksinasi telah membuat alur pemberian vaksin COVID-19. Dikutip dari laman resmi Kemenkes, berdasarkan Berdasarkan Petunjuk Teknis Pelayanan Imunisasi COVID-19 Kemenkes, alur pemberian vaksin dilakukan melalui 5 tahapan. Tahapan yang dimaksud adalah pendaftaran, skrining, pemberian vaksin, konsultasi Kejadian Ikutan Pasca Imunisasi (KIPI), dan menunggu selama 30 menit sambil dipantau oleh tenaga kesehatan. ""Pada saat skrining, calon penerima vaksin didata identitasnya, gejala yang sama seperti COVID-19, riwayat penyakit terdahulu, riwayat penggunaan obat, riwayat pemberian vaksin dalam waktu 1-14 hari terakhir, dan kondisi kehamilan,"" demikian dikutip dari laman tersebut, Jumat (30/10/2020). Setelah itu, calon penerima vaksin menuju ruang tindakan untuk diberi suntikan. Vaksin diberikan 2 kali, yakni di hari pertama pemberian vaksin dan berikutnya pada hari ke-14. Setelah itu penerima vaksin menuju ruang KIPI. Penerima vaksin dijelaskan apa itu KIPI, gejala yang timbul setelah diberi vaksin, dan penanganannya. Selanjutnya penerima vaksin diarahkan menuju ruang tunggu dan diarahkan menunggu selama 30 menit untuk melihat apakah ada gejala yang muncul. Usai 30 menit, penerima vaksin bisa meninggalkan ruangan. Jika terjadi gejala pada saat sampai di rumah atau beberapa hari setelah vaksin, diharuskan segera memriksakan diri ke fasilitas pelayanan kesehatan terdekat. Saat ini Kemenkes telah melakukan simulasi vaksinasi COVID-19 di beberapa rumah sakit, salah satunya di RS J Leimena, Ambon, Maluku. Direktur Fasilitas Pelayanan Kesehatan Kemenkes dr. Andi Saguni, MA mengatakan simulasi vaksin harus teratur dan pasti, mulai dari jalur pertama orang masuk hingga keluar ruangan, termasuk kondisi gedung dan kemampuan SDM. ""Pelaksanaan pemberian vaksin harus dipastikan kelengkapan peralatan, gedung, dan SDM. Kita tunjukkan bahwa kita siap memberikan pelayanan yang baik,"" katanya."
17,https://health.detik.com/berita-detikhealth/d-5234555/bergadang-jangan-bergadang-kalau-nggak-mau-sakit-jantung,"Bergadang Jangan Bergadang, Kalau Nggak Mau Sakit Jantung"," Kaum milenial pasti sangat akrab dengan kata bergadang. Di usia yang terbilang muda, tubuh memang tidak mudah protes jika harus diajak bergadang untuk menyelesaikan pekerjaan atau tugas-tugas perkuliahan Namun, tak sedikit pula yang hobi bergadang hanya untuk melakukan hal-hal yang kurang bermanfaat seperti main game atau nonton drama korea. Hayo ngaku, pasti banyak kan? Padahal bergadang memiliki efek yang buruk bagi kesehatan, terutama kesehatan jantung. Dalam sebuah penelitian yang dilakukan oleh para ilmuwan dari National Institute for Public Health and the Environment di Belanda menemukan manfaat dari tidur malam bagi kesehatan kardiovaskular. Hanya dengan tidur malam yang cukup, sekitar 8 jam setiap malam, risiko cardiovascular disease (CVD) termasuk di dalamnya penyakit jantung koroner turun lagi sebanyak 8 persen. Risiko kematiannya juga turun sebanyak 16 persen. Jika dibarengi dengan 4 gaya hidup sehat yang lain seperti olahraga teratur, diet sehat, mengurangi alkohol, dan tidak merokok, maka risiko CVD turun lagi menjadi 65 persen dan risiko kematian yang menyertainya juga turun lagi menjadi 83 persen. Dokter, presenter, sekaligus relawan COVID-19 dr. Vito Damay juga mengatakan bergadang bisa memicu hormon stres yang membuat detak jantung makin kencang dan tekanan darah menjadi tinggi. Selain itu, Dokter Spesialis Gizi Klinik dr. Cindiawaty Pudjiadi juga mengatakan bergadang membuat orang-orang yang melakukannya cenderung kacau dalam memilih makanan. Sebab, lanjutnya, di malam hari makanan yang tersisa biasanya makanan yang kurang sehat seperti mie instan, gorengan, dan camilan-camilan yang tinggi kolesterol. Kolesterol inilah yang menjadi salah satu faktor meningkatnya risiko penyakit jantung koroner. Oleh karena itu, agar terhindar dari efek buruknya, kurangi bergadang. Tidur malam yang cukup bisa membuat badan lebih segar dan sehat. Tak hanya istirahat cukup, kamu juga harus menyeimbanginya dengan makan makanan bergizi dan kaya serat seperti buah dan sayur serta rutin berolahraga. Kamu juga bisa mengurangi kadar kolesterol dengan minum Nestlé ACTICOR dua kali sehari setelah makan. Bagi yang suka minuman dingin, Nestlé ACTICOR juga bisa dikonsumsi dengan dikombinasikan bersama es batu atau diminum dalam kondisi dingin. Nestlé ACTICOR merupakan minuman susu rendah lemak yang mengandung Beta Glucan dan Inulin. Kandungan Beta Glucan dan Inulin teruji klinis mampu menurunkan kolesterol jahat (LDL) yang merupakan faktor risiko penyakit jantung koroner. Nestlé ACTICOR juga terbuat dari bahan alami dan rasanya pun sangat enak. Ada 4 varian rasa, antara lain avocado, chocolate, green-tea latte, dan banana. Nestlé ACTICOR baik dikonsumsi oleh orang dewasa yang peduli akan kesehatan tubuh. Nestlé ACTICOR, Cara Alami Turunkan Kolesterol."
18,https://health.detik.com/berita-detikhealth/d-5234740/ibrahimovic-lebih-cepat-sembuh-dari-ronaldo-ini-riwayat-covid-19-keduanya,"Ibrahimovic Lebih Cepat Sembuh dari Ronaldo, Ini Riwayat COVID-19 Keduanya"," Virus Corona COVID-19 bisa menginfeksi siapa saja, termasuk para atlet bertubuh bugar. Zlatan Ibrahimovic dan Cristiano Ronaldo bisa menjadi salah satu contohnya. Ibrahimovic dinyatakan positif COVID-19 pada 24 September. Sementara Ronaldo dilaporkan positif terinfeksi penyakit ini pada 13 Oktober. Ketika terinfeksi, keduanya sama-sama tidak mengalami gejala COVID-19. Namun, lama infeksi di antara mereka berdua ternyata berbeda, Ibrahimovic lebih cepat sembuh dari virus Corona dibandingkan Ronaldo. Berikut riwayat infeksi COVID-19 di antara keduanya. Dari kedua riwayat tersebut, bisa dilihat Ibrahimovic hanya membutuhkan waktu 15 hari untuk bisa sembuh dari COVID-19. Sementara sudah 17 hari lamanya (13-30 Oktober) Ronaldo belum mengabarkan dirinya sembuh dari COVID-19. Menurut sebuah studi di China, virus Corona dapat bertahan di dalam tubuh selama 20-37 hari. Hal ini diketahui setelah para peneliti melakukan penelitian kepada 191 pasien di Rumah Sakit Jinyintan dan Rumah Sakit Paru Wuhan. ""Dalam penelitian ini, kami menemukan bahwa RNA SARS-CoV-2 yang terdeteksi bisa bertahan dalam waktu rata-rata 20 hari,"" tulis para peneliti, dikutip dari Fox News beberapa waktu lalu. Menurut praktisi kesehatan olahraga dari Slim and Health Sports Therapy dr Michael Triangto, SpKO, orang-orang seperti Ibrahimovic dan Ronaldo yang sangat rutin berolahraga tidak menjamin imunitasnya selalu tinggi. Hal ini karena umumnya para atlet memiliki target yang harus dipenuhi dalam mengejar performa, sehingga bisa saja ini menjadi salah satu faktor penyebab turunnya imunitas. ""Itu bisa dikatakan olahraganya terlalu berat, sehingga imunitas tubuhnya turun,"" ucap dr Michael beberapa waktu lalu."
19,https://health.detik.com/berita-detikhealth/d-5234666/rekor-taiwan-tandai-200-hari-bebas-covid-19-ini-strateginya,"Rekor! Taiwan Tandai 200 Hari Bebas COVID-19, Ini Strateginya"," Pusat pencegahan dan pengendalian penyakit Taiwan mencatat 200 hari tanpa kasus transmisi lokal, menyoroti keberhasilan negara tersebut yang berhasil mengendalikan COVID-19 bahkan ketika banyak negara lain berjuang melandaikan lonjakan infeksi. Sejak pandemi melanda, Taiwan hanya mencatat 553 kasus COVID-19 dan 7 kasus kematian. Meskipun penularan dalam negeri sudah terhenti, Taiwan masih mencatat kasus baru dari orang-orang yang datang dari luar negeri. Taiwan dianggap sebagai kisah sukses dalam cara menangani pandemi, terutama mengingat hubungan bisnis dan pariwisata yang erat dengan China, tempat virus pertama kali muncul akhir tahun lalu. Mengutip ABC News, ada beberapa strategi yang dilakukan Taiwan untuk menekan lonjakan kasus COVID-19. Pertama, otoritas Taiwan menutup semua jalur penerbangan dan memeriksa penumpang dari Wuhan, tempat pertama pandemi berasal. Setelah itu pada 20 Januari, pemerintah pusat secara resmi membentuk Pusat Komando Epidemi untuk mengkoordinasikan arahan pusat ke daerah. Mereka juga mengkomunikasikan tentang betapa pentingnya memakai masker sambil mencoba mencegah panic buying dengan menjatah pembelian. Taiwan juga mengkarantina ketat untuk semua kedatangan, baik warga Taiwan maupun asing selama 14 hari. Sejauh ini, sekitar 340.000 orang telah menjalani karantina rumah, dengan kurang dari 1.000 orang didenda karena melanggar."
20,https://health.detik.com/berita-detikhealth/d-5234600/ronaldo-hingga-rossi-deretan-tokoh-yang-belum-juga-sembuh-dari-covid-19,"Ronaldo hingga Rossi, Deretan Tokoh yang Belum Juga Sembuh dari COVID-19"," Tubuh bugar tidak berarti 'bebas' dari COVID-19. Begitupun ketika terinfeksi, tidak ada jaminan akan cepat sembuh. Hal ini dibuktikan dengan laporan beberapa atlet yang belakangan semakin banyak dinyatakan positif COVID-19 dan tidak sembuh-sembuh meski sudah isolasi. Salah satu kabar terbaru datang dari pesepakbola Cristiano Ronaldo dan Ronaldinho. Ronaldo bahkan sudah menjalani tes tiga kali dan masih dinyatakan positif COVID-19. Di antara beberapa atlet yang dinyatakan positif COVID-19, ada yang kondisinya sudah membaik bahkan negatif. Namun, deretan atlet ini masih berjuang melawan COVID-19. Siapa saja? Dirangkum detikcom dari berbagai sumber, berikut beberapa atlet yang masih berjuang melawan COVID-19. Legenda pesepakbola dari Brasil, Ronaldinho dinyatakan positif COVID-19. Ia mengumumkan hasil tes tersebut pada Minggu (25/10/2020). Lima hari berselang, Ronaldinho belum dikabarkan negatif COVID-19. Ia diketahui positif COVID-19 tanpa gejala. ""Saya menjalani tes dan dinyatakan positif COVID. Saya baik-baik saja, tanpa gejala, tapi kami harus meninggalkan acaranya. Kita akan berjumpa lagi nanti. Pelu erat,"" ujarnya saat pertama kali menyampaikan kabar positif COVID-19. Valentino Rossi dikabarkan kondisinya sudah membaik dari sebelumnya. Sempat mengeluh gejala demam, kini ia dikabarkan sudah tak lagi merasakan gejala COVID-19. Namun, belum ada kepastian apakah pembalap Yamaha ini sudah negatif COVID-19. Kabar Rossi mengidap COVID-19 disampaikan Rabu (15/10/2020). ""Tes kilat PCR hasilnya negatif, seperti yang saya lakukan pada Selasa. Tapi salah satu hasilnya, yang dikirim pada pukul 16.00, amat disayangkan hasilnya positif,"" katanya. Valentino Rossi sudah dua pekan tak ikut balapan di MotoGP karena positif Covid-19. Rossi harus menjalani karantina mandiri sehingga absen di dua balapan di Aragon. Cristiano Ronaldo bintang pesepakbola Portugal dinyatakan positif COVID-19 pertama kali pada Selasa (13/10/2020). Diketahui, sudah 2 pekan berlalu sejak Ronaldo dinyatakan positif. Ronaldo sudah menjalani tiga kali tes COVID-19 dan yang terakhir masih dinyatakan positif, Kamis (29/10/2020). Ronaldo sempat membuat heboh lantaran cuitannya yang menilai PCR adalah omong kosong. Namun, belakangan postingan tersebut dihapus dan sudah tak ditemukan lagi dalam akun Instagram pribadinya.  Alex Telles, pemain baru Manchester United, dinyatakan positif COVID-19 pada Kamis (29/10/2020). Hal itu disampaikan Ole Gunnar Solskjaer selaku manajer Setan Merah. Ole Gunnar Solskjaer memastikan Alex Telles absen akibat positif terjangkit COVID-19. ""Telles telah dites positif mengidap virus Corona. Dia sudah absen selama beberapa hari,"" kata Solskjaer kepada MUTV, dikutip dari Metro. ""Tidak ada gejala. Dia akan baik-baik saja dan segera kembali,"" ujarnya. Dalam keterangan situs resmi Liverpool, Saide Mane dinyatakan positif COVID-19 pada 2 Oktober lalu. Ia diketahui tengah menjalani isolasi mandiri berdasarkan protokol ketat. ""Sadio Mane dinyatakan positif COVID-19 dan saat ini melakukan isolasi sendiri sesuai dengan pedoman yang diperlukan,"" demikian keterangan tertulis di laman Liverpool. Mane disebut mengeluhkan gejala COVID-19 ringan tetapi bisa dipastikan kondisinya baik-baik saja secara keseluruhan. ""Namun, seperti halnya Thiago Alcantara, Liverpool akan terus mengikuti semua protokol yang berkaitan dengan COVID-19 dan Mane akan mengisolasi diri selama jangka waktu yang ditentukan,"" lanjut keterangan tersebut. Berikut detail tanggal deretan atlet di atas dinyatakan positif COVID-19:"
21,https://health.detik.com/berita-detikhealth/d-5234563/gejala-covid-19-ini-bisa-bertahan-sampai-berbulan-bulan-meski-sudah-sembuh,Gejala COVID-19 Ini Bisa Bertahan sampai Berbulan-bulan Meski Sudah Sembuh," Tampaknya terinfeksi oleh virus SARS-CoV-2 dapat berdampak pada kulit juga. Sebuah studi baru-baru ini menunjukkan ada gejala COVID-19 yang masih bisa bertahan hingga berbulan-bulan meski pasien sudah dinyatakan sembuh. Dikutip dari laman Health Shots, penemuan yang dipresentasikan pada Kongres ke-29 di Akademi Dermatologi dan Venereologi Eropa oleh para peneliti di Rumah Sakit Umum Massachusetts (MGH), AS, yang berfokus pada penularan jangka panjang dari COVID-19. Bertujuan untuk analisis, para peneliti Amerika membuat daftar internasional untuk manifestasi kulit COVID-19 pada April 2020.Kemudian, dokter menghubungi pada bulan Juni dan Agustus untuk memperbarui hasil tes laboratorium COVID-19 dan durasi gejala kulit pasien. Tim peneliti mendefinisikan long hauler sebagai siapa saja dengan gejala COVID-19 di kulit yang bertahan setidaknya selama 60 hari. Tim peneliti mengevaluasi hampir 1.000 kasus pasien dengan manifestasi kulit COVID-19. Ruam seperti campak dan urtikaria berlangsung selama tujuh hari dan empat hari masing-masing untuk pasien dengan COVID-19 yang dikonfirmasi di laboratorium dengan durasi maksimum 28 hari. Ruam melepuh atau 'letusan papulosquamous' yang merupakan papula dan aktinik keratosis, berlangsung selama rata-rata 20 hari dalam kasus yang dikonfirmasi di laboratorium, dengan satu letusan actinic keratosis yang dikonfirmasi berlangsung selama 70 hari. Actinic keratosis adalah kondisi di mana kulit menjadi kasar, menebal, dan bersisik, Kemerahan dan pembengkakan pada kaki dan tangan, umumnya dikenal sebagai COVID toes, berlangsung selama rata-rata 15 hari pada pasien dengan dugaan COVID-19 dan 10 hari pada kasus yang dikonfirmasi di laboratorium.  Khususnya, ada enam pasien dengan gejala ini adalah pasien long haul dengan covid toes yang berlangsung setidaknya 60 hari, dengan dua pasien yang dikonfirmasi di laboratorium dengan covid toes berlangsung lebih dari 130 hari. ""Temuan kami mengungkapkan subset pasien yang sebelumnya tidak dilaporkan dengan gejala COVID-19 di kulit yang bertahan lama, khususnya mereka yang memiliki covid toes,"" jelas penulis senior Esther E. Freeman, MD, PhD, direktur Global Health Dermatology di MGH. Data ini pun menambah pengetahuan tentang efek jangka panjang COVID-19 di berbagai sistem organ."
22,https://health.detik.com/berita-detikhealth/d-5234499/pecah-rekor-lagi-ini-negara-penyumbang-kasus-harian-covid-19-tertinggi-dunia,"Pecah Rekor Lagi, Ini Negara Penyumbang Kasus Harian COVID-19 Tertinggi Dunia"," Kasus harian COVID-19 dunia per hari semakin meningkat, mencatat rekor lebih dari 500 ribu untuk pertama kalinya pada Kamis (29/10/2020). Rekor kasus COVID-19 tercatat saat beberapa negara kembali melaporkan lonjakan kasus. Penambahan kasus juga meningkat hampir 25 persen, dalam waktu kurang dari dua minggu saat dunia mencatat 400 ribu kasus per hari di Jumat lalu. Sebagian besar negara bagian barat dan Amerika Latin menyumbang kasus COVID-19 tertinggi di beberapa minggu terakhir. Bahkan kemarin Amerika Serikat mencatat kasus baru lebih dari 90 ribu kasus per hari. Eropa, Amerika Utara dan Amerika Latin menyumbang lebih dari 66 persen kasus COVID-19 dunia dan lebih dari 76 persen kematian COVID-19 dunia. Kasus baru COVID-19 di Eropa telah berlipat ganda selama dua minggu terakhir. Hal ini berdasarkan catatan kasus lebih dari 250.000 untuk pertama kalinya pada hari Rabu, menurut penghitungan Reuters. Dari sekian banyak negara yang kembali mencatat lonjakan kasus COVID-19, mana saja yang mencatat lonjakan paling tinggi? Berikut laporan data worldometers per Kamis (29/10/2020). Kasus baru: 91.530 kasus Total kasus: 9.212.767 Kasus baru: 49.281 Total kasus: 8.088.046 Kasus baru: 47.637 Total kasus: 1.282.769 Kasus baru: 26.831 Total kasus: 616.595 Kasus baru: 26.647 Total kasus: 5.496.402 Kasus baru: 23.580 Total kasus: 1.238.922 Kasus baru: 23.065 Total kasus: 965.340 Kasus baru: 20.156 Total kasus: 368.337 Kasus baru: 20.156 Total kasus: 319.205 Kasus baru: 18.732 Total kasus: 498.353"
23,https://health.detik.com/berita-detikhealth/d-5234450/eks-diplomat-who-pun-susah-cari-pesawat-saat-pandemi-ini-kisahnya,"Eks Diplomat WHO Pun Susah Cari Pesawat Saat Pandemi, Ini Kisahnya"," Sejak awal Oktober lalu, Prof Tjandra Yoga Aditama mengakhiri masa tugas sebagai Direktur Penanganan Penyakit Menular WHO untuk Asia Tenggara. Jabatan itu dia emban sejak 2018 dan berkantor di New Delhi, India. Pada pertengahan September dia pun kembali ke Jakarta untuk menikmati masa pensiun bersama keluarga. Meski berstatus diplomat WHO, proses kepulangan tak berlangsung mulus. Maklum, India belum sepenuhnya membuka status lockdown yang diterapkan sejak Maret lalu. Bandara Internasional New Delhi masih tutup, tak melayani penerbangan komersial internasional. Kerja sama penerbangan terbatas memang mulai dibuka sejak awal September, seperti dengan Malaysia. Prof Tjandra Yoga pun akhirnya memesan tiket Malaysia Airlines. Tapi karena satu dan lain hal, penerbangan tersebut ditunda beberapa hari dari jadwal yang telah ditetapkan. ""Padahal visa izin tinggal saya sudah habis sehingga akan dianggap illegal kalau tetap mengikuti jadwal penerbangan tersebut,"" tuturnya dalam program Blak-blakan di detik.com, Jumat (30/10/2020). Oleh WHO, ahli paru Fakultas Kedokteran-Universitas Indonesia (FKUI) itu yang pernah menjadi Dirjen Perlindungan Penyakit Menular Kementerian Kesehatan RI itu kemudian disediakan tiket penerbangan lain. Rutenya New Delhi-Dubai-Jakarta, artinya ke arah barat dulu lalu balik ke arah timur. Meski sedikit memutar, dia setuju. Penerbangan ini pun akhirnya batal diikuti karena yang boleh terbang cuma warga India dan Uni Emirat Arab. Alternatif lain disodorkan, yaitu penerbangan New Delhi, Frankfurt (Jerman) Bangkok, Jakarta. Total 36 jam karena harus transit selama 12 jam di Frankfurt. ""Tentu saya tolak karena bukan hanya terlalu melelahkan, tapi juga terlalu berisiko penularan COVID-19,"" kata Prof Tjandra Yoga. Dia beruntung karena akhirnya KBRI di New Delhi mengupayakan penerbangan repatriasi, khusus New Delhi-Jakarta untuk WNI dan atau warga negara lain yang harus terbang dari New Delhi ke Jakarta. ""Pengalaman ini menunjukkan bahwa kalau memang harus terbang, amat tidak mudah mendapatkan pesawat yang tersedia,"" ujarnya. Terlepas dari kendala tersebut, Prof Tjandra Yoga mengingatkan bila hendak bepergian dengan penerbangan internasional tetap memperhatikan aturan yang diminta oleh maskapai dan atau negara yang akan dituju. Sebagian besar negara mensyaratkan semua orang yang mendarat di bandara internasionalnya sudah membawa hasil PCR negatif untuk COVID-19. ""Ini juga harus hati-hati, karena ada yang mensyaratkan pemeriksaan PCR-nya paling lambat 48 jam sebelum mendarat, ada yang 72 jam, dan ada yang 7 hari,"" ujarnya. Selengkapnya, simak Blak-blakan detikcom dengan Prof Tjandra Yoga Aditama dalam video berikut:  [Gambas:Video 20detik] "
24,https://health.detik.com/berita-detikhealth/d-5234411/tertinggi-di-dunia-covid-19-di-as-sudah-tembus-9-juta-kasus,"Tertinggi di Dunia, COVID-19 di AS Sudah Tembus 9 Juta Kasus"," Total kasus virus Corona COVID-19 di Amerika Serikat (AS) sudah melewati sembilan juta kasus. AS pun kini masih menjadi negara penyumbang kasus COVID-19 terbanyak di dunia. Berdasarkan data worldometers, total kasus COVID-19 di AS sudah mencapai 9.212.546 kasus pada hari Jumat (30/10/2020). Menurut laporan New York Times, AS mencatat rekor penambahan kasus baru COVID-19 pada Kamis (29/10/2020), yakni sebanyak 86.600 kasus dalam sehari. Ahli epidemiolog dari University of Wisconsin-Milwaukee, Amanda Simanek, mengatakan ia belum pernah melihat lonjakan kasus COVID-19 sebanyak ini di negara lain. Simanek pun khawatir, jika tidak cepat ditangani, penyebaran virus Corona di AS akan semakin mudah saat musim dingin tiba. ""Pola penyebaran ini bisa terus terjadi jika kita tidak menekan infeksi hingga ke tingkat yang bisa kita kendalikan,"" ucap Simanek. Sementara itu, mantan komisioner Badan Pengawas Obat dan Makanan AS (FDA), Dr Scott Gottlieb, meyakini bahwa dalam waktu dekat AS akan mencatatkan kasus harian COVID-19 sebanyak 100.000 kasus per hari. ""Kami akan mengatasi 100.000 infeksi di beberapa titik dalam beberapa minggu mendatang, mungkin. Mungkin juga bisa dalam minggu ini, jika semua negara bagian melaporkan kasus dengan tepat waktu,"" kata Gottlieb, dikutip dari CNN. Menurut Gottlieb, lonjakan kasus ini dikarenakan masih banyaknya warga AS yang kurang memperhatikan prokotokol kesehatan. ""Kenyataannya adalah saya pikir kita tidak akan mulai melihat perlambatan kasus sampai adanya perubahan perilaku di masyarakat dan sampai Anda melihat data mobilitas mulai menurun,"" jelasnya. Selain itu, diketahui hingga saat ini sudah sebanyak 5.983.316 pasien COVID-19 di AS yang sudah dinyatakan sembuh. Sementara 234.177 pasien lainnya dilaporkan meninggal dunia."
25,https://health.detik.com/berita-detikhealth/d-5234388/cerita-eks-petinggi-who-soal-murahnya-tes-pcr-dan-harga-obat-di-india,Cerita Eks Petinggi WHO Soal Murahnya Tes PCR dan Harga Obat di India," Sebelum kembali ke tanah air dalam rangka persiapan pensiun sebagai Direktur Penanggulangan Penyakit Menular WHO untuk Kawasan Asia Tenggara, Prof Tjandra Yoga Aditama menjalani uji PCR pertengahan September lalu. Tes dilakukan di teras rumah dinasnya oleh petugas laboratorium di New Delhi, India. Biayanya cuma Rp 480 ribu. Atas saran anaknya yang seorang dokter, dia kembali menjalani tes PCR di sebuah rumah sakit di Jakarta. ""Tarifnya Rp 1,3 juta ha-ha-ha,"" kata Prof Tjandra Yoga dalam program Blak-blakan yang tayang di detikcom, Jumat (30/10/2020). Tak cuma itu. Ahli paru Fakultas Kedokteran Universitas Indonesia (FKUI) itu juga menyebut harga obat-obatan di India juga jauh lebih murah ketimbang di Indonesia. Tak heran bila sejumlah koleganya yang menjadi dokter kerap minta dibelikan obat di India. Sebelum ada pandemi COVID-19, Prof Tjandra Yoga mengaku biasa pulang ke Jakarta sebulan sekali. Di saat itulah koleganya titip dibelikan obat-obatan tertentu. ""Harganya memang bisa lebih murah 50 persen bahkan lebih dari harga di sini. Jadi, bukan cuma biaya PCR harga obat pun lebih murah,"" kata mantan Dirjen Perlindungan Penyakit Menular Kementerian Kesehatan RI itu. Kenapa India bisa demikian, Prof Tjandra Yoga menduga karena 'Negeri Sungai Gangga' itu punya banyak persediaan bahan baku obat. Jumlah penduduk yang mencapai 1,3 miliar jiwa menjadi pangsa pasar sangat besar sehingga bisa menurunkan ongkos produksi. Selain itu, upah pekerja di India kemungkinan lebih murah. ""Tapi soal upah pekerja ini saya tidak tahu persis ya,"" ujarnya. Duta Besar India untuk Indonesia Gurjit Singh, 2012-2015, pernah mengungkapkan alasan lain kenapa negerinya dapat memproduksi dan menjual obat dengan harga sangat murah. Selain punya bahan baku dan pangsa pasar di dalam negeri sangat besar, kata dia, banyak ilmuwan yang belajar di Amerika lalu mengembangkan obat di negaranya. Dalam bidang farmasi India merupakan negara eksportir obat generik terbesar di dunia. Secara volume, negeri itu juga menjadi eksportir obat generik terbesar dengan jaringan industri yang kuat karena 15% ilmuwan farmasinya berada di AS.  [Gambas:Video 20detik] "
26,https://health.detik.com/berita-detikhealth/d-5234346/kabar-baik-dari-104235-kasus-covid-19-di-dki-875-persen-sudah-sembuh,"Kabar Baik! Dari 104.235 Kasus COVID-19 di DKI, 87,5 Persen Sudah Sembuh"," Kabar baik datang dari DKI Jakarta. Jumlah kasus sembuh virus Corona COVID-19 di ibu kota terus mengalami peningkatan. Berdasarkan data corona.jakarta.id pada Jumat (30/10/2020) pagi, persentase jumlah pasien yang sudah sembuh dari COVID-19 di DKI Jakarta sudah mencapai 87,5 persen dari total kasus positif Corona di ibu kota, yakni 104.235 kasus. Persentase jumlah tersebut didapatkan setelah pasien sembuh COVID-19 di DKI Jakarta mengalami penambahan sebanyak 1.078 orang pada Kamis (29/10/2020), sehingga totalnya menjadi 91.235 orang. Total kasus sembuh ini mengalami peningkatan dari jumlah sebelumnya, yaitu 90.157 orang. Dari data tersebut juga diketahui, saat ini ada 10.775 kasus aktif COVID-19 di ibu kota, yang berasal dari 262 kelurahan di DKI Jakarta. Kasus aktif sendiri artinya adalah orang-orang yang masih dianggap sakit dan dalam perawatan. Dari 10.775 kasus aktif COVID-19 di DKI Jakarta, sebanyak 2.824 pasien dirawat dan 7.951 pasien masih menjalani isolasi mandiri. Sementara itu, dilaporkan juga sudah ada 2.225 pasien COVID-19 di DKI Jakarta yang meninggal dunia hingga saat ini."
