,url,title,content
8,https://food.detik.com/info-kuliner/d-5219680/restoran-di-jepang-ini-izinkan-pelanggan-bawa-makanan-sisa,Restoran di Jepang Ini Izinkan Pelanggan Bawa Makanan Sisa," Sebuah restoran memberlakukan kebijakan baru yakni mengizinkan pelanggan membawa makanan sisa. Ini dilakukan sebagai langkah meminimalisir sampah. Porsi makan orang Jepang terbilang lebih sedikit dibandingkan orang-orang barat. Meski porsi makanan yang disajikan di restoran Jepang sudah terbilang kecil, masih ada saja orang yang menyisakan makanan. Banyaknya sisa makanan yang tak termakan ini membuat sampah bertumpuk. Hal inilah yang kemudian menjadi alasan bagi restoran untuk mempersilakan pengunjung membungkus dan membawa makanan sisa. Dilansir dari SoraNews (19/10) sebuah jaringan restoran ternama di Jepang, Royal Host, membuat kebijakan baru terkait membawa makanan sisa. Restoran yang berfokus pada masakan gaya barat dengan cita rasa Jepang ini menyarankan pengunjung untuk membawa makanan sisa yang tak habis. Pihak restoran akan menyediakan wadah khusus untuk mengemas makanan yang akan dibawa pulang. Sebelumnya, tidak banyak resto yang menerapkan konsep seperti ini di Jepang. Kebanyakan makanan Jepang dimasak untuk sekali makan, sebut saja misalnya sushi atau ramen. Tapi sebenarnya banyak juga varian menu ala Jepang yang awet disimpan dalam jangka waktu lama. Banyak restoran melarang pengunjung membungkus makanan sisa karena alasan kesehatan. Pihak resto berdalih tak ingin pelanggannya menyantap makanan sisa karena dikhawatirkan akan sakit jika makanan tidak ditangani dengan baik. Padahal jika disimpan dan dikemas dengan baik makanan akan tetap aman dikonsumsi. Asalkan disertai informasi saran konsumsi dan umur simpan makanan yang dibungkus. Restoran yang menerapkan sistem bungkus makanan sisa membutuhkan izin khusus. Tujuannya untuk memastikan makanan tetap aman saat dikonsumsi di rumah. Dan tentu saja hal ini tidak berlaku untuk semua jenis makanan, terutama makanan yang cepat rusak. Dalam pengumumannya, jaringan restoran ini ingin mengikuti seruan dari Kementerian Pertanian, Kehutanan, dan Perikanan pemerintah Jepang untuk bekerja menuju tujuan pembangunan berkelanjutan dengan mengurangi limbah makanan. Kebijakan baru terkait membungkus makanan sisa di restoran Royal Host mulai berlaku pada 7 Oktober. Resto ini punya daftar makanan yang bisa dibawa pulang dan makanan yang dilarang dibawa pulang. Sup, makanan mentah dan makanan segar yang mudah rusak masuk dalam daftar menu yang dilarang dibawa pulang."
9,https://food.detik.com/info-kuliner/d-5219446/5-tips-bikin-salad-enak-dengan-tampilan-menggugah-selera-ala-netizen,5 Tips Bikin Salad Enak dengan Tampilan Menggugah Selera ala Netizen," Salad kerap jadi santapan para pelaku diet. Supaya menarik selera, netizen di Twitter ini bagikan tips bikin salad enak dan cantik. Yuk, simak! Salad terdiri dari berbagai sayuran atau buah-buahan segar. Untuk salad sayuran, biasanya menggunakan selada hijau segar dengan tambahan sayuran lain yang dinikmati bersama racikan saus atau dressing. Ada juga salad buah yang dibuat dari potongan aneka buah segar. Seperti apel, pisang, stroberi, mangga, lalu disajikan dengan saus creamy. Biasanya salad ini jadi santapan pilihan mereka yang sedang diet demi melangsingkan tubuh. Para pelaku vegetarian atau vegan juga menjadikan salad sebagai makanan mereka sehari-hari. Seperti Naajmi Wicaksono, netizen di Twitter yang sudah menjadi pelaku vegan sejak 4 bulan lalu. Sebelumnya ia seorang vegetarian sejak tahun 2018. Naajmi kerap membagikan menu sehatnya lewat akun Twitter-nya @Hujandisenja. Salah satunya yang ramai jadi perbincangan adalah cara membuat salad yang enak dan cantik (16/10). Naajmi membagikan tips ini agar banyak orang membuat salad tak hanya berwarna hijau saja. Ia menyarankan untuk menambahkan aneka sayuran yang berwarna. Tujuannya supaya salad tampil menggugah selera. ""Pada intinya bikin salad kamu berwarna seperti pelangi, jangan ijo mulu,"" ujar cuitannya di Twitter. Pilih sayuran yang memiliki warna cantik, seperti merah, kuning atau ungu. Sayuran tersebut di antaranya tomat ceri, paprika merah, paprika kuning, kol ungu, wortel, hingga bawang bombai ungu. ""Kol ungu ini enak banget dan crunchy pas dimakan,"" ujar Naajmi Wicaksono di Twitter (16/10). Baca Juga: Mau Racik Salad? Ini 8 Sayuran yang Paling Tinggi Nutrisinya Walaupun di awal ia mengatakan 'jangan melulu hijau' dalam membuat salad, tapi sayuran hijau tetap penting untuk dimasukkan ke dalam salad. Karena sayuran hijau banyak memiliki nutrisi penting untuk tubuh. Kalau bosan dengan selada bokor, bisa ganti dengan sayuran hijau lain yang nutrisinya tetap baik. Seperti bayam, romaine lettuce (selada cos), kale, dan lainnya. Selada air juga cocok kamu pilih karena mengandung sejumlah vitamin yang dibutuhkan tubuh. Seperti vitamin A, C, dan K. Pilihan lain adalah arugula yang kaya akan phytochemicals yang dapat menghambat perkembangan kanker tertentu.  Salad tak hanya sekadar sayuran atau buah-buahan saja. Agar nutrisinya tetap seimbang, tambahkan juga protein. Bisa dari protein hewan ataupun nabati. Protein hewan yang bisa digunakan adalah dada ayam. Dada ayam bisa dikukus dengan tambahan sedikit garam dan lada lalu dipotong dadu. Bisa juga diolah dengan cara dipanggang. Kalau kamu pelaku diet vegetarian atau vegan seperti Naajmi, bisa ganti protein hewan dengan nabati. Seperti kacang-kacangan, ada chickpeas (kacang Arab), kacang merah, lentils, dan kacang polong. Tempe dan tahu juga bisa ditambahkan karena terbuat dari kacang kedelai. Selain sayuran dan protein, langkah selanjutnya adalah memilih sumber lemak sehat. Makanan yang mengandung lemak sehat juga bisa ditambahkan ke dalam salad. Tujuannya untuk menambahkan cita rasa. Makanan yang mengandung lemak sehat diantaranya seperti alpukat, walnuts, almond, dan zaitun. Yang paling mudah di dapatkan adalah alpukat. Buah berwarna daging hijau kekuningan ini mengandung sekitar 14,7 gram lemak sehat dalam takaran 100 gram, seperti dilansir dari Verywell Fit. Lemak yang dikandung oleh alpukat ini bahkan dapat membantu mengatur kadar trigliserida dan mencegah diabetes. Dressing juga jadi elemen penting dalam membuat salad yang enak dan cantik. Naajmi dalam thread Twitter-nya mengatakan, ""Bikin salad sendiri kalo mau enak ada tahapannya: base oil, pemanis, asam, herbs,"" bebernya. Untuk pilihan base oil yang baik digunakan adalah minyak zaitun, grapeseed oil, atau sunflower oil. Perlu diingat, jangan menggunakan minyak goreng. Setelah itu tambahkan pemanis ke dalam salad, bisa berupa madu atau sirup maple. Untuk rasa asamnya bisa tambahkan cuka balsamic, cuka beras, white vinegar, atau yang paling mudah ditemui adalah air lemon. Herbs atau rempah juga tak boleh ketinggalan. Bisa menggunakan basil, bawang, rosemary, bubuk cabai, dan lainnya. Setelah semuanya siap, susun satu per satu elemen salad ke dalam mangkuk. Perhatikan komposisi warna dan posisinya. Terakhir, sirami dressing agar terlihat estetis sekaligus menggugah selera. Baca Juga: Pencinta Salad, Ini Bedanya Vinaigrette dan Dressing untuk Salad "
10,https://food.detik.com/info-kuliner/d-5219515/5-restoran-enak-di-jepang-yang-populer-lewat-video-game-yakuza,5 Restoran Enak di Jepang yang Populer Lewat Video Game Yakuza," Ditampilkan dalam serial game Yakuza yang populer di dunia, lima restoran di Jepang ini jadi populer. Terutama dikunjungi banyak penggemar dari video game tersebut. Mirip seperti serial film, Yakuza merupakan serial video game yang pertama kali tayang di tahun 2005 dan terus berkembang hingga tahun 2020. Selama lebih dari 15 tahun, video game ini menampilkan latar kota-kota besar di Jepang. Beberapa di antaranya masuk restoran yang eksis di dunia nyata. Karenanya banyak penggemar hingga turis dari berbagai negara yang penasaran dengan restoran-restoran yang mereka lihat dalam game Yakuza. Dilansir dari Tokyo Treat berikut lima restoran populer di Jepang yang ada di Yakuza. Baca Juga: Masa Karantina Jadi Asyik dengan Memainkan 5 Game Memasak Ini  1. Matsuya    Matsuya merupakan salah satu gerai restoran khas Jepang yang cabangnya bisa ditemukan di mana-mana. Restoran yang satu ini muncul di mana restoran populer ini selalu jadi latar yang dikunjungi karakter di serial pertama sampai Yakuza 5. Matsuya sendiri terkenal dengan hidangan gyudon nya atau irisan daging sapi yang disajikan dengan nasi. Selain itu menu andalan lainnya ada kari Jepang, hambagu atau hamburger dan masih banyak lagi. Secara keseluruhan Matsuya bisa dibilang sebagai restoran cepat saji yang menyajikan makanan Jepang. Kebanyakan cabang Matsuya buka selama 24 jam dan memudahkan banyak orang untuk makan di sana.  2. Ikinari Steak   Dalam serial Yakuza - Judgement, muncul restoran steak yang memiliki beberapa cabang di Tokyo dan kota besar lainnya. Restoran ini menyajikan menu steak yang enak namun dengan suasana kasual. Mirip seperti restoran steak pada umumnya, di sini para pengunjung bisa memesan potongan daging steak apa yang mereka sukai. Sampai mencicipi beberapa jenis potongan daging steak yang enak. Uniknya lagi di dalam video game Judgement tak hanya Ikinari Steak yang masuk ke sana. Tapi pemilik Ikinari Steak bernama Kunio Ichinose juga muncul di game tersebut. Tentunya hal ini membuat banyak penggemar Yakuza di luar Jepang penasaran dengan restoran steak ini.  3. Zuboraya    Satu hal yang membuat serial game Yakuza memiliki banyak penggemar dan bertahan selama belasan tahun, karena mereka selalu membuat video game dengan latar seperti kota Jepang yang asli. Di serial Yakuza 2 contohnya, ada restoran Zuboraya di Dotonbori, Osaka yang jadi latar game tersebut. Restoran ini terkenal menyajikan hidangan beracun yaitu puffer fish, atau ikan fugu. Memang tidak sulit untuk menemukan ikan fugu di Jepang, namun tak sembarang chef bisa mengolah ikan ini. Zuboraya menjadi salah satu restoran terkenal bagi mereka yang mau mencicipi ikan fugu untuk pertama kalinya.  4. Watami Izakaya Sama seperti Matsuya, Watami Izakaya merupakan bar gaya Jepang yang banyak ditemui cabangnya di wilayah Tokyo. Pub yang satu ini semakin popular setelah masuk ke dalam serial game Yakuza. Tempat ini dikenal penggemar sebagai lokasi karakter Kiryu pergi kencan dengan wanita yang ada di sana, di serial Yakuza 4. Tempat ini termasuk ke dalam tongkrongan hits yang ada di sana. Di kehidupan nyata Watami Izakaya memiliki banyak cabang yang tersebar di luar Jepang. Seperti China, Hong Kong, Taiwan, Singapura, Malaysia, sampai Korea Selatan.  5. Sam's Maui Sam's Maui merupakan restoran khas Hawaii yang ada di wilayah Okinawa. Restoran ini sempat muncul beberapa kali dalam serial game Yakuza 3. Sebelum masuk ke dalam Yakuza pun restoran yang satu ini sudah populer. Uniknya dalam game Yakuza, pemain bisa melihat-lihat menu yang sama seperti di kehidupan nyata. Misalnya racikan Shrimp Cocktail Supreme dengan visual yang menarik. Lalu ada menu Escargots Ala Sam's, tak ketinggalan menu Sam's Tenderloin Steak yang dimasak secara medium, dengan beberapa tambahan lainnya. Fitur ini berhasil membuat banyak penggemar penasaran dengan rasa makanan di Sam's Maui. Baca Juga: Kreatif! Mahasiswa Ini Ciptakan Game Boy dari Buah Semangka "
11,https://food.detik.com/info-kuliner/d-5219397/restoran-ini-tawarkan-masker-khusus-untuk-makan-bagi-pengunjung,Restoran Ini Tawarkan Masker Khusus Untuk Makan Bagi Pengunjung," Di tengah pandemi Corona, banyak cara yang dilakukan restoran untuk tetap menjaga protokol kesehatan. Salah satunya dengan menawarkan masker khusus. Restoran yang satu ini punya cara yang unik sekaligus inovatif untuk menarik perhatian pengunjung. Bukan hanya meningkatkan pelayanan dan kualitas makanan saja, restoran ini juga menawarkan masker khusus untuk makan di sana. Baca Juga: Kreatif! Netizen Bagikan Tips Makan Tanpa Melepas Masker Dilansir dari Zee News (19/10), restoran yang terletak di Kolkata, India ini viral setelah merancang masker yang bagian mulutnya bisa dibuka menggunakan resleting seperti celana. Dengan mudah pengunjung yang menggunakan masker ini bisa membuka resleting mereka di bagian mulut untuk minum dan makan. Setelah itu mereka bisa menutup masker tersebut sehingga tetap aman selama di dalam restoran. Sang pemilik restoran bernama Somoshree Sengupta mengatakan bahwa kini masker merupakan benda wajib yang harus dipakai. Karenanya ia inisiatif menambahkan resleting, agar orang-orang bisa dengan nyaman makan dan minum tanpa harus melepas masker mereka sepenuhnya. ""Karena masker sudah menjadi peraturan wajib di sini, jadi ketika kalian akan makan kalian bisa membuka resletingnya. Setelah selesai kalian bisa langsung menutupnya,"" jelas Sengupta. ""Kami menyediakan masker ini secara gratis untuk semua pengunjung yang datang ke restoran ini. Meski begitu mereka tak wajib menggunakan masker buatan kami ini, mereka bisa memakainya semau mereka, selama mereka mengenakan masker yang lain,"" pungkas Sengupta. Meski terbilang langkah yang kecil tapi banyak netizen yang mengapresiasi dan memuji langkah Sengupta ini. Netizen berharap akan ada lebih banyak restoran hingga kafe yang lebih peduli dengan protokol kesehatan. Tentunya hal ini bisa membantu mengurangi serta mencegah penyebaran virus Corona. Masker unik ini bukan satu-satunya masker yang didesain khusus untuk makan. Sebelumnya hadir masker 'Pac-Man' di Israel. Masker ini sengaja dibuat agar bagian mulutnya dapat terbuka untuk menerima makanan. Lalu setelah makanan lewat, masker ini akan tertutup rapat. Baca Juga: Kini Ada Masker 'Pac-Man', Bisa Makan Tanpa Perlu Copot Masker "
12,https://food.detik.com/info-kuliner/d-5219190/kue-seharga-rp-1-juta-bentuknya-mirip-kue-buatan-anak-kecil,Kue Seharga Rp 1 Juta Bentuknya Mirip Kue Buatan Anak Kecil," Seorang wanita memesan kue dengan harga hampir Rp 1 juta. Bukan kue cantik yang ia dapatkan, tapi kue abstrak yang mirip buatan anak-anak. Dikabarkan Metro (19/10) wanita bernama Sam Faulkner terpaksa mengalami hal menyebalkan. Ia memesan kue ulang tahun untuk sang suami, namun hasilnya sangat mengecewakan karena bentuk kue yang tidak jelas. Di momen ulang tahun suaminya yang ke-30, Sam ingin membuat kejutan kecil lewat sebuah kue ulang tahun. Ia lantas mencari inspirasi desain kue lewat foto-foto di Pinterest. Akhirnya Sam menemukan foto contoh kue cantik buatan Caker Street, sebuah toko kue yang berbasis di London. Kue ini hadir dengan hiasan danau, alang-alang, ikan dan sampan kayu. Kue juga semakin menarik dengan tambahan tulisan ""Happy Birthday"" Merasa sudah menemukan desain kuenya, Sam lantas memesan kue ini kepada baker bernama Emma Beth Mh lewat Facebook. Kue ini dibanderol dengan harga £ 50 (Rp 952 ribu) dan Sam pun menyetujuinya. Wajah senang Sam mendadak muram lantaran melihat kue ulang tahun untuk sang suami. Kue yang datang ternyata jauh dari bayangannya dan sama sekali tidak sama dengan contoh yang diberikan Sam. Ibunda Sam, Sue Faulkner, memposting foto kue tersebut ke grup lokal dan langsung mendapat tanggapan banyak orang. ""Putri saya putus asa ketika dia membuka kotak kue. Tidak seperti gambar contoh. Ini seharusnya adalah dermaga dengan alang-alang dan batu. Dia telah membayar untuk kue itu kepada wanita yang mengaku baker. Tapi hasilnya mirip kue buatan anak-anak, sangat jelek,"" kata Sue kepada Berkshire Live. Setelah membagikan unggahan yang merinci kejadian tersebut, Sue dihubungi oleh beberapa orang lainnya yang bernasib sama. Ternyata korban dari baker abal-abal ini bukan hanya Sam saja. Para korban menceritakan pengalaman sama terkait kue yang bentuknya tak karuan. Sam dan para korban lainnya sebenarnya tak mau tinggal diam karena hal ini sudah sangat merugikan. Mereka mencoba menghubungi Emma Beth Mh, namun akun Facebook maupun nomor kontaknya sudah diblokir. Halaman Facebook baker ini juga sengaja dihapus untuk menghilangkan jejak. Sam akhirnya membawa kasus ini ke Standar Perdagangan, ia melaporkan kasus penipuan ini agar tidak ada orang lain yang menjadi korban selanjutnya. ""Dia jelas bukan pembuat kue. Kami sekarang dapat melihat sisi lucunya setelah itu, tetapi pada saat itu kami sangat kecewa,"" ujar Sam. Kisah soal kue ulang tahun yang tak sesuai ekspektasi ini sebenarnya bukanlah kisah baru. Banyak orang dikecewakan karena kue pesanannya tidak sesuai dengan ekspektasi. Tahun lalu ada sepasang pengantin yang memesan wedding cake cantik bertema merak. Setelah dikirimkan, kue ini sama sekali tak tampak seperti merak dan justru menyeramkan. Momen pernikahan yang seharusnya makin meriah dengan adanya wedding cake justru membuat pengantin wanita menangis sedih. Dari pengalaman ini, pelajaran yang bisa diambil yakni jangan asal memesan kue pada baker yang tidak dikenal."
13,https://food.detik.com/info-kuliner/d-5219189/tteokbokki-jadi-comfort-food-terfavorit-orang-korea-selama-corona,Tteokbokki Jadi 'Comfort Food' Terfavorit Orang Korea Selama Corona," Selama pandemi Corona, orang-orang Korea Selatan banyak memilih tteokbokki sebagai makanan favorit mereka. Hal ini didasarkan pada hasil survei terhadap 10 ribu orang. Tteokbokki merupakan hidangan berbahan utama tteok atau kue beras berwarna putih dengan bentuk silinder dan teksturnya kenyal. Tteok dimasak dengan bumbu merah khas Korea. Bumbunya berupa gochujjang (pasta cabai), gochugaru (cabai bubuk), shoyu, kaldu ikan teri, daun bawang, minyak wijen, dan taburan biji wijen sebagai topping. Banyak juga yang mencampurkan tteokbokki dengan ramyeon, telur, dan odeng. Di Korea Selatan, tteokbokki jadi jajanan kaki lima yang tak sulit ditemui. Biasanya dijajakan oleh penjual kaki lima di area street food, stasiun, atau pasar tradisional. Pemerintah kota Seoul, Korea Selatan pada September lalu membuat survei tentang makanan rumahan favorit selama pandemi Corona. Survei ini lalu diikuti warga Korea Selatan. Terungkap mereka paling banyak memilih tteokbokki, seperti dilansir dari The Korea Times (17/10). Baca Juga: Resep dan Cara Membuat Tteokbokki Homemade Anti Gagal  Tteokbokki yang kenyal dan bercita rasa pedas manis ini menempati urutan pertama dengan total voting lebih dari 10.000 orang. Tak hanya orang lokal Korea saja yang mengikutinya, tapi ada sekitar 50 warga asing di Seoul yang juga memilih tteokbokki. Sebanyak 57% partisipan wanita mengikuti survei tersebut. Usia mereka sekitar 20-30 tahunan. Kota yang paling tinggi mengikuti survei adalah Seoul dengan 32,6% diikuti oleh Gyeonggi sebanyak 23%. Survei ini dilakukan sebagai bagian dari Taste of Seoul, acara kuliner yang akan berlangsung 11-15 November 2020. Ada banyak alasan mengapa tteokbokki terpilih sebagai urutan pertama untuk makanan rumahan favorit. Seorang partisipan di Incheon, Korea Selatan, mengatakan kalau dengan makan tteokbokki bisa melepaskan stres dan rasanya enak. Ketika dimakan dengan sundae (sosis darah) atau twigim (gorengan), maka mereka hanya fokus makan dan melupakan masalahnya. Lalu seorang warga asing yaitu Sara Rousalova dari Ceko mengatakan, ""Tteokbokki makanan yang baik untuk hilangkan pikiran negatif. Tteokbokki memberikan aku rasa pedas, hangat, dan lembut yang aku butuhkan saat aku merasa depresi,"" ungkapnya. Lewat survei makanan rumahan favorit ini, Joo Yong Tae dari perwakilan pemerintah kota Seoul berharap bisa menghidupkan kembali pariwisata di Seoul selama pandemi Corona. ""Kami berharap melalui makanan, kami dapat saling menyemangati dan merasakan cita rasa gastronomi Seoul yang sebenarnya,"" ujarnya. Baca Juga: Setiap Hari Ratusan Orang Indonesia Ngemil Tteokbokki di Restoran Ini "
14,https://food.detik.com/kabar-kuliner/d-5219164/unik-tahu-bulat-ini-dibagikan-gratis-untuk-orang-membutuhkan,Unik! Tahu Bulat Ini Dibagikan Gratis untuk Orang Membutuhkan," Mobil tahu bulat yang satu ini tampak berbeda. Bukan untuk dijual, tahu bulat dan paket nasi bungkus justru dibagikan gratis untuk orang yang membutuhkan. Hafal dengan jingle tahu bulat yang biasa dijajakan keliling menggunakan mobil? Nah kalau penjual tahu bulat yang satu ini beda dan unik. Mobil khas penjual tahu bulat yang keliling kawasan Jakarta Selatan ini membawa paket makanan gratis. Tak ketinggalan, sebungkus tahu bulat juga dibawa untuk dibagikan secara cuma-cuma. Foto dan video mobil tahu bulat yang diunggah di akun instagram @dramaojol.id ini langsung menarik perhatian netizen. Ada 50 paket nasi bungkus dan tahu bulat yang dibagikan khusus untuk para pekerja informal seperti pemulung, pedagang kaki lima, pengemudi ojol dan masyarakat yang membutuhkan. Diketahui, mobil tahu bulat unik ini sudah beroperasi keliling kawasan Jakarta Selatan mulai dari Pasar Minggu, Jagakarsa dan Kebagusan sejak 29 September-16 Oktober 2020. ""Nasi tahu bulatdikasih gratisanBuat yang membutuhkanKagak perlu bayarGurih-gurih Nyooooy.."" bunyi jingle dari speaker mobil tahu bulat ini. Dari keterangan media yang kami terima, aksi unik ini terlaksana berkat gotong royong masyarakat. Tujuannya untuk membantu masyarakat yang kesulitan memenuhi kebutuhan pangannya selama pandemi. Dari foto yang diunggah, terlihat mobil tahu bulat ini dihampiri dan menghampiri beberapa orang. Seperti petugas penyapu jalan, rombongan pengamen ondel-ondel, driver ojol serta pemulung. Senyum dan rona bahagia terpancar jelas dari wajah masyarakat penerima bantuan makanan gratis ini. ""Semenjak Pandemi, dagangan saya menurun 40%. Karena ada kegiatan ini jadi saling bantu. Setiap hari saya bantu bagikan 50 paket nasi bungkus dan 50 bungkus tahu bulat. Biasanya saya pilih-pilih orang yang dibagikan seperti pemulung, pedagang, petugas pembersih jalan. Saya senang dapat bantu menyalurkan, semoga bisa berkah untuk semuanya"", Daffa, penjual tahu bulat. Kegiatan ini bekerjasama dengan komunitas Turun Tangan dan donasi dari ribuan #orangbaik melalui program kitabisa.com/bisamakan. Program BisaMakan merupakan program yang diinisiasi KitaBisa untuk membantu memberi makanan kepada masyarakat yang kelaparan. ""Kaget tadi pas lihat spanduknya gratis, kirain tukang tahu bulat biasa makanya sempet ragu mau samperin. Tapi pas denger suaranya, baru deh yakin. Di saat kayak gini orderan sepi, jadi seneng kalo ada makanan gratis kayak gini. Terima kasih orang baik atas bantuannya."" ujar Ester seorang driver ojol. Netizen yang melihat unggahan mobil tahu bulat gratis ini pun banyak melemparkan komentar positif. Sebagian besar berharap agar semakin banyak aksi serupa yang bisa memberikan dampak besar bagi orang yang membutuhkan. ""Minimal ada 2 di setiap kota setiap hari, dengan kebaikan hati dan peduli sesama, pasti Indonesia jauh dari kelaparan,"" kata netizen. ""Karena dari hal kecil pun namanya kebahagiaan pasti nggak akan pernah bisa dibohongi. Semoga rejekinya semakin berlimpah mas, Aamiin,"" sahut netizen lainnya."
