,url,title,content
24,https://food.detik.com/info-kuliner/d-5222615/5-fakta-kesehatan-makan-ceker-ayam-yang-perlu-diketahui,5 Fakta Kesehatan Makan Ceker Ayam yang Perlu Diketahui," Di Indonesia, ceker ayam dimanfaatkan sebagai makanan lezat. Sebelum mengonsumsinya, ketahui dulu fakta kesehatan tentang ceker ayam. Ceker ayam merupakan bagian kaki ayam. Bagiannya terdiri dari kulit, tulang rawan dan tendon. Meski tanpa daging, tetapi ceker ayam mengandung nutrisi yang menyehatkan. Namun, manfaat ceker ayam bisa berubah menyebabkan efek samping pada kesehatan tubuh, jika diolah dengan cara yang salah. Mulai dari proses pembersihan hingga proses memasak. Ada beberapa tips yang harus diperhatikan saat membersihkan ceker ayam. Jika sudah bersih, ceker ayam dapat diolah menjadi berbagai makanan yang lezat.  Ceker ayam terdiri dari tulang, kulit, urat otot atau tendon. Meski tidak ada bagian dagingnya, tetapi ceker ayam cukup bergizi. Itu karena ceker ayam mengandung vitamin dan mineral dalam jumlah yang cukup. Dalam dua ceker ayam seberat 70 gram mengandung protein sekitar 70%. Jumlah tersebut merupakan total dari kolagen dan protein struktural yang memberikan bentuk, kekuatan dan ketahanan terhadap kulit, tendon dan tulang pada ceker ayam. Selain itu, ceker ayam juga merupakan sumber folat yang baik. Nutrisi itu dapat membentuk sintesis DNA berupa vitamin B9 untuk membantu mencegah kelainan kelahiran. Baca Juga : Netizen Masak Ceker Ayam 2 Jam Tetap Alot, Ini Cara Masak yang Benar Tentu ceker ayam memiliki manfaat untuk dikonsumsi. Manfaat kesehatan tersebut sebagian besar terkait dengan kandungan kolagennya yang tinggi. Manfaatnya dapat meningkatkan kesehatan pada kulit. Kandungan kolagen memang dapat meningkatkan elastisitas dan kepadatan kulit. Ceker ayam juga bisa membantu mengurangi nyeri sendi. Penelitian menunjukkan bahwa kolagen dapat merangsang jaringan untuk mengurangi gejala osteoartritis. Selain itu, asupan kolagen dapat meningkatkan pembentukan dan kepadatan tulang pada wanita terutama pasca menopause. Serta mengontrol gula darah dan menjaga kesehatan jantung. Makan ceker ayam juga bisa menyebabkan efek samping jika tidak diolah dengan cara yang benar. Mulai dari cara membersihkan, cara memasak hingga porsi makan. Misalnya, ceker ayam sering diolah dengan cara digoreng. Cara itu bisa meningkatkan lemak trans dan lemak tak jenuh yang berbahaya untuk kesehatan jantung. Saat membeli ceker ayam pastikan untuk membersihkan dengan benar. Mereka yang tampak kotor atau memiliki kulit yang terbakar amonia menunjukkan cara pembersihan yang buruk. Kamu harus membuang bagian yang kulit yang terbakar amonia yang terlihat seperti kapalan. Itu sering kali disebabkan oleh ayam yang berdiri di atas kotorannya sendiri. Ancaman tersedak juga bisa disebabkan dari mengonsumsi ceker ayam. Itu karena ceker ayam terdiri dari beberapa tulang kecil. Biasanya ceker ayam yang dijual di pasaran sudah dikuliti. Jadi, kamu bisa meminta penjualnya untuk memotong kukunya. Selain itu, ceker ayam harus dicuci bersih. Periksalah satu per satu tulang-tulang kecil pada ceker ayam. Jika menemukan sisi kulit yang tebal, maka harus dibuang. Kemudian cuci kembali ceker ayam. Lalu, berikan air jeruk nipis atau larutan air cuka sambil digosok-gosok hingga kulitnya tidak terasa licin. Selanjutnya kembali bilas dengan air bersih. Lalu rendam ceker ayam ke dalam campuran air dan soda kue. Rendam selama 30 menit hingga satu jam agar tidak amis dan teksturnya empuk. Terakhir tiriskan ceker ayam dan bilas dengan air bersih. Baca Juga : Bagaimana Membersihkan Cakar Ayam? Ceker ayam dapat diolah dengan berbagai cara. Salah satunya bisa dicampur ke dalam sup berkuah kaldu. Tambahan ceker saat maka sayuran dirasa lebih baik daripada digoreng. Namun, sekarang banyak ceker yang diolah jadi jajanan super pedas. Ceker ayam tersebut dibalut dengan sambal, sehingga warnanya merah kehitam-hitaman. Nah, saat mengonsumsi ceker ayam pedas itu sebaiknya dalam porsi yang cukup. Jangan berlebihan karena bisa meningkatkan kalori dalam tubuh."
25,https://food.detik.com/info-kuliner/d-5223486/bikin-laper-rendang-jengkol-hingga-spring-roll-udang-umkm-bandung,Bikin Laper! Rendang Jengkol hingga Spring Roll Udang UMKM Bandung," Ada yang unik pada episode Bikin Laper kali ini. Dua hostnya mencicipi jajanan UMKM Bandung seperti rendang jengkol dan spring roll udang. Jalan-jalan ke Bandung, Ncess Nabati dan Gilang Samiadji tak lewatkan kulineran. Pilihan mereka jatuh pada ragam menu buatan Usaha Mikro, Kecil, dan Menengah (UMKM) di kota kembang. Pertama, ada ayam bakar buatan Kedai Ayam Sipedo. ""Penampilannya glowing sekali. Aku suka banget tekstur ayam dan bumbunya. Ada pedes-pedesnya dikit,"" ujar Ncess. Mereka menikmati ayam bakar dengan nasi hangat plus sambal petis. Lagi-lagi Ncess dan Gilang dibuat semangat makan. Selanjutnya mereka mencoba jengkol yang tampak menarik selera. ""Ini bumbu rendang gitu guys jengkolnya. Legit banget jengkolnya. Ngaco! Edun!"" tutur Ncess. Gilang juga punya pendapat sama. Ia menyukai teksturnya yang empuk. ""Jengkolnya seempuk itu guys,"" ujarnya. Kedua, mereka menjajall ragam cookies dari Victoria Bakery. Terdapat 3 varian rasa yaitu Lotus, Chocolate, dan Red Velvet. Gilang dan Ncess jatuh cinta dengan tekstur cookies yang renyah dan chewy. ""Dan nggak terlalu manis,"" kata Ncess. Puas makan yang manis-manis, mereka mencoba menu buatan Sini Kuramu. Ada spring roll udang dan ayam yang menarik selera dengan balutan rice paper. ""Dia ada saus wijennya juga. Isian dan sayurannya fresh banget,"" kata Ncess. Ia pun merekomendasikan menu ini untuk yang sedang diet. Selain spring roll sayur, Sini Kuramu juga punya spring roll isi buah segar. ""Ada kiwi, apel, mangga, strawberry,"" jelas Ncess. Cita rasa buah yang segar dan asam membuat Ncess dan Gilang jadi semangat! Nah, kalau penasaran dengan makanan enak lain yang bikin ngiler, jangan lupa tonton Bikin Laper. Tayang setiap hari pukul 17.00 WIB dI Trans TV. "
26,https://food.detik.com/info-sehat/d-5222594/7-makanan-untuk-asam-lambung-naik-agar-cepat-reda,7 Makanan untuk Asam Lambung Naik agar Cepat Reda," Refluks asam terjadi ketika ada aliran balik asam dari lambung ke kerongkongan. Penyakit asam lambung ini bisa menyebabkan komplikasi atau gejala yang mengganggu seperti mulas. Hal ini bisa diredakan dengan mengonsumsi makanan untuk redakan asam lambung. Dikutip dalam Healthline, salah satu alasan terjadinya asam lambung adalah karena sfingter esofagus bagian bawah (LES) melemah atau rusak. Biasanya LES menutup untuk mencegah makanan di perut naik ke kerongkongan. Makanan yang Anda makan mempengaruhi jumlah asam yang diproduksi perut Anda. Makan jenis makanan yang tepat adalah kunci untuk mengendalikan penyakit refluks asam atau penyakit refluks gastroesofageal (GERD), bentuk asam lambung yang parah dan kronis. Gerakan refluks yang terjadi akibat asam lambung yang menyentuh kerongkongan dan menyebabkan iritasi serta nyeri. Jika Anda memiliki terlalu banyak asam, Anda dapat memasukkan makanan khusus ini ke dalam makanan Anda untuk mengatasi gejala refluks asam.    Sayuran secara alami rendah lemak dan gula sehingga sayuran bisa menjadi makanan untuk asam lambung naik. Sayuran seperti kacang hijau, brokoli, asparagus, kembang kol, sayuran hijau, kentang dan mentimun dapat dinikmati untuk mengurangi asam lambung.  Jahe memiliki sifat anti inflamasi alami dan merupakan pengobatan alami untuk mulas serta masalah pencernaan lainnya. Anda bisa menambahkan parutan atau irisan jahe ke makanan atau smoothies. Anda juga dapat minum teh jahe untuk meredakan asam lambung dan GERD.  Makanan untuk asam lambung GERD bisa dikonsumsi saat terjadi maag. Oatmeal adalah makanan sarapan yang terbuat dari biji-bijian utuh dan sumber serat yang baik. Diet tinggi serat telah dikaitkan dengan risiko penurunan asam lambung yang lebih rendah. Selain oatmeal, pilihan serat lainnya adalah roti gandum dan nasi gandum.  Buah non citrus termasuk melon, pisang, apel dan pir cenderung tidak memicu gejala refluks dibandingkan dengan buah dengan rasa asam.  Daging tanpa lemak seperti ayam, kalkun, ikan dan makanan laut rendah lemak dapat mengurangi gejala refluks asam. Cobalah mengonsumsi makanan tersebut dengan cara dipanggang atau direbus.  Putih telur adalah pilihan yang bagus untuk makanan asam lambung atau GERD. Hindari kuning telur yang tinggi lemak dan dapat memicu gejala refluks.  Sumber lemak sehat antara lain adalah alpukat, kenari, biji rami, minyak zaitun, minyak wijen dan minyak bunga matahari. Kurangi asupan lemak jenuh dan lemak trans dan ganti dengan lemak tak jenuh yang lebih sehat.  Mulas adalah gejala umum dari refluks asam atau GERD. Anda mungkin akan mengalami sensasi terbakar di perut atau dada setelah konsumsi makanan jenis tertentu. GERD juga dapat menyebabkan muntah atau regurgitasi saat asam bergerak ke kerongkongan. Gejala lainnya termasuk:1. Batuk kering2. Sakit tenggorokan3. Kembung4. Bersendawa atau cegukan5. Kesulitan menelan6. Benjolan di tenggorokan Selain itu banyak orang dengan GERD atau asam lambung menemukan bahwa makanan tertentu bisa memicu gejala asam lambung. Tidak ada diet tunggal yang dapat mencegah semua gejala GERD dan makanan pemicu asam lambung pun berbeda setiap orang. Sehingga jika asam lambung naik, sebaiknya cobalah konsumsi 7 makanan untuk asam lambung yang telah dijelaskan tadi. "
27,https://food.detik.com/detiktv/d-5223491/youtuber-edho-zell-jualan-sei-sapi-gimana-rasanya,"Youtuber Edho Zell Jualan Se'i Sapi, Gimana Rasanya?",Youtuber kondang Edho Zell jualan kuliner se'i sapi. Gimana rasanya? Apakah rasanya bisa jadi trending? Tonton dulu video ini.
28,https://food.detik.com/info-sehat/d-5222575/7-buah-dengan-kadar-gula-tinggi-yang-perlu-dihindari-pelaku-diet,7 Buah dengan Kadar Gula Tinggi yang Perlu Dihindari Pelaku Diet," Buah dengan kadar gula tinggi ini sebaiknya tak dikonsumsi terlalu banyak oleh pelaku diet atau penderita diabetes. Apa saja daftarnya? Buah pada umumnya mengandung karbohidrat berbentuk gula yang disebut fruktosa, namun secara umum gula pada buah aman dikonsumsi. Hal ini disampaikan ahli gizi Jansen Ongko, seperti dikutip dari detikhealth. Baca Juga: Kandungan Gula Alami Pada Buah Juga Bisa Picu Diabetes dan Bikin Gemuk?  Ia mengatakan tidak ada batasan mengonsumsi buah-buahan untuk mereka yang sehat. Namun bagi penderita diabetes, beberapa buah tinggi gula sebaiknya tidak dikonsumsi karena bisa memicu kenaikan glukosa darah dengan cepat. Pun untuk mereka yang sedang berjuang turunkan berat badan, buah dengan kadar gula tinggi sebaiknya tak terlalu banyak dikonsumsi. Lalu apa saja buah tinggi gula? detikFood merangkum 7 daftar buah dengan kadar gula tinggi seperti dikutip dari Womens Health Mag (21/10): 1. Leci Tiap satu cup (190 gram) buah leci segar mengandung 125 kalori dan 29 gram gula. Karenanya buah renyah manis ini sebaiknya tak dikonsumsi terlalu banyak. Untuk zat gizi lainnya, leci mengandung sekitar 136 mg kalsium. Asupan ini memenuhi kebutuhan kalsium harian seseorang yang hanya 75 mg. 2. ManggaSiapa tak suka mangga? Buah tropis ini rupanya termasuk buah dengan kadar gula tinggi. Sekitar 165 gram mangga mengandung 99 kalori dan 23 gram gula. Tapi mangga punya banyak manfaat sehat lain, seperti tinggi vitamin A yang baik untuk kesehatan mata.  3. ApelBuah dengan kadar gula tinggi selanjutnya adalah apel. Satu buah apel ukuran sedang mengandung 25 gram karbohidrat dengan komposisi gula sebanyak 19 gram. Sementara kalorinya sekitar 95. Namun kamu tak perlu khawatir saat mengonsumsi apel karena buah ini juga tinggi serat. Bonus lainnya, apel tinggi kandungan antioksidan seperti vitamin C yang bagus untuk daya tahan tubuh. 4. Jeruk Satu buah jeruk ukuran besar mengandung sekitar 86 kalori dan 17 gram gula. Konsumsi jeruk baik untuk kesehatan karena tinggi vitamin C dan selenium. Untuk pilihan terbaik, konsumsilah jeruk dalam bentuk buah utuh, bukan jus apalagi jus instan. Mengonsumsi jeruk utuh memungkinkan tubuh juga mengasup serat sehingga bisa memperlambat penyerapan gula. 5. PirBuah dengan kadar gula tinggi selanjutnya adalah pir. Tiap satu buah pir ukuran sedang mengandung 17 gram gula dan 101 kalori. Buah renyah manis ini cocok jadi camilan siang hari karena kandungan gulanya yang tinggi bisa puaskan seleramu. Selain itu, pir juga kaya serat yang bisa mempertahankan rasa kenyang lebih lama. Jumlahnya mencapai 6 gram.  6. KiwiKiwi terkenal sebagai buah tinggi vitamin C. Selain itu, kiwi ternyata buah dengan kadar gula tinggi. Tiap 180 gram kiwi mengandung 16 gram gula dan 110 kalori. Untuk konsumsinya, makan 180 gram kiwi bisa mengasup tiga kali lipat kebutuhan vitamin C harian seseorang. Ada juga kandungan vitamin K yang bermanfaat untuk tubuh. 7. Nanas Setiap 165 gram nanas mengandung setidaknya 82 kalori dan 16 gram gula. Karenanya nanas juga termasuk buah dengan kadar gula tinggi. Meski begitu, nanas punya banyak manfaat sehat. Salah satu yang menonjol adalah tinggi vitamin C dan mangan. Nanas juga sangat baik dalam menghidrasi tubuh. Baca Juga: Tak Disangka! 7 Makanan dan Minuman Ini Ternyata Tinggi Gula "
29,https://food.detik.com/info-kuliner/d-5222082/pencinta-kopi-ini-bedanya-cappuccino-basah-dan-kering,"Pencinta Kopi, Ini Bedanya Cappuccino Basah dan Kering"," Cappuccino merupakan salah satu minuman kopi terpopuler di dunia. Campuran espresso dan susu ini ternyata punya berbagai versi racikan. Kafe dan coffee shop makin banyak bermunculan seiring bertambahnya penggemar kopi di dunia. Karenanya coffee shop juga mulai memberikan pelayanan lebih spesifik bagi pencinta atau penggemar kopi yang datang. Meskipun racikan kopi terdiri dari campuran espresso dan susu tetapi banyak istilah yang dipakai. Banyak pencinta kopi mulai memakai istilah yang terdengar rumit. Seperti triple low-fat, no foam latte, non-fat, extra foam, soy cappuccino, dan lain-lain. Tujuannya mendapatkan racikan kopi yang pas. Cappuccino merupakan racikan kopi khas Italia yang namanya terinspirasi dari warna jubah para pendeta. Minuman ini diracik dari 2 shot espresso diberi lapisan steamed milk dan selapis buih susu atau foam milk di atasnya. Kadang diberi taburan cokelat bubuk. Steamed milk berbeda dengan foamed milk. Steamed milk dihasilkan melalui proses mengepulkan susu melalui uap yang disembur dengan tekanan tinggi, sehingga menghasilkan buih-buih halus, memakai steam wand yang ada di mesin espresso. Sementara foamed milk atau frothed milk merupakan buih halus mengembang yang dihasilkan dari proses mengocok susu panas dengan milk frother atau pengocok susu elektronik. Saat dikocok kencang susu yang mengandung protein, gula dan lemak akan mengembang. Cappuccino pada dasarnya diracik dari perbandingan yang sama antara espresso, steamed milk dan foamed milk. Tetapi kini ada dua tipe cappuccino yang disukai penggemar kopi. Wet cappuccino dan dry cappuccino. Apa beda keduanya? Istilah 'wet' atau basah merujuk pada cappuccino rasanya lebih creamy karena memakai banyak steamed milk. Sementara 'dry' cappuccino memakai lebih banyak frothed milk. Cappuccino versi basah lebih manis karena rasa susu dominan dan mengurangi rasa pahit espresso. Sebaliknya dry cappuccino lebih terasa pahit espressonya. Buih pada kopi ini lebih tahan lama karena kering. Kedua jenis cappuccino ini bisa dibuat latte art buihnya. Tetapi kini beberapa coffee shop juga punya 'bone dry' cappuccino. Racikan cappuccino tanpa steamed milk hanya foam atau buih susu saja. Sebaliknya ada juga 'super wet cappuccino yang sebenarnya adalah latte, hanya espresso dan steamed milk saja. Minum kopi adalah selera pribadi. Yang terpenting, saat memesan kopi, tentukan dulu jenis susu. Mau susu full cream, non fat atau susu nabati seperti almond dan susu kedelai. Selanjutnya tentukan jenis pemanis, seperti sirup caramel, hazelnut, dan lain-lain. Barulah tambahan topping, seperti whipped cream, kayu manis bubuk atau marshmallow. "
30,https://food.detik.com/info-sehat/d-5222783/10-efek-minum-teh-dalam-kondisi-perut-kosong-di-pagi-hari,10 Efek Minum Teh dalam Kondisi Perut Kosong di Pagi Hari," Minum teh di pagi hari jadi kebiasaan banyak orang, namun hindari minum teh dalam kondisi perut kosong. Ini efeknya. Selain kopi, teh jadi minuman pengawal hari yang populer. Bahkan beberapa orang merasa kurang berenergi kalau belum menyesap teh di pagi hari. Minum teh pun baik untuk kesehatan karena teh mengandung sejumlah nutrisi penting. Salah satu senyawanya yaitu katekin, tinggi antioksidan yang baik untuk imunitas dan metabolisme tubuh. Teh juga terdiri dari beberapa jenis dengan profil aroma dan rasa berbeda. Ada teh hijau, teh putih, hingga teh hitam yang populer. Tapi siapa sangka minum teh di pagi hari ada aturannya. Para pakar kesehatan merekomendasikan tidak minum teh dalam kondisi perut kosong karena kurang baik untuk kesehatan. Dikutip dari Bold Sky (21/10), berikut 10 efek minum teh dalam kondisi perut kosong di pagi hari: 1. Aktivitas metabolisme tubuh terganggu   Kebiasaan langsung minum teh usai bangun tidur ternyata bisa mengganggu sistem metabolisme tubuh. Hal ini karena ketidakseimbangan senyawa asam dan alkalin dalam perut. 2. Erosi enamel gigiPernah dengar kalau minum teh bisa bikin gigi kamu kuning? Biasanya terjadi saat kamu minum teh hitam yang mengandung lebih banyak tanin. Selain itu, minum teh dalam keadaan perut kosong juga bisa menyebabkan erosi pada enamel gigi. Ini terjadi karena bakteri dalam mulut akan memecah gula, yang berakibat pada peningkatan kadar asam dalam mulut. Pada akhirnya kondisi ini memicu erosi enamel gigi.  3. Tubuh dehidrasiEfek lainnya adalah tubuh akan dehidrasi alias kekurangan cairan. Sebab teh bersifat diuretik dimana bisa menyingkirkan kandungan air dalam tubuh. Saat kamu bangun tidur, tubuh sebenarnya sudah dehidrasi karena kamu tidak minum hingga 8 jam. Nah, jika ditambah dengan minum teh yang sifatnya diuretik, bukan tidak mungkin tubuh akan alami dehidrasi parah. 4. KembungEfek minum teh dalam kondisi perut kosong selanjutnya adalah merasa kembung. Biasanya terjadi saat kamu minum teh dengan campuran susu. Adanya kandungan laktosa tinggi pada susu bisa mempengaruhi kondisi usus yang kosong. Hal inilah yang berakibat pada perut kembung, bergas, hingga alami sembelit. 5. Mual Hal lain yang sering dirasakan orang saat minum teh dalam kondisi perut kosong adalah mual. Ini karena aktivitas empedu terganggu. Efek sampingnya berupa mual dan perasaan gelisah. Baca Juga: Sering Minum Teh Saat Lockdown Bahayakan Kesehatan, Ini Kata Ahli  6. Lesu di pagi hariEfek minum teh dalam kondisi perut kosong selanjutnya adalah merasa lesu dan tak bersemangat di pagi hari. Biasanya terjadi saat kamu minum teh campur susu.  7. Teh hitam bikin kembungPencinta teh hitam perlu mewaspadai efek menenggak minuman favoritnya di pagi hari. Teh hitam bisa sebabkan kembung dan menurunkan selera makan kamu saat diminum dalam kondisi perut kosong. 8. Kafein memicu mualUntuk pencinta teh yang sensitif terhadap kafein juga bisa merasa mual dan pusing usai minum teh dalam kondisi perut belum terisi makanan apapun. 9. Resah Minum teh saat perut kosong akan berdampak buruk bagi tubuh. Efeknya berupa rasa cemas dan masalah terkait tidur. Jika kamu berencana untuk minum teh di pagi hari, minumlah setelah sarapan. 10. Penyerapan zat besi berkurangTeh hijau bisa menurunkan kemampuan tubuh dalam menyerap zat besi secara alami. Orang yang alami anemia sebaiknya tidak minum teh dalam keadaan perut kosong, karena bisa menurunkan tingkat penyerapan zat besi dalam tubuh dari sumber makanan lain. Baca Juga: Kalau Terlalu Banyak Minum Teh Hijau, Anda Bisa Alami 5 Efek Buruk Ini "
