,url,title,content
38,https://travel.detik.com/travel-news/d-5215594/acha-acha-india-menang-pantai-terbersih-dan-teraman-dunia,Acha-acha! India Menang Pantai Terbersih dan Teraman Dunia," India harus bangga setelah upayanya dalam menjaga lingkungan membuahkan hasil. Negara ini sekarang punya sertifikat Blue Flag. Apa itu? Blue Flag merupakan penghargaan yang diberikan oleh United Nations Environment Programme (UNEP), World Tourism Organization (UNWTO), FEE, dan IUCN kepada negara yang memiliki pantai-pantai terbersih, teraman, dan ramah lingkungan di dunia. Dikutip detikcom dari Financial Express, India adalah negara pertama yang memiliki sertifikat ini. Wah! India memasukkan delapan pantai dalam satu upaya untuk memenangkan penghargaan ini. Delapan pantai tersebut adalah Radhanagar di Kepulauan Andaman dan Nicobar, Pantai Emas di Puri Odisha, Rushikonda Andhra Pradesh, Kappad Kerala, Ghoghla, Diu Shivrajpur Gujarat dan Pantai Kasarkod, serta Padubidri Karnataka. Pantai-pantai di India sesuai dengan detail yang dibagikan oleh Kementerian Lingkungan Hidup, Kehutanan dan Perubahan Iklim. Prestasi itu harus diacungi jempol. ""Ini prestasi luar biasa. Tidak ada Blue Flag yang pernah diberikan untuk delapan pantai dalam satu upaya,"" ujar Menteri Serikat Pekerja, Prakash Javadekar. Sebenarnya ada beberapa negara yang sudah berhasil memiliki Blue Flag, seperti UEA, Jepang, dan Korea Selatan. Namun mereka mendapatkannya untuk beberapa pantai dalam kerangka waktu 5-6 tahun, tidak sekaligus seperti India. Pemerintah India bangga atas kehormatan ini. Pemerintah pusat berencana untuk melanjutkan program ini untuk 100 pantai serupa dalam 5 tahun ke depan. Obsesi ini dinyatakan oleh Kementerian Lingkungan Hidup, Hutan dan Perubahan Iklim India. India telah mulai mengembangkan pantai percontohan di pesisir tiap negara bagian pada tahun 2018. Kini upaya yang mereka lakukan sudah membuahkan hasil! Selamat ya India. "
39,https://travel.detik.com/travel-news/d-5214952/4-kain-tradisional-ini-sudah-jadi-warisan-budaya-lho,4 Kain Tradisional Ini Sudah Jadi Warisan Budaya Lho!," Indonesia memang dikenal sebagai negara yang kaya akan beragam budaya. Selain bahasa dan adat istiadat, keberagaman Indonesia juga terlihat dari warisan karya seninya. Wastra nusantara menjadi salah satu warisan seni budaya Indonesia yang kaya akan nilai dan filosofi. Seperti halnya karya seni batik yang saat ini popularitasnya telah mendunia ke mancanegara. Tak hanya batik, #DiIndonesiaAja ternyata ada banyak kain tradisional yang bisa kamu temukan tentunya dengan motif dan jenis kain berbeda. Bahkan, Kementerian Pendidikan dan Kebudayaan juga telah menetapkan 33 kain tradisional sebagai warisan budaya non bendawi di Indonesia. Penasaran kain tradisional apa saja yang termasuk warisan budaya Indonesia? Melansir berbagai sumber, berikut 4 kain tradisional warisan budaya Indonesia. Songket menjadi salah satu kain tradisional khas Melayu yang umumnya ditemukan di Indonesia, Brunei Darussalam, dan Malaysia. Di Indonesia, songket juga memiliki ragam motif yang berbeda, setiap daerah tentu memiliki ciri khas songket tersendiri. Bicara soal songket, Palembang menjadi salah satu daerah penghasil songket pertama di Indonesia. Konon, Songket Palembang telah ada sejak zaman Sriwijaya dan dikenakan oleh para bangsawan istana dan pejabat. Namun, saat ini songket Palembang lebih sering digunakan untuk perayaan pernikahan atau tradisi adat. Untuk jenis kain, songket Palembang menggunakan benang emas atau benang logam metalik sehingga menimbulkan efek berkilau. Gemerlap kilauan emas inilah yang memberikan nilai dan keindahan dari kain songket ini. Songket Palembang juga memiliki beragam motif diantaranya lepus, tawur, bungo pacik, tretes, dan limar. Selain Palembang, Kalimantan Barat juga punya songket unik dan cantik yang bernama songket Sambas. Sama seperti Songket Palembang, songket yang satu ini juga terbuat dari benang berwarna kuning keemasan. Tak hanya unik, untuk menghasilkan satu buah kain songket Sambas pun perlu dilakukan proses tahapan dalam menenun yakni, menarrau dan mengani. Menarrau merupakan proses menggulung benang ke dalam bilah-bilah peleting (bambu kecil tempat penyimpanan gulungan). Sementara itu mengani adalah proses penyusunan benang-benang ke dalam longsen (alat penyimpan susunan benang). Tak hanya itu, songket Sambas juga punya banyak motif seperti pucuk rebung, tabur melati, serong pita berbunga, tabur bintang, serong parang manang, bunga tanjung, bunga malek, dan lainnya. Banyak yang mengatakan motif-motif tersebut merupakan refleksi dari nilai-nilai budaya masyarakat Sambas. Nusa Tenggara Timur tak hanya menyimpan segudang destinasi wisata yang indah, namun juga memiliki jenis kain tradisional yang unik dan cantik. Baru-baru ini, banyak masyarakat yang mulai menggemari tenun ikat Sumba. Bukan hanya punya motif yang eksotis, proses pembuatan tenun ikat Sumba ternyata juga memerlukan waktu yang cukup lama sekitar 2 hingga 3 bulan. Bahkan, untuk ukuran kain yang besar memerlukan waktu sampai 3 tahun lamanya. Pasalnya, untuk membuat satu helai kain memerlukan 42 tahapan Satu hal unik lainnya, tenun ikat Sumba ternyata terbuat dari tumbuhan, termasuk untuk proses pewarnaanya. Umumnya, proses pembuatan dimulai dari meracik tumbuhan sebagai bahan pewarna, proses pengikatan daun gewang, dan dilanjut proses penjemuran. Sama seperti kain tradisional lainnya, tenun ikat Sumba juga punya motif yang beragam dengan makna yang berbeda. Seperti halnya motif burung yang menyimbolkan persatuan, motif kuda yang berarti kebangsawanan, atau motif buaya yang melambangkan kekuatan. Siapa sangka kalau di Indonesia ada jenis kain tradisional yang terbuat dari kulit kayu? Di Kalimantan, pakaian yang terbuat dari kain kulit kayu menjadi salah satu pakaian adat yang sering digunakan dalam acara adat, khususnya masyarakat Rampi. Pada dasarnya, ada beberapa jenis kayu yang bisa digunakan sebagai bahan pembuatan kain kulit kayu antara lain pohon nunu towula, nunu lero, nunu wiroe, nunu malo/mao, nunu tea tanoher, dan nunu ivo. Sementara itu, untuk pewarna baju menggunakan pohon ula vua, lumpur, dan kayu letuhu. Selain untuk pakaian sehari-hari, pakaian kulit kayu juga digunakan dalam berbagai kegiatan upacara adat. Adapun beberapa pakaian kulit kayu di antaranya kemeja, celana, dan topi. Pakaian kulit kayu juga memiliki motif antara lain tanduk kerbau, tumbuh-tumbuhan, bunga, geometris dan lainnya. Nah, itulah ragam kain tradisional yang jadi warisan budaya Indonesia. Adapun semua ragam kain tersebut dapat ditemukan #DiIndonesiaAja dan tentunya dengan motif yang cantik dan eksotis."
40,https://travel.detik.com/travel-news/d-5215596/lagi-pria-terbang-pakai-jetpack-terlihat-di-langit-los-angeles,"Lagi, Pria Terbang Pakai Jetpack Terlihat di Langit Los Angeles"," Seorang pria tak dikenal terlihat terbang dengan jetpack di dekat bandara Internasional Los Angeles. Ini bukan insiden pertama yang terjadi di LA. Dikutip dari CNN oleh detikcom, Jumat (16/10/2020), kru pesawat menemukan seorang pria terbang pakai jetpack pada ketinggian 6.000 kaki. FAA mengatakan telah memberi tahu lembaga penegak hukum setempat dan sedang menyelidiki insiden ini lebih lanjut. ""Seorang awak China Airlines melaporkan melihat sesuatu yang tampak seperti seseorang dalam jetpack pada perkiraan ketinggian 6.000 kaki, sekitar tujuh mil barat laut Bandara Internasional Los Angeles,"" kata FAA dalam sebuah pernyataan. Kejadian ini merupakan kedua kalinya di Los Angeles. Penampakan yang sama dari seorang pria dalam jetpack di dekat bandara Los Angeles telah dilaporkan ke FAA pada awal September lalu. Penerbangan American Airlines lah yang pertama kali melaporkan kejadian ini di atas ketinggian pesawat 3.000 kaki. Awak pesawat mengatakan bahwa pria itu berada sekitar 30 yard atau 27 meter dari pesawat.   Tak hanya awak pesawat American Airlines yang menyaksikan kejadian tak biasa ini, sekitar 10 menit kemudian, pesawat lain juga melihatnya. FBI kini sedang menyelidiki kedua insiden tersebut. ""FBI melakukan kontak dengan FAA dan sedang menyelidiki beberapa laporan, menurut saksi mata, tampak seperti seseorang di dalam jetpack dekat LAX (Bandara Internasional Los Angeles) yang hari ini dilaporkan oleh awak China Airlines,"" kata juru bicara Kantor Lapangan FBI Los Angeles, Laura Eimiller, Rabu (14/10). Menurut komunikasi audio antar kontrol lalu lintas udara, petugas penerbangan Amerika dan maskapai penerbangan Jetblue pada insiden pertama pada 1 September 2020 yang diperoleh CNN, pengatur lalu lintas udara memperingatkan penerbangan jetblue untuk berhati-hati. ""Hati-hati, orang dengan jetpack dilaporkan berada di 300 yard (274 meter) arah selatan (dari LA)."" Setelah menerima instruksi tersebut, pilot menjawab. ""Hanya di LA."""
41,https://travel.detik.com/travel-news/d-5215586/kunjungan-wisman-ke-dki-jakarta-anjlok-hingga-99,Kunjungan Wisman ke DKI Jakarta Anjlok hingga 99%," Pandemi virus Corona membuat sektor pariwisata terdampak signifikan. Khusus wisata DKI Jakarta, kunjungan turis asing anjlok hingga 99 persen.  Pelaksana Tugas Kadisparekraf DKI Jakarta, Gumilar Ekalaya, menuturkan bahwa pemerintah tengah mencari titik tengah agar pariwisata bisa bangkit kembali tanpa mengesampingkan kesehatan masyarakat. Sebab, kunjungan wisatawan mancanegara telah turun drastis. ""Grafik kunjungan wisman dan wisnus selama pandemi kita lihat untuk wisman hampir 99 persenlah ya anjlok dari mulai bulan April sampai sekarang,"" kata Gumilar dalam Webinar MICE & Tourism Indonesia Pasca Pandemi, Kamis (15/10/2020). Kondisi kunjungan wisatawan nusantara juga mengalami penurunan semenjak dilakukan kebijakan Pembatasan Sosial Berskala Besar (PSBB) yang menyebabkan 20 destinasi DKI Jakarta. Namun seiring adanya PSBB transisi kunjungan wisnus berangsur membaik. ""Tapi untuk wisnus masih terlihat ada tren kenaikan pada bulan Juli Agustus, dan juga untuk tingkat hunian kamar di bulan Juni sudah mulai ada kenaikan sedikit,"" kata Gumilar.  Industri perhotelan pun mengeluh akan hal ini. Saat PSBB diperketat semua hotel hanya melayani room service. Sudah begitu berbagai fasilitas hotel masih ditutup. ""Seluruh fasilitas hotel masih ditutup untuk sekarang. Kita juga masih sangat hati-hati ya seperti fasilitas di hotel seperti kolam renang, spa itu kita masih belum izinkan memang,"" ujar Gumilar. Namun, Gumilar menuturkan kini industri perhotelan telah terbantu karena adanya stimulus dari Kementerian Pariwisata. Rencananya, perhotelan dan restoran akan mendapatkan total stimulus 3,3 triliun dari Kemenparekraf. ""Ke depan ada stimulus sekitar Rp 3,3 triliun dari Kemenpar untuk hotel dan restoran Indonesia, dimana Jakarta mendapatkan sekitar Rp 511 M untuk tahun 2020,"" dia menambahkan. "
42,https://travel.detik.com/travel-news/d-5215575/katanya-risiko-tertular-virus-corona-di-pesawat-lebih-rendah,"Katanya, Risiko Tertular Virus Corona di Pesawat Lebih Rendah"," Bepergian di tengah pandemi virus Corona membuat traveler cemas. Tapi, data menunjukkan kalau traveling dengan pesawat memiliki risiko tertular COVID-19 lebih rendah dibanding moda lain. Diberitakan Lonely Planet, Jumat (16/10/2020) International Air Transport Association (IATA) atau Asosiasi Transportasi Udara Internasional mengklaim bahwa sangat kecil angka yang menunjukkan infeksi COVID-19 di udara. Klaim itu mewakili sekitar 290 maskapai penerbangan di seluruh dunia. Mereka mengatakan bahwa 1,2 miliar penumpang telah melakukan perjalanan dengan pesawat sejak awal tahun. Sejauh ini hanya ada 44 kasus COVID-19 yang dilaporkan di mana transmisi diduga terkait dengan penerbangan. ""Itu satu kasus untuk setiap 27 juta pelancong. Kami menyadari bahwa ini mungkin perkiraan yang terlalu rendah, tetapi bahkan jika 90% kasus tidak dilaporkan, itu akan menjadi satu kasus untuk setiap 2,7 juta pelancong,"" kata Dr David Powell, penasihat medis IATA. ""Kami pikir angka ini sangat meyakinkan. Selain itu, sebagian besar kasus yang dipublikasikan terjadi sebelum pemakaian penutup wajah dalam penerbangan menjadi meluas,"" Powellmenambahkan.  Menurut publikasi penelitian yang dilakukan oleh Airbus, Boeing, dan Embraer mengungkapkan laporan simulasi rinci yang mengonfirmasi bahwa sistem aliran udara pesawat mengontrol pergerakan partikel di kabin membatasi penyebaran virus. Mereka mengatakan bahwa sistem aliran udara pesawat, filter HEPA, penghalang alami sandaran kursi, aliran udara ke bawah dan tingkat pertukaran udara yang tinggi secara efisien mengurangi risiko penularan penyakit di pesawat dalam waktu normal. Udara dipertukarkan 20-30 kali per jam di dalam sebagian besar pesawat yang sangat menguntungkan dibandingkan dengan ruang kantor rata-rata (rata-rata dua hingga tiga kali per jam) atau sekolah (rata-rata 10-15 kali per jam). Laporan tersebut menunjukkan bahwa penambahan pemakaian masker di tengah kekhawatiran pandemi menambah lapisan perlindungan ekstra yang lebih jauh dan signifikan. Tentu saja ini semakin membuat duduk di dekat kabin pesawat lebih aman daripada kebanyakan lingkungan dalam ruangan lainnya. Pemakaian masker di pesawat direkomendasikan oleh IATA pada bulan Juni dan merupakan persyaratan umum di sebagian besar maskapai penerbangan. ""Kebijakan dalam pemrosesan tanpa kontak, antrian terkelola, pengurangan pergerakan di kabin, dan layanan on board yang disederhanakan adalah di antara beberapa langkah yang diambil industri penerbangan untuk tetap terbang dengan aman,"" kata Powell. Walau begitu, traveler perlu mempertimbangkan kembali untuk bepergian di tengah pandemi Corona. Sesuai anjuran pemerintah, untuk tetap di rumah adalah pilihan yang bijak demi keamanan keluarga. "
43,https://travel.detik.com/travel-news/d-5215573/cerita-beruang-yang-jadi-model-di-rusia,Cerita Beruang yang Jadi Model di Rusia," Seekor beruang coklat dewasa menjadi model dan viral di media sosial. Posenya tak kalah saat berpadu dengan model profesional lho. Kok bisa ya? Namanya Stepan, beruang coklat itu berusia 28 tahun. Dia dulunya dibuang oleh ibunya dan diadopsi oleh sepasang manusia bernama Svetlana dan Yuriy Panteleenko. Dibesarkan oleh manusia sejak berusia 3 tahun dengan penuh kasih sayang, Stepan pun menjadi ramah dan bersahabat terhadap manusia. Karena itulah seorang fotografer asal Moskow bernama Mila Zhdanova punya serangkain ide menarik untuk menjadikan Stephan sebagai modelnya. Mia memulai idenya dengan membuat serangkaian adegan yang terinspirasi dari fantasi yang menampilkan Stepan berpose bersama para model dalam pakaian tradisional Rusia. Dan juga ada rangkain pose Stephan yang terinsipirasi dari dongeng-dongeng Disney.  [Gambas:Instagram]  Selama 5 tahun Mila telah bekerjasama dengan beruang bertubuh besar ini. Puluhan model dia terbangkan dari berbagai negara untuk berfoto dengan Stephan. Hasil fotonya pun membuat siapapun terpukau. Dalam wawancaranya Mila mengatakan bahwa dia sangat menikmati bekerjasama dengan Stephan karena dia gampang diatur. Ini adalah salah satu efek dari kehebatan orangtua adopsinya yang membesarkan Stephan dengan kasih sayang. ""Stepan sangat ramah berkat perhatian dan cinta pelatihnya. Saya telah bekerja dengan model dari Thailand, Australia, Jerman, Inggris, dan Israel yang semuanya terbang untuk bekerja dengannya,"" kata Mila seperti yang dilansir detikcom dari Daily Mail. Pengambilan gambar pun dilakukan di Moskow selama beberapa bulan. Stephan pun hanya dapat bekerja sekitar setengah jam dalam satu waktu. Selain menampilkan karyanya, Mila ternyata punya pandangan lain terhadap proyek barunya ini. Dia ingin menampilkan sis lain Rusia kepada dunia. ""Orang-orang memiliki beberapa gagasan stereotip tentang Rusia. Mereka mengira kami tidak pernah tersenyum dan ada beruang yang berjalan di jalan. Kami memang punya beruang tapi saya ingin menunjukkan di foto saya bahwa kami memang tersenyum. Syuting dengan Stepan sangat menyenangkan dan saya harus menahan emosi saya,"" katanya. Hasil jepretan Stephan sebagai model bisa traveler lihat di dalam akun Instagram Mila. Ragam pose beruang ini gemas dan membuat kita takjub. Keren! "
