,url,title,content
23,https://food.detik.com/info-kuliner/d-5218744/bikin-laper-ada-gurame-thailand-hingga-mango-chicken-enak-di-sini,Bikin Laper! Ada Gurame Thailand hingga Mango Chicken Enak di Sini," Punya racikan saus yang khas, hidangan khas Thailand yang enak bisa dicicip di restoran ini. Mulai dari ikan gurame sampai mango chicken yang gurih segar. Masih dalam petualangan kulineran seru bersama tim Bikin Laper, duo jawara makan Tara Budiman dan Gilang Samiadji kembali menelusuri tempat-tempat makan enak. Baca Juga: Bikin Laper! Nikmatnya Sapi Crispy dan Baby Cumi Saus Madu  Dalam episode terbaru Bikin Laper, mereka berdua kompak memilih Frestro Asia Restaurant di Jakarta Pusat, sebagai tempat makannya. Restoran ini menyajikan berbagai jenis hidangan khas Thailand yang autentik. Pertama mereka mencoba Mango Chicken (Rp 67.000). Hidangan ayam goreng tepung dengan saus irisan mangga segar ini punya paduan rasa yang gurih dan segar. ""Perpaduan yang menarik, ayamnya kripsi dan gurih tapi ada rasa seger mangga dan bawangnya. Tapi bagian dalamnya tetap juicy apalagi jika disantap dengan nasi putih,"" ungkap Tara. ""Gak ngerti lagi kenapa rasanya seenak itu, tekstur daging empuk dan juicy. Bagian luarnya krispi gurih, tapi mangganya bikin sensasi yang baru,"" puji Gilang. Lanjut ke makanan kedua mereka pesan Sup Tomyum (Rp 40.000) yang kaya rempah. Kali ini Gilang dan Tara memutuskan untuk menggabungkan sup tom yum dengan mango chicken. ""Coba kita kolaborasi sup tomyum dengan ayam dan nasi putih. Cita rasanya mampu membuat lambung aku geger. Seger pedes jadi perpaduan yang epik,"" puji Tara disela-sela suapannya. Begitu juga dengan Gilang yang kewalahan menyantap enaknya sup tomyum dengan nasi putih hangat. ""Icip kuahnya aja nih bikin langsung semangat makan. Ini enak banget, rasanya seger karena ada rasa tom yumnya pokoknya ini perfect banget rasanya,"" jelas Gilang. Terakhir mereka mencoba menu andalan di sini, yaitu ada Ikan Gurame Saus Thailand (Rp 110.000). Ikan gurame disajikan dalam porsi yang besar dengan potongan daging yang royal. ""Makan ikan gurame di sini pastik gak nyesel. Guramenya ini fresh dan saus Thailand nya ini dominan banget. Bikin laper!"" jelas Tara. ""Rasanya itu asam, manis, dan sedikit pedas untuk ikan guramenya. Ini pertama kalinya aku makan ikan gurame dengan saus Thailand. Daging guramenya juga bener-bener chrunchy dan tebel banget, apalagi kalau dipakai kuah tom yum,"" pungkas Gilang. Selain icip-icip makanan khas Thailand, tim Bikin Laper juga menelusuri banyak kuliner lainnya. Mulai dari makanan tradisional sampai yang kekinian. Untuk itu saksikan terus acara Bikin Laper yang tayang di Trans TV, setiap hari pukul 17.00. Baca Juga: Bikin Laper! Cicip Bebek Bakar Daun Pisang dan Tengkleng Kambing "
24,https://food.detik.com/info-sehat/d-5218377/5-manfaat-mie-shirataki-makanan-rendah-kalori-dan-cocok-untuk-yang-lagi-diet,"5 Manfaat Mie Shirataki, Makanan Rendah Kalori dan Cocok untuk yang Lagi Diet"," Mie shirataki saat ini sedang viral dikonsumsi oleh masyarakat yang sedang melakukan diet. Mie ini bentuknya putih panjang dan sering juga disebut mie konjac. Hal ini karena mie terbuat dari glukomanan, sejenis serat yang berasal dari umbi tanaman konjac atau konnyaku. Konjak banyak tumbuh di Jepang, China, dan Asia Tenggara. Mie shirataki mengandung sangat sedikit karbohidrat yang dapat dicerna. Tetapi sebagian besar karbohidratnya berasal dari serat glukomanan. Dalam sejumlah penelitian serat glukomanan terbukti berperan membantu menurunkan berat badan. Shirataki dalam bahasa Jepang artinya air terjun putih. Hal ini lantaran shirataki digambarkan tampilannya yang transparan. Mie ini dibuat dengan mencampurkan tepung glukomanan dengan air biasa dan sedikit air jeruk nipis. Tujuannya untuk membantu mie menahan bentuknya. Campuran tersebut direbus kemudian dibentuk menjadi mie atau potongan mirip nasi. Mie Shirataki mengandung banyak air. Faktanya, mie shirataki mengandung sekitar 97% air dan 3% serat glukomanan. Mie ini juga sangat rendah kalori dan mengenyangkan. Kalori mie yang terasa mirip rumput laut ini di bawah 100 kalori. Di Indonesia, mie Shirataki dapat ditemukan di toko online ataupun minimarket. Mie dapat ditemukan dalam bentuk mentah atau instan. Harganya jika dalam bentuk mie instan jauh lebih mahal. Namun dengan melihat manfaat mie shirataki seperti bagus untuk diet dan untuk pola hidup sehat, Anda akan mengonsumsi mie tersebut. Glukomanan adalah serat yang sangat kental. Glukomanan dapat menyerap hingga 50 kali beratnya dalam air, seperti yang tercermin dari kandungan air mie shirataki. Mie ini membantu Anda merasa kenyang dan menunda penyerapan nutrisi ke aliran darah. Selain itu, serat kental berfungsi sebagai prebiotik, yang dapat memberi makan bakteri yang hidup di usus besar Anda. Di usus besar Anda, bakteri memfermentasi serat menjadi asam lemak rantai pendek. Hal ini berfungsi melawan peradangan, meningkatkan fungsi kekebalan dan memberikan manfaat kesehatan lainnya. Sebuah penelitian pada manusia baru-baru ini memperkirakan bahwa memfermentasi glukomanan menjadi asam lemak rantai pendek menghasilkan satu kalori per gram serat. Karena mie shirataki 4 ons (113 gram) biasanya mengandung sekitar 1-3 gram glukomanan. Mie shirataki bisa dapat membantu menurunkan berat badan. Serat kental mie menunda pengosongan perut, jadi Anda tetap kenyang lebih lama dan akhirnya makan lebih sedikit. Nah hal ini sangat baik untuk Anda yang sedang diet. Selain itu, memfermentasi serat menjadi asam lemak rantai pendek dapat merangsang pelepasan hormon usus yang meningkatkan rasa kenyang. Satu review dari tujuh studi menemukan bahwa orang yang mengonsumsi glukomanan selama 4-8 minggu kehilangan berat badan 3-5,5 pon (1,4-2,5 kg). Dalam studi lain, orang dengan kelebihan berat badan yang mengonsumsi glukomanan setiap hari selama delapan minggu kehilangan 5,5 pon (2,5 kg) tanpa makan lebih sedikit atau mengubah kebiasaan olahraga mereka. Glukomanan telah terbukti membantu menurunkan kadar gula darah pada penderita diabetes dan resistensi insulin. Karena serat kental menunda pengosongan perut, kadar gula darah, dan insulin meningkat lebih bertahap karena nutrisi diserap ke dalam aliran darah Anda. Dalam sebuah penelitian, penderita diabetes tipe 2 yang mengonsumsi glukomanan selama tiga minggu mengalami penurunan fruktosamin yang signifikan, yang merupakan penanda kadar gula darah. Beberapa penelitian juga menunjukkan bahwa glukomanan dapat membantu menurunkan kadar kolesterol. Para peneliti mencatat bahwa glukomanan meningkatkan jumlah kolesterol yang diekskresikan dalam tinja sehingga lebih sedikit yang diserap kembali ke aliran darah Anda. Sebuah tinjauan dari 14 studi menemukan bahwa glukomanan menurunkan kolesterol LDL jahat dengan rata-rata 16 mg / dL dan trigliserida dengan rata-rata 11 mg/dL. Banyak orang mengalami sembelit kronis atau jarang buang air besar. Glukomanan pada mie shirataki telah membuktikan manfaat yang efektif untuk sembelit pada anak-anak dan orang dewasa. Dalam sebuah penelitian, sembelit parah berhasil diobati pada 45% anak yang memakai glukomanan. Untuk orang dewasa, suplemen glukomanan meningkatkan frekuensi buang air besar, tingkat bakteri usus yang menguntungkan, dan produksi asam lemak rantai pendek. Efek Samping Bagi sebagian orang, glukomanan dalam mie shirataki dapat menyebabkan masalah pencernaan ringan, seperti tinja encer dan perut kembung. Namun, perlu dicatat bahwa glukomanan telah ditemukan aman pada semua dosis yang diuji dalam penelitian. Namun demikian, seperti halnya dengan semua serat, yang terbaik adalah memasukkan glukomanan ke dalam makanan Anda secara bertahap. Selain itu, glukomanan dapat mengurangi penyerapan obat tertentu, termasuk beberapa obat diabetes. Untuk mencegahnya, minumlah obat Anda setidaknya satu jam sebelum atau empat jam setelah makan mie shirataki. Memasak mie Shirataki mungkin agak sulit pada awalnya. Mie itu dikemas dalam cairan berbau amis, yang berasal dari akar konjak. Oleh karena itu, penting untuk membilasnya dengan baik selama beberapa menit dengan air bersih yang mengalir. Hal ini akan menghilangkan sebagian besar bau. Anda juga harus memanaskan mie dalam wajan selama beberapa menit tanpa tambahan lemak. Langkah ini menghilangkan kelebihan air dan memungkinkan mie memiliki tekstur yang lebih mirip mie. Jika terlalu banyak air yang tersisa, mereka akan menjadi lembek. 2 sdm minyak sayur10 butir bawang merah, iris tipis5 siung bawang putih, cincang100 g daging sapi shabu-shabu2 butir telur, kocok1 sdm saus tiram1 sdm kecap manis1/2 sdt merica bubuk1 sdt garam50 g wortel,m potong kecil panjang50 g sawi hijau, potong2 sdm daun bawang iris kasar1 sdm daun seledri iris1 bungkus (500 g) shirataki1 sdm minyak wijen Tiriskan mie shirataki. Rebus sebentar lalu tiriskan kembali. Gunting-gunting shirataki agar pendek dan mudah dimakan. Tumis bawang merah dan bawang putih hingga layu dan wangi. Masukkan daging, aduk-aduk hingga berubah warna. Tuangkan telur kocok, aduk hingga matang. Tambahkan saus tiram, kecap manis, merica dan garam lalu aduk rata. Masukkan shirataki, sawi, wortel, aduk hingga layu. Tambahkan daun bawang dan seledri serta minyak wijen. Aduk sebentar. Angkat dan sajikan hangat. Sajian untuk 4 porsi."
25,https://food.detik.com/info-kuliner/d-5218374/mulia-kepala-sekolah-ini-rela-jadi-pengantar-makanan-untuk-bantu-sekolahnya,Mulia! Kepala Sekolah Ini Rela Jadi Pengantar Makanan Untuk Bantu Sekolahnya," Demi membantu para murid dan sekolahnya, kepala sekolah ini rela menjadi pengantar makanan. Kumpulkan dana agar sekolahnya tetap berjalan. Tak hanya mengajarkan nilai-nilai akademik saja, tapi kepala sekolah yang satu ini rela melakukan apapun untuk membantu sekolah hingga murid-muridnya. Baca Juga: Setiap Hari Kepala Sekolah Ini Memasak Untuk Seluruh Muridnya  Dikutip dari World of Buzz (18/10), kepala sekolah bernama Haji Adeil Mat asal Kuala Selangor, Malaysia ini viral setelah kisahnya tersebar di media sosial. Adeil merupakan kepala sekolah dari Sekolah Agama Menengah (SAM). Ia memutuskan untuk menjadi pengantar makanan di salah satu aplikasi ojek online, guna membantu menghimpun dana untuk pembuatan aula di sekolahnya. Awalnya Adeil tak menyangka bahwa kisahnya ini akan menarik perhatian banyak orang. ""Ketika foto saya viral di internet, banyak orang yang bertanya sampai saya tidak bisa menjawabnya satu per satu. Saya sengaja menjadi pengantar makanan agar orang-orang ikut berdonasi membantu sekolah kami, meski sumbangannya hanya sebesar RM 5 (Rp 17.000),"" ungkap Adeil. Sekolahnya membutuhkan sekitar RM 362,000 (Rp 1,2 miliar) untuk membangun aula serbaguna bagi para murid. Namun sampai sekarang pihak sekolah baru berhasil mengumpulkan uang sebanyak RM 167,000 (Rp 591 juta). Rencana pembangunan aula yang semula dijadwalkan di tahun ini, harus ditunda setelah pandemi Corona menyerang. Tapi meski begitu, Aedil tetap semangat mencari uang tambahan dengan mengantarkan makanan. ""Terlepas dari semuanya, kami sangat bersyukur sudah mendapatkan izin untuk mendirikan aula ini Insya Allah ketika semuanya selesai, aula ini akan memberikan banyak manfaat untuk 825 murid di sekolah kami,"" jelas Aedil. Karena sekolahnya tak memiliki fasilitas aula, selama ini para muridnya berkumpul untuk melakukan berbagai aktivitas di masjid yang ada di sana. Nantinya aula ini akan digunakan sebagai tempat untuk berlatih ekskul, olahraga sampai acara lainnya. Banyak netizen yang merasa tersentuh dengan aksi Aedil sebagai kepala sekolah. Banyak juga yang tertarik untuk ikut berdonasi membantu Aedil mengumpulkan uang. ""Tersentuh sekali mendengar perjuangan kepala sekolah yang satu ini. Rela menjadi pengantar makanan demi memberikan fasilitas terbaik bagi para muridnya,"" komen salah satu netizen. ""Semoga Pak Aedil sehat selalu dan semua pekerjaannya dilancarkan. Kepala sekolah seperti ini lah yang seharusnya menjadi panutan bagi kita semua,"" puji netizen lainnya. Aedil bukan satu-satunya pendidik yang rela melakukan apapun demi mendukung murid-muridnya. Sebelumnya seorang guru asal Malaysia bernama Harry Yanti Bikal, viral setelah ia rela menggendong kulkas untuk para muridnya melalui sungai hingga hutan. Baca Juga: Susuri Hutan dan Sungai, Guru Ini Gendong Kulkas Untuk Muridnya "
26,https://food.detik.com/info-sehat/d-5218236/sudah-sarapan-tapi-masih-lapar-ini-5-penyebabnya,Sudah Sarapan Tapi Masih Lapar? Ini 5 Penyebabnya," Banyak orang masih merasa lapar meskipun baru saja sarapan. Hal ini disebabkan oleh beberapa kesalahan yang dilakukan saat memilih menu sarapan. Jadwal makan harian dibagi menjadi tiga, sarapan, makan siang dan makan malam. Tetapi sarapan dianggap paling penting karena merupakan saat mengisi ulang energi setelah 6-8 jam beristirahat atau tidur. Ada orang yang makan sekaligus banyak saat sarapan tetapi beberapa saat merasa lapar kembali. Ternyata hal ini disebabkan oleh kesalahan dalam memilih menu sarapan. Makanan tinggi gula, kurang serat dan kurang lemak serta protein bisa jadi penyebabnya. Hal tersebut bisa memicu kenaikan berat badan. Karena merasa lapar maka orang makan lagi dengan porsi mengenyangkan. Padahal jenis makanan sarapan perlu dipilih tepat dan tidak perlu terlalu kenyang. Karena sebelum waktu makan siang bisa ngemil sedikit makanan lagi. Dilansir oleh eatingwell (29/9), Lisa Valente, M.S, R.D mengidentifikasi beberapa penyebab orang cepat merasa lapar meski baru sarapan. Mungkin saja kamu mengalami dan melakukan hal-hal berikut ini saat sarapan. Menu sarapan umumnya mengandung karbohidrat seperti roti, nasi, ketupat atau mie. Meskipun mengenyangkan tetapi tidak bertahan lama. Kamu perlu mengasup karbohidrat kompleks yang lebih kaya serat dan mengenyangkan. Selain itu menurut riset kamu perlu makan 30 g protein saat sarapan. Karena protein memberi rasa kenyang lebih lama. Protein bisa didapatkan dari telur, keju, yogurt, daging atau kacang-kacangan. Baik karbohidrat dan protein harus seimbang asupannya. Gara-gara takur gemuk dan berat badan naik orang sering menghindari lemak. Lemak memang lebih besar kalorinya daripada protein dan karbohidrat. Tetapi lemak perlu proses cerna lebih lama sehingga lebih mengenyangkan. Untuk mencukupi kebutuhan lemak, kamu perlu memilih lemak baik sebagai asupan sarapan. Seperti alpukat, selai kacang, putih telur goreng atau rebus bisa jadi pilihan makanan berlemak sehat untuk sarapan.  3. Kurang asupan serat Seperti protein dan lemak, serat akan memberi rasa kenyang yang memuaskan. Jika kamu makan rotitawar putih yang dipanggang dan diolesi selai kamu akan cepat lapar. Coba ganti dengan roti tawar whole wheat atau brown bread. Banyak sekali buah dan sayuran kaya serat serta berbagai bijian sehat untuk sarapan. Misalnya sereal dari gandum utuh, oatmeal, buah-buahan utuh, biji-bijian dan kacang-kacangan. Biji chia bisa jadi pilihan sehat untuk dimakan bersama potongan buah segar. 4. Makanan tinggi gula Jika kamu suka makanan manis untuk sarapan seperti cinnamon roll, muffin, atau berbagai roti manis, sudah dapat dipastikan kamu cepat lapar. Karena makanan tersebut mengandung gula buatan yang tinggi kalori. Meskipun enak di mulut, kandungan gula dalam makanan manis akan cepat diserap tubuh dan membuat gula darah naik. Kamu bisa mengganti dengan sarapan roti gandum dengan telur, atau sereal gandum utuh dengan yogurt tawar dan potongan buah segar. 5. Porsi makanan terlalu kecil Karena ingin mengurangi asupan kalori bukan berarti semua porsi makanan termasuk sarapan dikurangi hingga sangat kecil. Jangan sibuk menghitung kalori tetapi perhatikan porsi wajar dan jenis menu sarapan. Cobalah menambah sedikit porsi makan hingga perut terasa hampir kenyang. Jika perut terlalu lapar di pagi hari akan mendorong kamu makan lebih banyak di siang hari. Kamu masih bisa ngemil buah segar atau kacang-kacangan sebelum makan siang, jika perlu."
27,https://food.detik.com/info-kuliner/d-5218381/nasi-goreng-hingga-omelette-ini-5-sarapan-enak-serba-durian,"Nasi goreng hingga Omelette, Ini 5 Sarapan Enak Serba Durian"," Selain enak disantap langsung, ternyata durian juga populer sebagai menu sarapan di beberapa negara. Mulai dari nasi goreng sampai omelet. Masuk ke dalam buah kontroversial karena aromanya yang menyengat, durian tetap eksis dan memiliki banyak penggemar terutama di wilayah Asia Tenggara. Buah berduri tajam yang satu ini selain diubah menjadi dessert, sering juga dimasak menjadi menu sarapan yang cukup unik tapi rasanya tetap enak. Seperti nasi goreng dengan sambal belacan dan topping buah durian di Penang. Lalu ada juga nih burrito yang isinya durian dan cukup populer di Vietnam. Dilansir dari berbagai sumber, berikut lima menu sarapan durian yang enak. Baca Juga: Rekor Durian Termahal di Dunia, Satu Buah Harganya Rp 681 Juta   1. Nasi Goreng Durian Tak hanya enak dimakan langsung, beberapa orang kreatif menciptakan durian dengan campuran nasi goreng dan ditambah dengan sambal belacan yang pedas. Pada awal Juli lalu muncul kreasi nasi goreng durian sambal belacan di Penang, Malaysia. Menu sarapan populer di Asia ini jadi viral karena menggabungkan durian sebagai topping nasi goreng yang gurih pedas. Di tempat makan Ah Chong Fried Rice, beberapa food vlogger menyantap nasi goreng ini. Menurut mereka rasanya cukup enak, dengan kombinasi creamy legit durian Musang King dan pedas gurih sambal belacan.  2. Durian Burrito Burrito merupakan menu sarapan yang cukup populer di negara Barat. Biasanya burrito untuk sarapan diisi dengan sayur atau buah segar seperti alpukat. Namun di Vietnam, menu sarapan yang populer adalah burrito isi beras ketan dengan topping durian di dalamnya. Karena orang Asia tak bisa lepas dari nasi, tentu menu sarapan ini menggunakan ketan yang padat namun enak. Menu sarapan ini eksis sejak tahun 1970-an di Provinsi Giang, Vietnam. Durian burrito ini biasanya dijual di pinggir jalan di pagi hari. Banyak orang yang membelinya untuk sarapan di kantor atau di rumah.  3. Pulut Durian Tak berbeda jauh dari Malaysia dan Vietnam, buah durian juga sudah menjadi makanan sehari-hari bagi orang Indonesia. Hampir setiap daerah di Indonesia memiliki ciri khas durian yang berbeda. Seperti di Aceh contohnya, buah durian yang legit dan creamy dimasak dengan beras ketan. Hidangan ini terkenal dengan nama pulut durian, di mana buah durian diolah menjadi kuah kental yang nantinya disantap dengan nasi ketan. Rasanya yang enak dan legit membuat banyak orang Aceh menyantapnya di pagi hari sebagai sarapan. Biasanya disantap dengan secangkir kopi panas yang jadi paduan sempurna.  4. Omelette Durian Jika Malaysia punya nasi goreng durian, kalau di Singapura ada menu sarapan omelette durian. Menu yang satu ini lebih ke makanan kemasan yang mirip seperti roti atau camilan. Bentuknya mirip seperti sponge cake lembut dengan isian krim. Krimnya ini perpaduan antara telur dan durian yang rasanya tetap legit dan enak. Banyak orang yang suka sarapan dengan omelette durian ini karena praktis dan mudah dibawa ke mana-mana. Aromanya juga tidak terlalu menyengat seperti makan durian langsung.  5. Kopi Durian Kopi dengan topping durian masuk ke dalam menu sarapan yang cukup digemari di Vietnam dan Filipina. Di Filipina sendiri bahkan ada kafe besar yang menyajikan menu kopi durian. Kopi durian yang ditawarkan cukup menarik, racikan kopi dicampur dengan daging durian yang berpadu sempurna ke dalam kopi. Bahkan minuman ini populer di kalangan vegan. Selain kopi ada juga teh durian berada di Amerika, teh durian ini disajikan di salah satu kafe bernama Lupicia yang menawarkan perpaduan teh hijau dengan potongan daging durian di dalamnya. Baca Juga: Menikmati Manis Legit Durian Monthong di Pinggir Kota Bogor   "
