,url,title,content
0,https://health.detik.com/berita-detikhealth/d-5235317/cek-kepesertaan-bpjs-kesehatan-waspada-beku-pada-1-november-2020,"Cek Kepesertaan BPJS Kesehatan, Waspada Beku pada 1 November 2020"," Bagi peserta JKN-KIS, sebaiknya sering-sering mengecek status kepesertaan BPJS Kesehatan melalui cara-cara yang tersedia. Pengecekan status terkait rencana melakukan Program Registrasi Ulang (GILANG). Aplikasi GILANG diterapkan pada sebagian peserta Jaminan Kesehatan Nasional-Kartu Indonesia Sehat (JKN-KIS), dari kelompok Pekerja Penerima Upah Penyelenggara Negara (PPU PN). Sebagian data peserta PPU PN belum terisi Nomor Induk Kependudukan (NIK). ""Bagi peserta JKN-KIS PPU PN yang datanya belum terisi NIK, status kepesertaannya akan dinonaktifkan sementara, pada saat dicek status kepesertaannya mulai tanggal 1 November 2020 akan muncul notifikasi untuk melakukan registrasi ulang,"" ujar Kepala Humas BPJS Kesehatan M Iqbal Anas Ma'ruf.   Dalam rilis yang diterima detikcom Iqbal menjelaskan, pembaruan data NIK dapat dilakukan dengan tiga cara. Misal, peserta bisa memanfaatkan Layanan Administrasi melalui WhatsApp (PANDAWA) menu pengaktifan kembali kartu BPJS Kesehatan. Cara lain adalah memanfaatkan petugas BPJS SATU! di rumah sakit atau menghubungi BPJS Care Center di 1500 400. Peserta cukup menyiapkan foto KTP/KK dan kartu peserta (KIS). ""Jika sudah melaporkan pembaruan data, maka status kepesertaannya akan diaktifkan kembali dalam waktu maksimal 1x24 jam,"" kata Iqbal.   Registrasi ulang merupakan tindak lanjut dari rekomendasi KPK, hasil audit BPKP tahun buku 2018, dan hasil rapat bersama kementerian atau lembaga. BPJS Kesehatan tentu perlu keterlibatan dari instansi pemerintah misal TASPEN, ASABRI, dan PWRI. Instansi pemerintah diharapkan mendorong peserta untuk aktif mengecek status kepesertaan JKN-KIS. Jangan sampai peserta JKN-KIS PPU PN mengalami status non aktif sementara dan tidak registrasi ulang. Terkait cara cek status kepesertaan BPJS Kesehatan, berikut cara yang bisa digunakan: 1. Melalui Aplikasi Mobile JKN 2. Menggunakan layanan informasi melalui Whatsapp (CHIKA) di nomor 08118750400 3. Menghubungi BPJS Kesehatan Care Center 1500 400 4. Menghubungi petugas BPJS SATU! yang ada di rumah sakit 5. Mengakses aplikasi JAGA KPK."
1,https://health.detik.com/sexual-health/d-5235338/tips-agar-bercinta-kilat-di-kamar-mandi-jadi-menyenangkan,Tips Agar Bercinta Kilat di Kamar Mandi Jadi Menyenangkan," Malam ini tak ada salahnya menghabiskan waktu dengan bercinta dengan pasangan. Tapi bila kesibukan sudah menunggu, kamu bisa mencoba seks kilat (quickie) di kamar mandi. Bercinta di kamar mandi membuat kamu dapat menghabiskan momen intim sekaligus sesudahnya siap-siap beraktivitas. Hanya saja mungkin tidak semua orang tahu atau bisa menikmati bercinta di kamar mandi. Dikutip detikcom dari berbagai sumber, berikut 5 tips yang mungkin bisa membuat pengalaman bercinta di kamar mandi kamu jadi lebih menyenangkan. Air kerap dianggap sebagian orang bisa membantu organ intim jadi lebih 'basah' dan siap untuk penetrasi. Pada kenyataannya menurut seksolog Sadie Allison, PhD, air malah akan semakin membuat penetrasi sulit karena membasuh pelumas alami yang dihasilkan vagina. Dampaknya seks bisa jadi pengalaman yang tidak mengasyikkan karena timbul risiko rasa nyeri iritasi. Daripada menggunakan air, sebaiknya bawa pelumas khusus untuk melengkapi aktivitas bercinta di kamar mandi. Pelumas berfungsi untuk membuat waktu bercinta jadi lebih cepat dan nyaman karena meminimalisir gesekan tidak diinginkan pada organ intim. Allison merekomendasikan pelumas yang berbahan dasar silikon karena tidak mudah luntur bila terkena air. Pilih posisi bercinta yang aman dilakukan di kamar mandi. Allison menyarankan posisi seperti cowgirl yaitu saat pria duduk di lantai lalu pasangannya duduk di atas untuk melakukan penetrasi. Agar lebih nyaman jangan lupa jadikan handuk basah atau sejenisnya sebagai alas tempat duduk sang pria. Misalnya di kamar mandi ada air mengalir dari shower atau keran terbuka, jangan bercinta pada posisi yang membuat pasangan menghadapi air. Alasannya karena ini malah akan membuat pasangan bisa tersedak oleh air yang masuk ke hidung atau mulut. Dampaknya kenyamanan bercinta malah jadi berkurang."
2,https://health.detik.com/berita-detikhealth/d-5235315/satgas-covid-19-kematian-dokter-ri-akibat-corona-terbanyak-di-juli-september,Satgas COVID-19: Kematian Dokter RI Akibat Corona Terbanyak di Juli-September," Ketua Satgas Penanganan COVID-19 Doni Monardo menyebut angka kematian dokter tertinggi akibat virus Corona di Indonesia terjadi selama bulan Juli, Agustus, dan September 2020. ""Tenaga kesehatan kita para dokter sejauh ini yang kami terima dari kawan-kawan IDI telah mencapai lebih dari 140 orang yang wafat,"" ucap Doni dalam Seminar Nasional XII PERSI dan Seminar Tahunan XIV Patient Safety, Jumat (30/10/2020). Doni menjelaskan, salah satu penyebab tingginya angka kematian dokter pada periode Juli-September adalah banyaknya pasien COVID-19 yang dirawat di rumah sakit. Terlebih kasus Corona di Indonesia terus mengalami penambahan setiap harinya. ""Kita harapkan kasus positif bisa berkurang, kemudian yang dirawat di rumah sakit tidak terlalu banyak, sehingga dokter punya kesempatan untuk relaksasi,"" harapnya. Berikut sebaran 141 dokter yang meninggal karena Corona di Indonesia per 25 Oktober 2020."
3,https://health.detik.com/berita-detikhealth/d-5235274/kasus-baru-covid-19-ri-turun-signifikan-bakal-melonjak-setelah-libur,"Kasus Baru COVID-19 RI Turun Signifikan, Bakal Melonjak Setelah Libur?"," Kasus baru Corona di Indonesia per hari ini turun signifikan dan menjadi terendah sejak September. Hari ini 'hanya' ada 2.897 kasus yang dilaporkan. Penambahan kasus COVID-19 di angka 2 ribu terakhir kali dilaporkan pada 7 September lalu. Kala itu ada 2.880 kasus baru, kemudian kasus baru terus meningkat hingga sempat mencetak rekor sebanyak 4.850 di 8 Oktober. Dr Masdalina Pane dari Perhimpunan Ahli Epidemiologi Indonesia (PAEI) menegaskan laporan ini tidak serta merta menandakan kasus COVID-19 di Indonesia menurun. Sebab, beberapa fasilitas laboratorium kemungkinan tutup. ""Puskesmas libur, jadi suspek-suspek yang ada di puskesmas kan nggak bisa diperiksa, yang buka pun kan hanya rumah sakit, itu pun hanya emergency biasanya ya,"" jelas Pane saat dihubungi detikcom Kamis (30/10/2020). ""Lihat grafik WHO, kalau weekend mesti kan pada turun terus naik lagi di Selasa,"" lanjutnya. Senada dengan Pane, ahli epidemiologi Fakultas Kesehatan Masyarakat Universitas Indonesia (FKM UI), Tri Yunis Miko, menegaskan jumlah spesimen yang diperiksa tentu sedikit karena beberapa lab libur. ""Karena libur, jumlah tesnya sedikit yang diperiksa,"" tegasnya. Hal ini tak menutup kemungkinan lonjakan kasus COVID-19 di beberapa hari ke depan. Sebab, spesimen menumpuk dan baru bisa diperiksa di beberapa hari kemudian. ""Iya bisa naik, nanti di hari berikutnya numpuk, bisa naik,"" lanjutnya. Miko menegaskan jangan menyimpulkan kasus COVID-19 lantas menurun. Kasus COVID-19 menurun harus dilihat dari positivity rate-nya. ""Nggak bisa, karenalabnya juga menurun, liatpositivityratenya kalau itu,""pungkasnya. "
4,https://health.detik.com/berita-detikhealth/d-5235203/as-diperkirakan-tak-bisa-vaksinasi-covid-19-tahun-ini-apa-sebabnya,"AS Diperkirakan Tak Bisa Vaksinasi COVID-19 Tahun Ini, Apa Sebabnya?"," Penasihat kesehatan Gedung Putih sekaligus dokter penyakit menular, Anthony Fauci, mengatakan vaksin virus corona COVID-19 kemungkinan tidak akan tersedia di Amerika Serikat (AS) hingga Januari 2021 mendatang. Fauci mengatakan sekitar bulan Desember mendatang akan banyak perusahaan yang akan memiliki dewan pemantauan keamanan data untuk melihat detail dari vaksinnya. Jika dewan tersebut merekomendasikan vaksin tersebut, maka perusahaan dapat mengajukan izin penggunaan darurat dari Administrasi Makanan dan Obat (FDA) AS. ""Sekitar bulan Desember Anda akan mulai melihat perusahaan dengan acara yang cukup,"" kata Fauci dalam wawancara online dengan Howard Bauchner, pemimpin redaksi Journal of American Medical Association, dikutip dari laman Bloomberg. Sebelumnya Presiden AS Donald Trump, pemimpin industri farmasi, dan beberapa pejabat kesehatan masyarakat lainnya mengatakan bahwa vaksin untuk mencegah COVID-19 dapat tersedia sebelum pemilihan presiden pada 3 November. Namun, tanggal tersebut secara konsisten diundur, karena studi klinis vaksin mulai menemui beberapa rintangan. Ada beberapa orang yang melakukan uji coba malah jatuh sakit. Tidak heran jika Fauci mengatakan studi yang saat ini sedang berlangsung tidak mungkin mencapai tolok ukur tersebut sampai sekitar bulan Desember 2020 mendatang. Setelah data tersedia, perusahaan masih harus menganalisis temuan, mengajukan kepada FDA untuk penggunaan darurat dan berpartisipasi dalam sidang komite penasihat. Saat ini ada lima perusahaan dalam tahap akhir studi untuk vaksin virus Corona. Vaksin dari Pfizer dan Moderna telah mendaftarkan uji coba mereka sepenuhnya. Jika vaksin ini lolos dan memiliki data keamanan yang cukup dan bahkan mungkin temuan kemanjuran jangka panjang, kedua vaksin tersebut dapat mengajukan penggunaan darurat vaksin pada Desember mendatang. Pfizer mengatakan pada Selasa (27/10/2020) bahwa studi tahap akhir dari vaksin COVID-19 eksperimental belum mencapai angka tonggak yang diperlukan untuk menentukan apakah vaksin mereka menunjukkan tanda-tanda efektivitas. Sementara itu, dewan pemantau ilmuwan yang mengawasi uji coba tersebut belum melakukan yang pertama dari empat tinjauan sementara yang direncanakan, karena belum ada 32 kasus infeksi virus Corona di antara 42.000 partisipannya."
5,https://health.detik.com/detiktv/d-5235199/video-pernyataan-terbaru-menkes-terawan-soal-corona-di-indonesia,Video Pernyataan Terbaru Menkes Terawan soal Corona di Indonesia, Perjalanan COVID-19 di Indonesia masih panjang. Hal ini diungkapkan oleh Menkes Terawan di Seminar Nasional XII PERSI dan Seminar Tahunan XIV Patient Safety.
6,https://health.detik.com/berita-detikhealth/d-5235184/kasus-covid-19-dki-terus-menurun-ini-2-kemungkinan-penyebabnya,"Kasus COVID-19 DKI Terus Menurun, Ini 2 Kemungkinan Penyebabnya"," Memasuki libur long weekend, DKI Jakarta per hari ini mencatat kasus lebih sedikit dibanding hari-hari sebelumnya. Ada 612 kasus baru COVID-19 per Kamis (30/10/2020). Per hari ini, berdasarkan laporan corona.jakarta.go,id ada 8.490 spesimen yang diperiksa. Sementara jumlah orang yang dites PCR di DKI sebanyak 6.707 orang. Dr Masdalina Pane dari Perhimpunan Ahli Epidemiologi Indonesia (PAEI) menjelaskan catatan kasus baru COVID-19 di DKI yang lebih rendah dari sebelumnya berkaitan dengan seberapa banyak testing yang dilakukan. ""Lihat testingnya, kalau testingnya turun, kasusnya turun,"" tegasnya saat dihubungi Jumat (30/10/2020). Salah satu kemungkinan tak banyak tes yang dilakukan di DKI Jakarta bisa saja terjadi akibat libur panjang. Mobilitas orang ke luar DKI Jakarta pun tercatat cukup banyak. ""Per Senin kemarin kan 500 ribu lebih mobil yang keluar DKI Jakarta, menuju daerah-daerah penyangga nah itu juga ada mobilitas orang ke luar Jakarta,"" lanjutnya. ""Jadi tentu itu juga berpengaruh terhadap jumlah orang yang ditesting,"" pungkasnya. Pane menjelaskan catatan kasus COVID-19 yang menurun juga bisa dilihat pada grafik WHO. Dalam grafik WHO, kasus COVID-19 setiap weekend cenderung menurun. ""Nggak usah Jakarta, WHO deh, lihat grafik WHO, kalau weekend mesti kan pada turun terus naik lagi di Selasa,"" pungkasnya."
7,https://health.detik.com/berita-detikhealth/d-5235116/terendah-dalam-sepekan-ini-riwayat-penambahan-kasus-baru-covid-19-di-dki,"Terendah dalam Sepekan, Ini Riwayat Penambahan Kasus Baru COVID-19 di DKI"," Provinsi DKI Jakarta menjadi salah satu wilayah di Indonesia yang mencatatkan jumlah kasus baru COVID-19 terbanyak per hari. Akumulasi pasien positif di DKI mencapai 104.235 orang. Meski masih menjadi daerah dengan kasus harian terbanyak, penambahan kasus baru di DKI cenderung mengalami penurunan. Berdasarkan data Jumat, (30/10/2020), jumlah kasus baru di DKI sebanyak 612. Menurun dibanding Kamis lalu yakni 713 kasus. Jika dilihat dari data corona.jakarta.go.id, DKI Jakarta mencatatkan rekor terbanyak penambahan kasus baru pada 16 September dengan 1.505 pasien. Setelah itu, per 24 Oktober, grafik positif harian di DKI cenderung mengalami penurunan."
8,https://health.detik.com/berita-detikhealth/d-5235088/4517-pasien-covid-19-ri-sembuh-di-30-oktober-dki-sumbar-di-atas-seribu,"4.517 Pasien COVID-19 RI Sembuh di 30 Oktober, DKI-Sumbar di Atas Seribu"," Jumlah pasien virus Corona COVID-19 di Indonesia yang dinyatakan sembuh pada 30 Oktober tercatat 4.517 kasus. Total ada 334.296 pasien sembuh, 13.782 meninggal, dari total 406.945 kasus terkonfirmasi positif. Sementara itu jumlah suspek pada hari ini tercatat 68.292 dengan 24.845 spesimen yang diperiksa. Detail perkembangan kasus COVID-19 adalah sebagai berikut:"
9,https://health.detik.com/berita-detikhealth/d-5235067/perusahaan-farmasi-asal-prancis-ini-bikin-vaksin-covid-19-segini-harganya,"Perusahaan Farmasi Asal Prancis Ini Bikin Vaksin COVID-19, Segini Harganya"," Perusahaan farmasi asal Prancis, Sanofi, mengembangkan vaksin COVID-19 yang direncanakan rampung pada pertengahan tahun depan. Saat ini Sanofi juga tengah bekerja sama dengan GlaxoSmithKline (GSK) Inggris dalam pengembangan vaksin. Pada awal September lalu, Bogillot mengungkap harga vaksin sekitar 10 euro atau Rp 175 ribu per dosis. ""Harga belum sepenuhnya ditetapkan, kami menilai biaya produksi untuk beberapa bulan mendatang diperkirakan akan di bawah 10 euro,"" kata Bogillot kepada radio France Inter, dikutip dari Reuters. Seorang juru bicara Sanofi mengatakan dalam pernyataan melalui surel bahwa harga akhir akan diputuskan ketika vaksin sudah melalui tahap pengujian terakhirnya. ""Kami mengantisipasi untuk dapat menentukan harga akhir pada saat uji coba tahap III. Ketika kami mengetahui lebih banyak tentang dosis. Pada tahap ini, angka apa pun tidak tepat. Kurang dari 10 euro hanyalah salah satu hipotesis yang sedang kami perkirakan,"" papar pernyataan resmi tersebut. Sanofi dan GSK menargetkan bisa melalui tahap uji klinis akhir atau fase 3 pada Desember mendatang. Apabila hasil memuaskan, Sanofi dan GSK berharap vaksin itu bisa disetujui pada paruh pertama tahun depan."
10,https://health.detik.com/berita-detikhealth/d-5235010/sebaran-virus-corona-indonesia-30-oktober-2897-kasus-baru-612-dari-dki,"Sebaran Virus Corona Indonesia 30 Oktober: 2.897 Kasus Baru, 612 dari DKI"," Pemerintah melaporkan 2.897 kasus baru COVID-19 yang terkonfirmasi pada hari Jumat (30/10/2020). Total kasus terkonfirmasi saat ini sudah mencapai 406.945 kasus semenjak virus Corona mewabah di Indonesia. DKI Jakarta menjadi provinsi dengan penambahan kasus paling tinggi sebanyak 612 kasus, disusul Jawa Barat sebanyak 320 kasus baru per 30 Oktober. Dikutip dari laman covid19.go.id, pada hari ini ada sebanyak 4.517 kasus sembuh, sementara kasus kematian Corona sebanyak 81 orang."
11,https://health.detik.com/berita-detikhealth/d-5234993/update-corona-ri-30-oktober-hanya-2897-kasus-baru-terendah-sejak-september,"Update Corona RI 30 Oktober: 'Hanya' 2.897 Kasus Baru, Terendah Sejak September"," Kasus positif virus Corona di Indonesia bertambah 2.897 kasus. Total kasus positif tercatat 406.945, sembuh 334.295, meninggal 13.782. Sementara itu jumlah pemeriksaan dalam sehari tercatat sebanyak 24.854 spesimen. Jumlah suspek mencapai 68.292. Detail perkembangan virus Corona di Indonesia pada Jumat (30/10/2020), adalah sebagai berikut: 1. Kasus positif bertambah 2.897 menjadi 406.945 2. Pasien sembuh bertambah 4.517 menjadi 334.295 3. Pasien meninggal bertambah 81 menjadi 13.782 Sebelumnya pada Kamis (29/10/2020), jumlah kasus positif virus Corona COVID-19 tercatat 404.408 kasus, sembuh 329.778, dan meninggal 13.701 kasus."
12,https://health.detik.com/berita-detikhealth/d-5234977/sebenarnya-apa-penyebab-long-covid-ini-kata-dokter,Sebenarnya Apa Penyebab Long COVID? Ini Kata Dokter," Sebagian penyintas COVID-19 masih bisa mengalami gejala, seperti nyeri otot, rasa lelah, dan gangguan napas, bahkan setelah dinyatakan sembuh. Hal ini disebut juga sebagai fenomena long COVID dan para ahli hingga kini masih berusaha mengungkap teka-teki di baliknya. Menurut ahli patologi klinik dr Muhammad Irhamsyah, SpPK, MKes, dari Primaya Hospital Bekasi Timur, studi dari negara-negara Eropa menemukan 9 dari 10 pasien COVID-19 yang dirawat dapat mengalami fenomena long COVID. Bagi mereka yang terdampak, kemungkinan butuh waktu perawatan lebih lama di rumah sakit. ""Long COVID ini biasanya terjadi pada pasien dengan keluhan mild symptoms (gejala ringan) dan rata-rata mengalami gejala lebih dari tiga minggu bahkan berbulan-bulan setelah gejala awal dialami pasien,"" kata dr Irhamsyah lewat rilis yang diterima detikcom pada Jumat (30/10/2020). Hingga saat ini penyebab long COVID masih belum diketahui secara pasti. Namun, menurut dr Irhamsyah kemungkinan ini berhubungan dengan tingkat kerusakan organ yang disebabkan oleh virus dan proses pemulihannya. ""Penelitian mengatakan bahwa penyakit yang ditimbulkan oleh COVID-19 bergantung seberapa berat kerusakan organ yang dialami oleh pasien. Sehingga terdapat potensi pasien yang mengalami gejala berkelanjutan akan melalui proses perbaikan organ tubuh yang memakan waktu lama,"" ungkap dr Irhamsyah. ""Indonesia sebaiknya juga perlu waspada tentang hal ini karena COVID-19 adalah virus yang dianggap sangat berbahaya dikarenakan dapat mengganggu kualitas hidup seseorang, terutama fisik maupun mental,"" pungkasnya. "
13,https://health.detik.com/berita-detikhealth/d-5234943/menkes-terawan-akui-perjalanan-covid-19-di-ri-masih-panjang,Menkes Terawan Akui Perjalanan COVID-19 di RI Masih Panjang," Menteri Kesehatan Terawan Agus Putranto mengaku perjalanan pandemi COVID-19 masih panjang. Meski begitu, ia berterima kasih kepada seluruh tenaga medis atas perjuangannya selama ini. ""Saya sangat berterimakasih dan bersyukur melihat apa yang sudah dikerjakan oleh teman-teman semua, baik secara individu maupun pelayanan di rumah sakit begitu luar biasa dan perjuangan kebersamaan inilah yang saya yakin akan diridhai dan diberkahi oleh Tuhan Yang Maha Kuasa,"" jelas Terawan dalam Seminar Nasional XII PERSI dan Seminar Tahunan XIV Patient Safety, Jumat (30/10/2020). ""Apa yang kita hadapi (COVID-19) perjalanannya masih cukup panjang dan kita harus berikan semua kekuatan kita dalam pelayanan rumah sakit dan maupun kesehatan para tenaga medis,"" lanjut Terawan. Selain itu, Menkes Terawan menyebut akan terus mendampingi para tenaga medis. Termasuk bila ada sesuatu yang diperlukan tenaga medis. ""Saya selaku Menteri Kesehatan terus akan mendampingi, terus akan menyertai, dan akan terus membantu bila ada sesuatu yang diperlukan, dan terus akan kita lakukan tumpangan,"" ujarnya. Menkes Terawan menyoroti perjuangan para tenaga medis yang tak kenal lelah menyelamatkan pasien. ""Dan saya percaya Yang Maha Kuasa pasti memberikan kekuatan dan juga berkah, bukan hanya teman sejawat saja, tetapi meliputi seluruh keluarganya,"" pungkasnya."
14,https://health.detik.com/berita-detikhealth/d-5234873/heboh-seruan-boikot-barang-prancis-segini-produk-kesehatan-ri-dari-prancis,"Heboh Seruan Boikot Barang Prancis, Segini Produk Kesehatan RI dari Prancis"," Beberapa produk Prancis kini ramai diboikot sejumlah negara. Hal ini menjadi sikap sejumlah negara muslim terhadap Presiden Prancis lantaran membiarkan karikatur Nabi Muhammad tetap dipublikasi. Salah satu yang mengecam hal tersebut adalah Presiden Turki. Presiden Turki, Recep Tayyip Erdogan mendesak orang-orang untuk tak lagi membeli barang-barang dengan label Prancis. ""Jangan pernah menghargai barang-barang berlabel Prancis, jangan membelinya,"" kata Erdogan dalam pidato yang disiarkan televisi di Ankara. Dikutip dari CNBC, beberapa supermarket di Kuwait sudah mulai mengeluarkan semua produk Prancis dari rak. Hal ini disebut sebagai aksi protes. Indonesia jadi salah salah satu negara yang mengecam kartun Nabi Muhammad. Pemerintah RI mengecam pernyataan Presiden Perancis Emmanuel Macron yang menghina Islam. Pernyataan Macron itu dianggap melukai perasaan 2 miliar muslim di seluruh dunia. ""Indonesia mengecam pernyataan Presiden Perancis yang menghina agama Islam. Pernyataan tersebut telah melukai perasaan lebih dari 2 Milyar orang muslim di seluruh dunia dan telah memecah persatuan antar umat beragama di dunia,"" demikian pernyataan RI, seperti dikutip dari situs resmi Kemlu RI, Jumat (30/10/2020). Rata-rata Indonesia mengimpor berbagai produk medis dari Prancis. Tercatat ada produk kesehatan dan farmasi sebanyak 681.044 kg, nilainya US$ 33,9 juta. Selain produk kesehatan berikut beberapa produk yang diimpor dari Prancis. - Senjata dan peluru 282,029 Kg, senilai USD 71,9 juta - Pulp and waste paper 111,8 juta kg, senilai USD 45,9 juta - Mesin dan motor termasuk suku cadang 699.281 kg senilai USD 436 juta - Kedelai 120.743 kg nilainya USD 73.370 - Mentega 286.790 kg nilainya USD 238 juta."
15,https://health.detik.com/berita-detikhealth/d-5234823/kisah-viral-nakes-di-medsos-rontgen-susuk-hingga-rebutan-pasang-kateter,"Kisah Viral Nakes di Medsos, Rontgen Susuk hingga Rebutan Pasang Kateter"," Belakangan ramai tenaga kesehatan dengan cerita mereka soal pasien yang mendadak viral di media sosial. Seperti yang terbaru, seorang bidan menceritakan kondisi pasien yang mengidap sifilis. Beberapa netizen menilai cerita ini malah terkesan mengumbar aib pasien dan melanggar kode etik. Meski begitu, wanita tersebut mengaku hal ini tak termasuk pelanggaran kode etik karena tak menyebutkan identitas pasien. Bahkan ada juga yang menganggapnya bermanfaat karena mengandung unsur edukasi. Terlebih jika disampaikan oleh tenaga kesehatan yang kompeten, sehingga bisa menambah wawasan. Beberapa waktu lalu, sempat viral juga penampakan X-ray yang memperlihatkan susuk dalam tubuh seorang pasien. Berikut cerita-cerita viral kondisi pasien yang dirangkum detikcom dari berbagai sumber. Heboh potongan cerita seorang wanita diduga perawat menceritakan dirinya berebut ingin memasang kateter dengan teman. Ia mengaku hal ini dilakukan semata-mata ingin melihat penis pasien pria dewasa. Meski begitu, cerita viral tersebut sudah tak ditemukan dalam akun TikTok milik wanita diduga perawat. Cerita ini malah ramai jadi perbincangan dalam akun @tubirfess yang diunggah pada Sabtu (24/10/2020). ""Gimana sih rasanya masang selang kateter ke pasien dewasa lelaki,"" tulis caption yang dilihat detikcom pada potongan gambar dari video TikTok, dari akun @tubirfess. ""Sampai berantem woy gua sama kawan gua, demi dapat tindakan ini,"" lanjut caption tersebut. Seorang bidan dicibir netizen lantaran menceritakan kondisi pasien yang mengidap sifilis. Ia menceritakan hal ini dalam akun TikTok pribadinya @m*ria******. ""Jadi ada pasien yg kontrol dan blng terkena syphilis,"" jelasnya. Wanita tersebut mengatakan kalau si pasien tidak tahu sejak kapan mengidap penyakit ini. Hingga ia tak tega mengatakan kondisi pasien lantaran menghindari kemungkinan masalah dengan suami. ""Pasien ini polos banget. Tapi enggak tega mau ngomong penyebabnya sama dia, takutnya berantem sama suaminya,"" lanjutnya. Netizen menilai apa yang dilakukan bidan ini melanggar kode etik. Namun, ia meyakini tindakannya tak melanggar kode etik lantaran tak menyebutkan identitas pasien. ""Etikanya sebagai tenaga medis, Anda tidak perlu mengumbar masalah pasien Anda di sini,"" respons netizen @Nir***a.   Viral gambar Xray yang memperlihatkan seorang pasien memiliki ratusan susuk. Gambar ini lantas viral di media sosial usai diunggah selebgram yang juga mahasiswa kedokteran lulusan 2019, Tasqia Syabira. Dalam gambar Xray tersebut nampak jelas bahwa sang wanita yang kabarnya berusia 55 tahun itu memiliki ratusan susuk di tubuhnya. Susuk tersebut terlihat seperti garis-garis kecil berwarna putih yang cukup banyak dan menyebar di tubuhnya. ""Pasien wanita usia 55 tahun mau di X-ray. Nah kalo inisusuknya ada berapa?Itung sendiri deh ya:)"" tulisTasqia dalamunggahannya."
