,url,title,content
10,https://food.detik.com/info-kuliner/d-5224175/kondisi-tangannya-patah-kakek-70-tahun-ini-tetap-semangat-jualan-teh,"Kondisi Tangannya Patah, Kakek 70 Tahun Ini Tetap Semangat Jualan Teh"," Kondisi kakek penjual teh di India ini sangat memprihatinkan. Usianya sudah 70 tahun dan tangannya patah. Meski begitu, ia tetap semangat berjualan teh. Kisah inspiratif banyak berdatangan dari lansia yang memenuhi kebutuhannya dengan berjualan makanan. Di Indonesia ada banyak kakek atau nenek yang melakukannya meski tubuhnya sudah sangat ringkih. Begitu juga dengan India, banyak sosok kakek dan nenek yang masih semangat berjualan untuk memenuhi kebutuhan hariannya. Meskipun kondisinya sangat memprihatinkan. Hal ini dialami seorang kakek di India. Kakek yang tak diketahui namanya ini telah berusia 70 tahun. Tubuhnya sudah lemah dan kondisi tangannya sangat memprihatinkan, seperti dilihat dari Indiatvnews (21/10). Baca Juga: Kakek Maman dari Garut Semangat Jualan Camilan Meski Kakinya Lumpuh  Tangan sang kakek diketahui patah dan tak pernah diobati. Tangan bagian kirinya terlihat terpisah dari tulangnya dan terkulai lemas. Kakek ini kerap menutupi kondisi tangannya tersebut. Sekujur tubuhnya juga dipenuhi luka bakar. Sang kakek juga terlihat kesusahan untuk berdiri, bahkan untuk berpindah pun ia terlihat merangkak. Kisah yang mengiris hati ini dibagikan oleh food vlogger India di Instagram @foodyvishal (20/10). Lokasi berjualan kakek dan nenek ini berada di kawasan Delhi's Dwarka Sector 13. Untuk memenuhi kebutuhan, sang kakek ditemani oleh istrinya berjualan teh. Teh yang dijualnya diracik dengan cara tradisional. Seperti ditumbuk lalu direbus sampai mendidih baru disajikan kepada pembelinya. Kisah kakek di India inipun viral di Instagram. Banyak netizen India yang prihatin dan menanyakan kondisi sang kakek. Tak jarang sebagian dari mereka menanyakan alamat yang pasti agar bisa langsung membantu sang kakek. ""Tolong berikan aku alamat lengkapnya dan nomor google pay,"" ujar netizen. ""Tolong bagikan secara detail, saya ingin mengirimkan sejumlah donasi,"" tulis netizen lain. Sebelumnya, kisah nenek berusia 110 tahun yang kesulitan jalan di Yogyakarta juga menarik perhatian netizen. Ini karena sang nenek masih semangat berjualan kerupuk dengan kondisinya yang memprihatinkan. Nenek bernama Ngatiyem ini setiap pagi berjualan kerupuk di sekitar Alun-alun Kidul Yogyakarta. Kerupuknya ia ikatkan di tongkat yang membantunya dalam berjalan. Baca Juga: Kesulitan Jalan, Nenek 110 Tahun Ini Jualan Kerupuk Pakai Tongkat "
11,https://food.detik.com/info-kuliner/d-5223827/5-reaksi-bule-saat-cicip-martabak-indonesia-pertama-kali,5 Reaksi Bule Saat Cicip Martabak Indonesia Pertama Kali," Martabak Indonesia menarik perhatian orang-orang luar negeri ini. Begini reaksi mereka saat mencicipi martabak untuk pertama kali. Martabak mungkin belum sepopuler nasi goreng atau rendang di luar negeri, namun karena tampilan kudapan ini menarik, banyak orang asing juga tertarik mencicipinya. Martabak tak ubahnya pancake gaya Barat, namun dengan tekstur adonan yang lebih tebal dan berserat. Semakin menggugah selera karena martabak diberi limpahan isian untuk versi manis. Bisa cokelat, keju, kacang, hingga selai. Nah, jika orang Indonesia sudah terbiasa dengan rasa martabak manis, bagaimana ya dengan orang-orang di luar negeri. Apakah mereka menyukainya? Berikut 5 reaksi bule saat mencicipi martabak Indonesia: YouTuber Bali, David Allen membeli martabak telur dan martabak manis untuk dicoba bule-bule di pulau dewata. Pertama ada bule dari Serbia bernama Sara. Ia langsung tertarik makan martabak telur pakai cabai rawit. ""Ini enak. Cabai juga populer di Serbia,"" katanya. Ia memberi nilai 10 untuk martabak telur. Lanjut ke martabak manis, Sara terpukau dengan tampilannya yang menggugah selera karena tebal dan terlihat empuk. Begitu mencicipinya pun ia langsung jatuh cinta. ""Martabak manis ini lebih enak dari martabak telur karena aku suka manis,"" ujarnya. Saking enaknya ia bahkan memberi nilai 10 plus untuk martabak isi kacang, cokelat, dan susu ini.  Matt dari New York dan Nanki dari India juga coba martabak yang dibawa David. Pertama, mereka cicip martabak telur. Nanki langsung bilang, ""Enak banget. Aku bakal jadikan ini sebagai camilan."" Sedangkan Matt menilai martabak telur seperti omelet yang besar. Untuk nilainya, Nanki kasih 10 sedangkan Matt 8. ""Ya lumayan enak lah, tapi aku tidak akan makan ini tiap hari. Yang jelas ini enak,"" ujar Matt. Martabak manis tak ketinggalan mereka cicipi. ""Aku lebih suka yang martabak telur karena aku kurang suka manis,"" kata Nanki. Ia memberi nilai 7 untuk kreasi ini. YouTuber Korea yang bisa bahasa Indonesia, Sunny Dahye mengunjungi Surabaya bersama kekasih bulenya, Chris. Di sini mereka mencoba banyak makanan tradisional. Mereka bahkan mukbang martabak di bathtub. Sunny menjelaskan kalau martabak adalah pancake khas Indonesia. Ia memesan martabak biasa rasa Toblerone dan martabak tipis kering (tipker) rasa red velvet. ""Kayaknya ini adalah makanan terbaik yang pernah ada. Perutku lagi nggak enak sekarang, tapi rasanya aku bisa habiskan semua. Kayaknya ini makanan favoritku di Indonesia sejauh ini,"" kata Chris. Untuk varian tipis kering, Chris bilang tampilannya seperti crepe. ""Rasanya menarik, lama-lama aku jadi suka,"" ujar Chris soal martabak red velvet rasa Oreo ini. Baca Juga: 5 Momen Seru Bule Barcelona Pertama Kali Cicip Makanan Indonesia   Hari Jisun adalah YouTuber asal Korea yang populer di Indonesia. Ia sering mengajak ibu dan adiknya cicip makanan Indonesia. Kali ini berupa martabak manis dan telur. ""Seperti telur dadar,"" kata adik Jisun saat melihat martabak telur. Mencium martabak manis, ia juga bilang, ""Aromanya manis banget."" Bagaimana dengan rasanya? Usai gigit martabak telur, ibunya langsung bilang, ""Mau pakai nasi!"". Ia pun terlihat menyukai martabak telur. Begitu juga dengan adik Jisun yang tak henti mengunyah. ""Rasanya gurih kayak dumpling, kayak pancake juga,"" kata Jisun dan adiknya. Untuk martabak manis, Jisun dan ibunya bilang, ""Rasanya luar biasa. Enak banget."" Sedangkan sang adik terlihat diam dan fokus menikmati lezatnya martabak manis. YouTuber Korea yang pernah tinggal di Indonesia, Sanghoya, juga mengajak teman-teman bulenya cicip martabak.Mereka adalah Tom dan Joy yang baru coba martabak pertama kali. ""Wanginya enak banget,"" kata Tom saat mencium martabak manis original. Untuk rasanya Tom bilang sangat enak. Selanjutnya mereka cicipi martabak red velvet Oreo. Tom dan Joy juga sangat menyukainya. ""Aku lebih suka ini,"" kata Joy. Bagaimana dengan martabak telur? Tom dan Joy terlihat menikmati. Tom bilang rasanya lumayan. Sedangkan Joy terlihat lebih menyukainya. Apalagi ketika dicocol saus dan acar yang jadi pelengkapnya. Baca Juga: Bule Prancis Ini Jatuh Hati Pada 10 Makanan Indonesia Enak "
12,https://food.detik.com/info-kuliner/d-5224075/ada-es-ganja-di-jogja-rasanya-segar-bikin-geleng-geleng,"Ada Es Ganja Di Jogja, Rasanya Segar Bikin Geleng-geleng"," Sudah diketahui secara umum kalau ganja termasuk narkoba yang dilarang. Tapi di Jogja ada penjual yang nekat menjajakan es ganja. Waduh! Es ganja yang satu ini dijual si kios pinggir jalan di kawasan Jl. Hayam Wuruk, Lempuyangan, Yogyakarta. Sensasi rasanya yang segar bikin es ganja ini laris manis diserbu pembeli. Eits jangan salah, ganja yang satu ini bukan narkoba ya. Ganja sendiri adalah singkatan dari Degan Gula Jawa alias es kelapa muda dengan campuran gula jawa. Video es ganja ini sempat membuat heboh. Sejak diunggah oleh akun instagram @voilajogja pada 17 Oktober lalu, es ganja ini mulai jadi perbincangan netizen. ""Satu-satunya lapak yang jual ganja legal di Jogja lur.. udah pada tau belom?"" tulis admin Voila Jogja. ""Ganja di sini ditambah es batu jadi makin seger, diminum pas siang-siang panas terik. Buat yang pada pengen nyobain ganja tanpa takut ditangkap pak polisi, bisa langsung mlipir ke sini yes,"" lanjutnya. Ketika dihubungi detikFood (21/10), Voila Jogja mengatakan kalau es ganja ini sudah cukup lama berjualan. Menunya hanya satu yakni es ganja yang terbuat dari campuran degan alias kelapa muda dan gula jawa. Tambahan lainnya hanya es batu yang membuat sensasi es ini makin segar nikmat. ""Sudah lama itu, dinamai es ganja biar unik aja. Campurannya hanya kelapa muda dan gula jawa,"" kata Voila Jogja. Seporsi es ganja ukuran jumbo harganya hanya Rp 12 ribu. Bisa dinikmati langsung ataupun dibungkus untuk dibawa pulang. Soal rasa, manis segar es kelapa muda semakin nikmat ditambah legitnya gula Jawa. Setuju dengan saran Voila Jogja, es ganja ini cocoknya dinikmati siang hari saat cuaca terik. Es ganja ini juga tampaknya menarik perhatian banyak orang yang justru jadi penasaran. Ada yang sudah jadi langganan, namun ada juga yang mengajak temannya untuk 'nge-ganja' di sini. ""Hayuk nge-es ganja di sini,"" kata netizen. ""We love ganja!"" sahut netizen lainnya. Nah kamu yang tinggal di Jogja atau sedang plesiran ke Jogja jangan sampai melewatkan segarnya es ganja ini ya. Rasanya segar dan bikin geleng-geleng kepala. "
13,https://food.detik.com/info-kuliner/d-5223838/bukan-di-mall-mewah-5-konglomerat-ini-hobi-makan-di-warung-kaki-lima,"Bukan di Mall Mewah, 5 Konglomerat Ini Hobi Makan di Warung Kaki Lima"," Dikenal sebagai konglomerat di Indonesia, orang-orang hebat ini justru hobi nongkrong di warung kaki lima. Ada bos Djarum hingga bos jalan tol. Video pengguna TikTok bernama Denise Chariesta yang nongkrong di mall mewah dan merendahkan orang karena nongkrong di pinggir jalan menuai banyak kritik tajam. Bahkan banyak netizen yang membandingkannya dengan para konglomerat Indonesia, yang terkenal kaya raya tetapi tak gengsi untuk makan di warung kaki lima. Kesederhanaan para konglomerat tersebut justru membuat kagum netizen dan menginspirasi banyak orang. Ada bos Djarum hingga bos jalan tol yang hobi makan di warteg. Jusuf Hamka merupakan bos yang ada di balik proyek besar jalan tol di Indonesia. Ia juga merupakan pimpinan di PT Citra Marga Nusaphala Persada. Melihat jabatannya, tentu Jusuf Hamka hidup dengan serba kecukupan. Meskipun begitu, Jusuf Hamka merupakan sosok yang sederhana. Bahkan ia tak gengsi makan di warteg. Foto dirinya saat makan di warteg itu sempat viral di media sosial dan membuat netizen salut. Untuk menuju warteg saja ia menggunakan mobil mewah. Sementara ia hanya mengenakan setelan berupa kaos, celana pendek dan sandal. Penampilannya seperti warga biasa. Tak hanya itu, ia juga mentraktir makan warga-warga sekitar. ""Karena masih suasana lebaran dan saya nggak open house, sehingga saya memanfaatkan kesempatan tersebut untuk mentraktir orang-orang yang sedang makan di warteg,"" tulisnya dalam caption. Momen dirinya makan di warung kaki lima bukan hanya sekali saja. Ia banyak membagikan momen kuliner sederhananya di laman Instagramnya. Michael Bambang Hartono juga sempat viral karena potret dirinya yang sedang asyik makan di warung kaki lima. Michael Bambang Hartono dikenal sebagai bos Djarum. Fotonya viral setelah dibagikan oleh pengguna Twitter @ayudh69. Banyak netizen yang mengaku kagum dengan kesederhanaan Michael Bambang Hartono. Dalam foto tersebut tampak Michael Bambang Hartono tengah makan sepiring tahu pong di warung Tahu Pong Karangsaru Semarang. Michael Bambang Hartono juga tampak berpenampilan sederhana, dengan kaos berkerah berwarna hijau. Ternyata, bos Djarum tersebut sudah menjadi langganan di warung tersebut. Baca Juga : Punya Harta Rp 522 Triliun, Bos Djarum Tak Gengsi Makan Tahu di Warung Siapa yang tak kenal Dahlan Iskan? Namanya populer sebagai mantan Menteri BUMN. Selain itu, ia juga pernah menjadi pimpinan di perusahaan media. Maka tak heran, namanya dikenal sebagai konglomerat di Indonesia. Meski begitu, tetapi gaya hidupnya sangat sederhana. Bahkan, Dahlan Iskan hobi makan di warteg. Ia pernah mampir ke Warteg Warmo yang berada di kawasan Tebet, Jakarta Selatan. Bukan hanya itu, saat berada di Ngawi ia menyempatkan untuk mampir ke warung pecel. Warungnya sederhana, bahkan area makannya satu area dengan dapur. Sandiaga Uno dikenal sebagai mantan Wakil Gubernur DKI Jakarta. Selain itu, Sandiaga juga merupakan pengusaha sekaligus politikus Indonesia. Punya posisi jabatan yang tinggi tidak membuat Sandiaga uno tinggi hati. Ia justru dikenal sebagai sosok yang sederhana. Untuk kulineran, Sandiaga lebih memilih warung kaki lima yang sederhana. Dalam beberapa momen, ia pernah mampir ke warteg. Ada salah satu warteg yang menjadi langganannya, yaitu di bilangan Masjid Agung Sunda Kelapa, Jakarta Pusat. Menu yang dipesan biasanya ada oncom, tumis kangkung hingga sayur asem. Selain itu, ia juga pernah mampir ke pasar tradisional untuk menikmati soto. Armand Wahyudi adalah keponakan dari Michael Bambang Hartono. Armand Wahyudi putra dari Robert Budi Hartono yang merupakan adik dari Michael Bambang Hartono. Armand Wahyudi juga merupakan pewaris grup Djarum. Sama seperti sang paman, Armand Wahyudi juga dikenal sebagai sosok yang sederhana. Ia tak gengsi untuk makan di warung-warung sederhana. Seperti pada beberapa waktu lalu, namanya ramai diperbincangkan karena nongkrong di kantin untuk mengisi perut. Armand Wahyudi memang sudah terbiasa hidup sederhana. Dengan kesederhanannya itu banyak menginspirasi orang. Baca Juga : Tajir Melintir, 5 Artis Ini Tak Gengsi Makan di Warung Pinggir Jalan"
14,https://food.detik.com/info-kuliner/d-5223684/7-bisnis-makanan-kekinian-yang-laris-untuk-jualan,7 Bisnis Makanan Kekinian yang Laris untuk Jualan," Bisnis makanan kekinian ternyata banyak menarik minat orang untuk mencicip. Jika kamu ingin mencoba belajar berbisnis, maka tak ada salahnya belajar membuat dan coba jualan secara online. Tren makanan memang berubah. Kalau dulu ramai menjual makanan dengan sensasi rasa pedas, kini beberapa makanan kekinian banyak yang berasal dari makanan Barat yang lebih modern. Di masa pandemi ini, kebanyakan orang juga ingin menikmati makanan enak di rumah. Jika belum memiliki modal banyak, cobalah menjajal bisnis makanan kecil-kecilan dengan menjual makanan kekinian. Ini beberapa bisnis makanan kekinian yang bisa dicoba.      Brulee bomb merupakan camilan enak yang bentuk dan cara membuatnya mirip sepertibitterballen. Namabrulee bomb semakin melejit ketikaNagitaSlavina memulai bisnis makanan berjualanbitterballen yangisiannya lumer dan dinamakan denganbrulee bomb.  Kamu pun bisa membuat ini menjadi ide bisnis. Brulee bomb dijual secara frozen dan bisa disimpan hingga 2 minggu dalam freezer. Brulee bomb dibuat dengan bahan seperti bawang bombay, bawang putih, smoked beef atau sosis, margarin, tepung terigu, susu cair serta keju mozarella. Dibalut dengan tepung roti yang digoreng garing dan di dalamnya terasa lembut. Brulee bomb makin enak dinikmati bersama dengan saus tartar ataupun saus sambal.   Memiliki konsep 'lumer' seperti brulee bomb, spaghetti brulee dibuat dengan spaghetti yang dimasak dengan saus bolognese dan daging cincang. Kemudian dituang dengan brulee. Saus cream brulee dibuat dengan mencampurkan mentega, tepung terigu, susu cair, cooking cream hingga keju cheddar parut. Enak dinikmati hangat-hangat.   Dessert yang dibuat dari buah mangga ini kini tengah jadi trend. Dibuat dengan isian potongan buah mangga dan puding mangga. Semakin enak dipadu bersama dengan kuah creamy susu yang mantap. Makin enak juga isiannya dipadu dengan sagu mutiara yang dicampur dengan susu evaporasi dan juga susu kental manis. Nikmat disajikan dingin lho.   Siapa yang suka dessert ala Filipina ini? Meskipun buko pandan juga terkenal di Sumatera. Hidangan penutup ini terbuat dari campuran kelapa muda, susu kental manis, krim, agar-agar pandan dan sagu mutiara. Perpaduan warna hijau mudanya dengan aroma khas pandan. Karena dalam proses pembuatannya buko pandan memang dibuat dengan campuran daun pandan. Beberapa orang yang berjualan buko pandan akan mencampurkan serutan keju sebagai toppingnya lho.  Bombolone merupakan donat Italia yang bisa jadi peluang bisnis makanan kekinian. Donat tanpa lubang ini biasanya diisi dengan selai di dalamnya. Nama bomboloni berasal dari kata ""bomb"" yang menggambarkan bentuknya bulat seperti granat tangan yang siap meledak. Menggambarkan isiannya yang siap meledak di mulut. Jadi bomboloni juga bisa nih jadi pilihan untuk ide bisnis makanan kamu.  Roti gaya Korea yang satu ini memiliki rasa yang legit dan empuk. Bentuknya memang mirip seperti ubi ungu namun sebenarnya adonan luarnya dibuat dengan campuran tepung tapioka, tepung ketan hingga taro bubuk. Lalu isiannya dicampurkan dengan ubi manis, mentega, madu dan susu. Penasaran bagaimana cara membuatnya? Cek resepnya di sini ya.   Nama asli donat ini Loukumades. Nama Lokma di India dan Luqmat Al-qadl di Arab Saudi. Loukumades dibuat dari adonan tepung yang kemudian digoreng garing. Penyajian adonan ini diberi campuran sirup gula yang permukaannya sedikit lengket. Donat khas Yunani ini dibuat dengan campuran tepung terigu, ragi, air hangat dan garam. Teksturnya renyah di luar dan lembut di dalam. Loukumades juga bisa jadi bisnis makanan kekinian yang bisa dikolaborasikan dengan beberapa topping seperti matcha, cokelat hingga kayu manis.  "
15,https://food.detik.com/info-kuliner/d-5222599/turun-bb-20-kg-daffa-punya-cheating-day-untuk-lancarkan-metabolisme,Turun BB 20 Kg Daffa Punya 'Cheating Day' Untuk Lancarkan Metabolisme," Cheating day dilakukan Daffa hingga sukses berdiet. Agar metabolisme tubuh lancar dan mood tetap baik. Dilansir dari Healthline (21/10) cheating day adalah hari yang ditetapkan oleh pelaku diet untuk bisa menyantap makanan apapun yang disukai. Biasanya momen ini ditentukan satu hari dalam seminggu. Misalnya, setelah 6 hari membatasi porsi dan menu makan maka dalam satu hari kamu 'mengizinkan' diri untuk makan dengan bebas. Ternyata penerapan cheating day ini berpengaruh pada sistem metabolisme tubuh serta membantu memperbaiki mood. Beberapa ahli gizi mengungkapkan kalau kegiatan cheating day saat diet terbukti membantu mengatur perubahan dalam komposisi tubuh. Cheating day juga terbukti meningkatkan metabolisme dalam tubuh. Hal ini diikuti oleh produksi hormon leptin. Leptin sendiri merupakan hormon yang bertanggung jawab untuk menekan rasa lapar. Beberapa penelitian menunjukkan ketika seseorang mengalami penurunan berat badan yang signifikan karena proses diet, kadar leptin dalam tubuh akan menurun. Tingkat leptin yang rendah akan membuat orang makan berlebihan yang justru membuat berat badan meningkat. Saat cheating day, hormon akan memproduksi leptin lebih banyak sehingga keinginan untuk makan berlebih justru bisa ditekan. Dalam hal ini tentu dibutuhkan kontrol emosi juga. Meskipun memberi dampak baik, tapi sebaiknya jangan menganggap cheating day sebagai ajang balas dendam. Kamu harus tetap fokus pada tujuan utama yakni menurunkan bobot badan. Daffa, pelaku diet yang sukses menurunkan 20 kilogram berat badannya dalam waktu 4 bulan juga menerapkan cheating day. Ia mengaku cheating day dilakukan setiap akhir pekan. Diakui Daffa, cheating day bisa jadi obat yang mengusir rasa bosan saat berhari-hari makan dengan porsi dan menu terbatas. Momen cheating day juga jadi ajang untuk memperbaiki mood. ""Kalo cheating day itu aku pasti makan di mall atau cafe, karena weekday aku usahain nggak pergi kemana-mana. Pas cheating tergantung mood, apapun dimakan dan nggak ada batasan porsinya, benar bebas. Pokoknya kalo cheating day itu kopi sih yang wajib ada, jadi pasti beli kopi,"" beber Daffa. Menjalani program diet selama berbulan-bulan tentu membuat Daffa sesekali merasa bosan. Tapi ia punya siasat untuk mengusir anggapan bosan ini. ""Cara mengatasi kebosanan diet ya mau nggak mau harus dibiasakan, karena kita punya tujuan akhir yang harus tercapai,"" pungkas Daffa. Daffa merupakan satu pelaku diet yang sukses menurunkan berat badannya lewat diet karbo. Berat badan sebelumnya 80 kilogram berhasil ia turunkan menjadi 60 kilogram. "
