,url,title,content
15,https://sport.detik.com/moto-gp/d-5226730/motogp-2020-alex-marquez-kini-telah-berubah,MotoGP 2020: Alex Marquez Kini Telah Berubah," Alex Marquez menampilkan performa oke di dua balapan terakhir MotoGP 2020. Rider tim Repsol Honda itu menyebut dirinya kini sudah berubah dibanding sebelumnya. Marquez tampil gemilang di seri MotoGP Prancis dan MotoGP Aragon. Adik dari Marc Marquez itu berhasil back to back podium untuk pertama kalinya di kelas primer. Di MotoGP Prancis, Marquez menjadi yang tercepat nomor dua di belakang Danilo Petrucci. Pada balapan di Aragon, dia kembali menempati podium dua dan hanya kalah bersaing dengan Alex Rins yang keluar sebagai juara. Pencapaian yang diraihnya tersebut jelas menunjukkan perkembangan signifikan dari Alex Marquez. Sebelumnya di awal-awal balapan MotoGP 2020, rider 24 tahun itu kesulitan menembus barisan terdepan dan lebih banyak finis di luar 10 besar. Marquez sendiri mengaku jika dirinya memang telah bertransformasi menjadi lebih baik lagi, terutama setelah menjalani tes di Misano pada pertengahan September lalu. Juara Moto2 2019 itu kini sudah lebih nyaman dengan motor RC213V miliknya. ""Itu benar. Saya Alax yang berbeda saat berada di atas motor sekarang,"" kata Marquez, dilansir dari Speedweek.  [Gambas:Twitter]  ""Saya memiliki perasaan yang lebih baik, telah mencoba banyak hal dan bilang ke teknisi saya: serahkan kepada saya sendiri. Itu kuncinya,"" dia menambahkan. ""Saya juga menyesuaikan mentalitas saya. Sekarang saya dapat mengemudi lebih lancar dan lebih cepat pada saat bersamaan,"" ujarnya. Alex Marquez bakal beradu cepat lagi memperebutkan podium dalam MotoGP Teruel akhir pekan ini. Seri ke-11 MotoGP 2020 itu digelar pada Minggu (25/10/2020) malam WIB dan dapat disaksikan langsung di Trans 7 dan detikSport."
16,https://sport.detik.com/detiktv/d-5226754/joan-mir-santai-saja-pimpin-klasemen-dengan-selisih-cuma-6-poin,Joan Mir Santai Saja Pimpin Klasemen dengan Selisih Cuma 6 Poin," Joan Mir kini memimpin klasemen MotoGP, hanya unggul 6 poin dari Fabio Quartararo. Ia mengaku biasa saja menanggapi hal itu dan menghadapi MotoGP Teruel."
17,https://sport.detik.com/detiktv/d-5226725/el-clasico-barcelona-vs-real-madrid-duel-raksasa-bermasalah,"El Clasico: Barcelona VS Real Madrid, Duel Raksasa Bermasalah", Barcelona VS Real Madrid akan tersaji akhir pecan ini. Kedua raksasa dalam keadaan yang tidak bagus. Siapa yang akan menjadi pemenang di El Clasico? Simak obrolannya bersama Indo Barca dan Real Madrid Indonesia.
18,https://sport.detik.com/sport-lain/d-5226688/khabib-nurmagomedov-ambil-banyak-pelajaran-dari-ronaldo,Khabib Nurmagomedov Ambil Banyak Pelajaran dari Ronaldo," Petarung Ultimate Fighting Championship (UFC), Khabib Nurmagomedov, sangat mengidolakan Cristiano Ronaldo. Pesepakbola asal Portugal itu bahkan jadi panutan Khabib. UFC 254 menyajikan Khabib Nurmagomedov vs Justin Gaethje pada Minggu (25/10/2020) pukul 01.00 WIB. Khabib Nurmagomedov sang juara kelas ringan akan mempertahankan sabuk juaranya dari Justin Gaethje si pemegang sabuk interm. Pertarungan itu menandakan kembalinya The Eagle ke Oktagon setelah 13 bulan lamanya. Sebelum bertarung melawan Justin Gaethje, Khabib bicara terkait Cristiano Ronaldo dan mengambil banyak pelajaran dari bintang Juventus itu. ""Ketika saya bertemu Cristiano Ronaldo, saya memiliki begitu banyak pertanyaan untuk ditanyakan. Saya ingin tahu bagaimana dia dapat mempertahankan keinginannya untuk menjadi yang terbaik selama 17 tahun berturut-turut,"" kata Khabib Nurmagomedov dalam wawancaranya di akun Youtube UFC Rusia. ""Sejak 2003, dia berada di level tertinggi. Setiap akhir musim dia masuk dalam daftar peringkat sepuluh besar pemain,"" sambungnya. Ronaldo adalah pesepakbola yang banyak merasakan gelar individu, di antaranya lima Ballon d'Or, top skor LaLiga, hingga Pemain Terbaik pilihan FIFA. Gelar secara koletif juga mampu dimenangan, yakni lima Liga Champions, Piala Eropa, dan gelar domestik di Portugal, Inggris, Spanyol, dan Italia. ""Dia memenangkan segalanya selama dia di Manchester United dan Real Madrid. Dua liga sepakbola kelas dunia. Dia memenangkan segalanya,"" Khabib mengungkapkan. ""Saya bertanya-tanya bagaimana dia berhasil mencapainya. Sejauh yang saya pahami, energi di dirinya, keinginan, motivasi, disiplin, teknik pemulihan, pola hidup, nutrisi - dia menggabungkan semuanya,"" ujar Khabib Nurmagomedov tentang Cristiano Ronaldo."
19,https://sport.detik.com/detiktv/d-5226719/aksi-petr-cech-yang-kembali-masuk-skuad-chelsea,Aksi Petr Cech yang Kembali Masuk Skuad Chelsea, Petr Cech kembali masuk skuad Chelsea. Cech akan menjadi kiper keempat The Blues. Cech juga terlihat sudah latihan bersama Chelsea.
20,https://sport.detik.com/moto-gp/d-5226636/mulai-tampil-impresif-honda-sudah-atasi-masalahnya-di-motogp,"Mulai Tampil Impresif, Honda Sudah Atasi Masalahnya di MotoGP?"," Honda mulai tampil impresif di MotoGP 2020, dengan terakhir ridernya tercepat di latihan bebas MotoGP Teruel 2020. Benarkah Honda telah mengatasi masalahnya? Honda tampil impresif di awal rangkaian MotoGP Teruel 2020. Dari dua kali sesi latihan bebas, semua pebalapnya, baik tim pabrikan dan satelit, bisa mencatat hasil positif di Sirkuit Motorland Aragon, Jumat (23/10/2020). Di sesi pertama, keempat ridernya menempati urutan 10 besar. Rider Repsol Honda, Alex Marquez, di posisi pertama, Takaaki Nakagami di tempat kedua, lalu Stefan Bradl (Repsol Honda/keempat) dan Cal Crutchlow (LCR) ke-10. Sementara di sesi kedua, gantian Nakagami menjadi yang tercepat. Pebalap Jepang itu mencatat waktu 1 menit 47.782 detik, kemudian disusul Crutclow di posisi ketiga, Alex Marquez (10) dan Bradl (11). Hasil ini membuat Honda diprediksi telah menemukan solusi atas masalahnya. Sebab sebelumnya, di MotoGP Aragon, tim juara bertahan itu juga bisa menyabet podium lewat keberhasilan Alex Marquez menjadi runner up. Musim ini, Honda memang sempat kesulitan, seiring absennya Marc Marquez. Baru di MotoGP Prancis mereka meraih podium, lewat Alex Marquez, dan kini masih tertinggal di klasemen pabrikan. Crutchlow menegaskan, performa impresif Honda di MotoGP Teruel bukan cuma karena telah mengatasi solusinya. Ada faktor pebalap juga, yang bisa melesat di trek. ""Saya pikir pebalap yang balapan dengan lebih baik adalah Alex dan Taka. Saya merasa sedikit lebih baik [masih pemulihan lengan] jadi saya bisa mendorong lebih banyak. Orang-orang bilang Honda telah mengubahnya, dan lain-lain, Saya tidak percaya itu masalahnya,"" kata Crutchlow dilansir Crash. ""Saya percaya, setiap kali kami mendapatkan beberapa informasi kecil dan perubahannya sangat kecil, apakah itu terkait elektronik atau kejutan baru ini, terkadang kami menggunakannya, terkadang tidak."" ""Pada dasarnya, kami cepat di sirkuit ini saat ini. Tetapi, seperti yang terlihat akhir pekan lalu, saya percaya Alex-lah yang membuat perbedaan. Hari ini, Alex kembali sangat cepat dan Taka juga sangat cepat."" ""Jadi saya pikir, pebalaplah yang membuat perbedaan. Sebab jika Anda melihat latihan saat ini, ini menjadi balapan Taka dengan kalah sekitar 11 detik. Karena kecepatan FP1-nya, jika dia menjaga kecepatan yang dia miliki, dia akan memenangkan balapan dengan 11 detik,"" katanya. Balapan MotoGP Teruel akan digelar pada Minggu (25/10/2020). Para rider akan lebih dulu menjalani kualifikasi sehari sebelumnya."
