,url,title,content
18,https://food.detik.com/berita-boga/d-5234369/di-warung-semox-bisa-nikmati-trancam-di-pinggir-tanggul-sungai-brantas,Di Warung Semox Bisa Nikmati Trancam di Pinggir Tanggul Sungai Brantas," Paduan aneka sayuran segar yang renyah pedas bisa dinikmati di warung ini. Dimakan segar dengan suasana tanggul sungai Brantas yang semilir. Menghabiskan libur panjang di Kabupaten Jombang belum lengkap kalau tidak mampir ke Warung Semox Dekat Kali (DK). Tidak hanya menyajikan aneka masakan pedas, diwarung ini juga bisa menikmati pemandangan tepi tanggul sungai Brantas. Seperti namanya, warung di Desa/Kecamatan Megaluh, tepatnya di sebelah barat Pasar Megaluh ini berada di pinggir Sungai Brantas. Yakni sungai terbesar di Jatim. Sepintas, Warung Semox DK sama dengan tempat makan di kampung pada umumnya. Baca Juga : 5 Fakta Bir Kopi dari Jombang yang Halal Dikonsumsi Namun, ada beberapa hal yang membuat warung ini selalu ramai pengunjung. Salah satunya menu trancam. Mirip urap, trancam berisi aneka sayur segar tanpa direbus. Seperti kacang panjang, kecambah, daun simbukan, daun kemangi, serta beluntas. Aneka sayur segar tersebut dicampur bumbu urap dan kelapa parut dengan rasa yang pedas gurih. Trancam disajikan dengan nasi dan aneka lauk yang digoreng atau dibakar. Mulai dari ayam, bebek, daging sapi, jeroan, gurame, nila, ikan wader, hingga telur puyuh. ""Kami mempunyai 25 menu. Menu lainnya ada soto, rawon, lodeh, kare dan aneka sambelan,"" kata pemilik Warung Semox DK Duwi Adi kepada detikcom, Kamis (29/10/2020). Menyantap aneka masakan pedas semakin asyik sambil menikmati suasana petang dari tanggul Sungai Brantas. Ya, Warung Semox menyediakan tempat makan lesehan di tanggul sungai terbesar di Jatim tersebut. Semakin malam, pemandangan sungai kian menarik karena berhiaskan lampu dari perahu-perahu penyeberangan. ""Kebanyakan pengunjung suka makan di tanggul karena udaranya segar dan pemandangannya bagus,"" terang Adi. Warung yang sudah berdiri selama 6 tahun ini buka mulai pagi hingga hampir tengah malam. Mulai pukul 05.00-11.00 WIB dan pukul 14.00-23.00 WIB. Harga tiap menu di tempat ini pun terjangkau. Rata-rata hanya Rp 12.000 per porsi. ""Paling ramai saat akhir pekan dan momen liburan. Omzet saya bisa jutaan rupiah dalam sehari,"" ungkap Adi. Salah seorang pengunjung, Indah (20) mengaku sengaja makan di Warung Semox bareng saudaranya sembari bersantai. Gadis asal Kecamatan Megaluh ini memang penggemar kuliner pedas. ""Tempatnya nyaman untuk refreshing tipis-tipis. Suasana ruang terbuka dengan pemandangan Sungai Brantas dan perahu. Jadi, bisa makan sambil selfie untuk diunggah ke medsos,"" tandasnya. Baca Juga : Maknyus! Durian Bakar Khas Jombang yang Creamy Wangi"
19,https://food.detik.com/info-kuliner/d-5233684/5-restoran-di-puncak-yang-instagramable-cocok-buat-ngadem,"5 Restoran di Puncak yang Instagramable, Cocok Buat Ngadem!"," Restoran di Puncak yang Instagramable ini bisa jadi pilihan tempat ngadem. Suasananya bikin betah dengan pilihan makanan enak. Libur cuti bersama banyak dimanfaatkan orang untuk liburan, termasuk ke Puncak. Cuaca yang dingin dengan ragam pilihan tempat wisata membuat kawasan ini ramai disambangi. Urusan makanan tak perlu khawatir karena di Puncak ada banyak tempat makan enak. Ada yang konsepnya rumah makan sederhana hingga restoran kekinian. Nah, bagi kamu yang mau nongkrong, restoran di Puncak yang Instagramable ini bisa jadi pilihan. Suasananya dijamin bikin betah dengan pilihan menu beragam. Berikut 5 restoran di Puncak yang Instagramable: Berada di tengah hutan pinus, The Lake House cocok untuk kamu yang mau menghirup udara segar. Di tempat ini juga ada satu spot Instagramable yang terkenal. Berupa area duduk di tengah kolam luas. Untuk lokasinya, The Lake House ada di Pesona Alam, tak jauh dari Taman Safari Cisarua Bogor. Untuk menunya, restoran ini punya ragam menu Sunda dan Barat. Beberapa yang bisa dicicip adalah nasi bakar, pizza, sandwich, nacos, salad, sampai ragam minuman segar.  Restoran di Puncak yang Instagramable selanjutnya adalah Ramatama. Lokasinya di pinggir jalan, sekitar 10 menit dari Agrowisata Gunung Mas. Mampir ke sini kamu dijamin betah karena bisa melihat pemandangan bukit yang manjakan mata. Apalagi saat malam hari, semakin menarik dengan cahaya-cahaya bohlam. Nongkrong di sini jangan lupa cicip minuman kopi yang segar. Kalau lapar, bisa beli ragam rice bowl dan olahan mie instan enak. Kalau tertarik mampir, Ramatama ada di Jalan Raya Puncak KM 85,6. Baca Juga: Pencinta Mie,Ini Daftar 5 Mie Ayam Legendaris di Bogor  Kalau ingin menikmati kopi dengan cuaca sejuk, mampirlah ke Sama Dengan Coffee. Lokasinya ada di Ciloto, Jalan Raya Puncak. Terdapat area indoor dan outdoor dengan konsep modern minimalis. Sejauh mata melihat, kamu juga akan dimanjakan asrinya pemandangan Puncak Gunung Gede Pangrango. Pilihan menunya juga banyak. Dari kategori menu Asia ada nasi ayam kecombrang, sop iga, dan sate ayam. Dari kategori menu Barat ada burger, pasta carbonara, sandwich, dan French toast.  Restoran Instagramable di Puncak selanjutnya adalah Pelangi Cafe & Resto. Dari Jalan Raya Puncak, kamu bisa masuk lewat alternatif Gadog-Bukit Pelangi. Lokasi persisnya di Gunung Geulis. Areanya luas mirip lapangan dengan rumput sintetis, kemudian untuk tempat santainya memakai bean bag warna-warni. Paling pas mampir ke sini bersama teman-teman. Saat lapar melanda, kamu bisa cicipi ragam menu Barat enak di sini. Salah satunya Rainbow Mozzarella Cheese Burger yang tampilannya juga Instagramable. Satu lagi restoran di Puncak yang Instagramable di Puncak yang bisa kamu sambangi. Namanya Chocolate Room by Nicole. Berada di lantai 6, Kampoeng Brasco FO, kamu bisa lihat pemandangan ketinggian di sini. Untuk menunya, tersedia ragam minuman kopi, cokelat, dan dessert enak. Salah satu yang bisa dicoba adalah Double Chocolate Molten Cake. Disajikan bersama saus cokelat, es krim, dan potongan buah segar. Baca Juga: Libur Panjang! Ini 5 Resto di Puncak yang Punya Pemandangan Keren "
20,https://food.detik.com/resto-dan-kafe/d-5234544/wajib-coba-ini-dia-4-hidangan-enak-ala-kaum-urban-yang-bikin-nagih,Wajib Coba! Ini Dia 4 Hidangan Enak ala Kaum Urban yang Bikin Nagih," Bosan makanan yang itu-itu aja? Coba deh sekali-kali icip makanan khas kaum urban yang lagi menggeluti tren green lifestyle yaitu salad. Eits, jangan salah nggak semua salad menjadi sajian yang membosankan dan itu-itu aja kok, gak percaya? Coba saja datang, ke restoran Lifestyle-dining dan Salad Bar pertama KFC yang bertajuk Naughty by Nature. Di sana kamu akan disuguhkan sajian salad yang dipadukan dengan ayam khas KFC yang rasanya istimewa. Naughty by Nature merupakan salah satu inovasi terbaru persembahan dari KFC Indonesia, yang akan membuat kamu menyantap salad dan sayuran dengan cara lebih seru, menyenangkan, mengenyangkan, dengan kombinasi ayam KFC sebagai proteinnya. General Manager Marketing PT Fast Food Indonesia Hendra Yuniarto mengatakan penggarapan ide orisinil di KFC Indonesia ini dilatarbelakangi riset yang terus menerus dilakukan sehingga lahirlah konsep dan menu Naughty by Nature secara maksimal. Tak cuma konsep restoran dan menu, interior dan eksterior pun dibuat sedemikian rupa sesuai dengan tema alam. ""Hadirnya Naughty by Nature bertujuan untuk mengisi celah di pasar kuliner ditargetkan untuk konsumen yang senang mengkonsumsi salad namun tetap menginginkan makanan yang gurih, menyenangkan, mengenyangkan serta menggugah selera,"" ujar Hendra dalam keterangan tertulis, Jumat (30/10/2020). Lalu apa saja menu yang disajikan oleh Naughty by Nature ini? Berikut adalah beberapa sajian yang dapat membuat kamu terbelalak. Meal Market Platter  Ini adalah menu andalan dari Naughty by Nature. Kamu yang memilih sajian ini sebagai menu makananmu. Naughty by Nature bakal memberikan kebebasan kombinasi yang ingin ditaruh di atas piringmu. Berbagai pilihan ayam olahan KFC mulai dari Grilled Chicken, O.R Chicken, Hot and Crispy hingga Chicken Skin sebagai protein bisa kamu paduka dengan berbagai macam sayuran mulai dari sayuran segar seperti kale caesar, sweet potato salad, kale slaw hingga sayuran panggang seperti roasted baby potato, mashed potato, zucchini gratin dan lainnya sebagai pendamping ayam. Grilled Chicken  Menu makanan ini menjadi favorit bagi orang yang ingin menikmati sajian ayam tanpa tepung yang enak dan juga gurih. Sajian ayam panggang yang di marinasi dengan bumbu KFC ditambah dengan sentuhan aroma daun rosemary ini mampu menggoyangkan lidah siapapun yang mencicipinya. Eggtastic Pecinta telur pasti akan suka dengan makanan yang satu ini. Campuran telur yang lembut dipadankan dengan savory yogurt yang kaya rasa dan nikmat, mampu memancarkan rasa yang fantastis dan tak ada duanya. Iced Butterfly Pea Tea Kurang afdol bila menyantap makanan tanpa minuman yang menyegarkan bukan? Di Naughty by Nature, kamu bisa menemukan minuman yang enak dan juga sehat, seperti Iced Butterfly Pea Tea yang merupakan es teh dengan penampilan cantik dan unik dengan campuran bunga telang serta lemon yang segar. Sekali tengguk, seluruh rasa dahaga akan hilang dengan sekejap. Selain 4 menu andalan tersebut, Naughty by Nature juga menawarkan berbagai kreasi makanan inovatif berbahan ayam KFC seperti chicken taco, pasta, ayam KFC geprek, makanan berbahan dasar telur, serta makanan ringan bagi konsumen yang cocok untuk lidah orang Indonesia. Saat ini, Naughty by Nature menerapkan sistem protokol kesehatan untuk layanan makan di tempat dan pembelian take-away sesuai anjuran dari Pemerintah demi keamanan, kesehatan dan kenyamanan. Naughty by Nature juga membatasi kapasitas restoran hanya 50% dari total kapasitas pengunjung dengan waktu operasional pukul 10:00 - 18:00 untuk Senin-Kamis dan pukul 07:00 - 18:00 untuk Jumat-Minggu. Untuk melihat berbagai macam sajian dan konsep restoran Naughty by Nature, kamu dapat mengakses Instagram @Naughtybynaturekfc atau memintai kode QR di bawah ini. "
21,https://food.detik.com/info-kuliner/d-5234453/mulia-penjual-sushi-ini-sumbangkan-50-buah-sushi-tiap-jumat,Mulia! Penjual Sushi Ini Sumbangkan 50 Buah Sushi Tiap Jumat," Penjual sushi ini punya cara beramal sendiri. Tiap Jumat, ia selalu menyisihkan 50 buah sushi untuk dibagikan pada orang-orang yang membutuhkan. Tak banyak penjual makanan yang memikirkan bagaimana nasib orang-orang membutuhkan di sekitarnya. Tapi berbeda dengan penjual sushi asal Malaysia ini. Dikutip dari Must Share News (30/10), ia berusaha untuk membantu mereka. Bahkan ketika sebenarnya penjual sushi ini juga berjuang untuk memenuhi kebutuhan hidupnya. Adalah Said Muhammad Hafidz Adhha Said yang rutin sedekah 50 buah sushi setiap hari Jumat. Lewat akun Twitter pribadinya, ia meminta tolong netizen untuk menyebarluaskan inisiatif mulianya. ""Minta tolong Retweet agar tweet ini sampai pada orang-orang susah yang ingin makan sushi,"" kata Hafidz. Usaha sushi baru milik Hafidz ini dinamai Keda Singgit. Lokasi berjualannya di kawasan Sk Lembah Keramat, Kuala Lumpur. Hafidz tak mematok harga mahal untuk sushinya. Harganya RM 1 atau sekitar Rp 3.500 per buah. Ternyata inisiatif mulia Hafidz disambut positif oleh netizen. Bahkan esok harinya setelah unggahan Twitternya viral, ia mendapat pesanan 350 buah sushi. Pemesannya terdiri dari beberapa orang yang sengaja memesan sushi itu untuk dibagikan para orang-orang yang membutuhkan. Baca Juga: Inspiratif! Satu Keluarga Bagikan 100 Porsi Makanan Gratis Tiap Hari    Pria 25 tahun ini juga berbagi informasi penjualan sushinya di Facebook. Pada 24 Oktober 2020, ia menjual 1.000 buah sushi dalam 2 jam, termasuk sushi yang dibagikan sebanyak 350 buah itu. Mengenai motivasinya berbagi sushi pada orang-orang yang membutuhkan, Hafidz punya alasan khusus. Kepada Free Malaysia Today (30/10) ia mengatakan melihat banyak orang-orang kurang beruntung di sekitar tempatnya berjualan. Ayah dua anak ini lalu terpikir membagikan sushi jualannya karena ia sadar ada banyak orang tak mampu yang belum pernah makan sushi. Merekapun sulit membelinya. ""Mereka jarang makan sushi dan beberapa bahkan belum pernah coba sama sekali,"" katanya. Hafidz juga bilang, ""Semua orang seharusnya bisa makan sushi."" Ke depannya Hafidz tidak akan berhenti. Mimpi besarnya adalah ia ingin mendonasikan sushi dari uangnya sendiri, tidak bergantung kontribusi pembeli. Baca Juga: Penjual Makanan Ini Berikan Makanan Gratis untuk Anak Kecil di Pinggir Jalan "
22,https://food.detik.com/info-kuliner/d-5233998/jarang-diketahui-5-makanan-enak-ini-juga-ada-di-suryakencana,"Jarang Diketahui, 5 Makanan Enak Ini Juga Ada di Suryakencana"," Suryakencana terkenal sebagai surga kuliner di Bogor. Selain soto kuning yang jadi incaran, ini 5 makanan yang jarang terekspos di Suryakencana. Rasanya tak kalah enak! Bicara soal kuliner di Bogor, kawasan Pecinan Suryakencana dikenal sebagai surganya. Bagi pencinta kuliner, kawasan ini wajib dikunjungi karena akan memanjakan perut dengan ragam makanannya. Yang paling jadi incaran di sini adalah soto kuning. Mulai dari gerobakan pinggir jalan, hingga sudah punya gerai luas. Tapi, tak hanya itu saja karena banyak ragam kuliner lain yang jarang terekspos di Suryakencana. Ada combro yang garing nikmat hingga lumpia basah yang sedap. Lumpia basah sangat populer di Jawa Barat dan Semarang. Namun tentunya berbeda. Ciri khas lumpia basah di Bogor adalah menggunakan bengkuang dan kulit lumpianya tidak dilumuri adonan sagu gula merah. Salah satu penjual lumpia basah paling nikmat di Suryakencana adalah yang menggunakan gerobak hijau. Berada di kawasan Gang Aut di depan penjual manisan. Lumpia Basah Gang Aut ini sudah berjualan sejak tahun 1972. Kulit lumpianya pun cukup tebal dan diproduksi sendiri. Untuk isiannya ada telur, tauge, bengkuang dan tahu yang telah dihaluskan. Untuk memasaknya pun masih menggunakan arang, jadi rasanya jelas lebih sedap. Saat detikFood berkunjung, penjual Lumpia Basah Gang Aut ini mengaku bisa habiskan 100 porsi tiap hari. Lalu menjelang akhir pekan, bisa sampai 200 porsi lebih. Satu porsinya Rp 15.000, ukuranya cukup besar dan bisa mengenyangkan. Baca Juga: Legendaris! 5 Tempat Makan Ini Jadi Langganan Presiden Jokowi  Combro juga salah satu makanan khas Bogor. Berupa singkong yang diparut lalu diberikan isian oncom yang telah diolah dengan bumbu pedas. Kemudian digoreng sampai teksturnya renyah. Saat detikFood berkunjung ke Suryakencana langsung tertuju pada penjual combro dengan gerobak cokelat tak jauh dari Lumpia Basah Gang Aut. Namanya Combro Atmajaya yang sudah berjualan sejak tahun 1997. Combro di sini sangat segar karena langsung dibuat. Gigitan pertama teksturnya sangat renyah, rasa oncomnya juga tak terlalu pedas. Jadi nikmat ketika disantap. Minyak gorengnya juga sangat bersih ketika kami membelinya. Satu combrong dibanderol harga Rp 5.000. Tak heran kalau harganya cukup tinggi karena kualitasnya juga baik. Dalam sehari penjualnya mengaku bisa menghabiskan 300 pcs combro. Kalau dikalkulasikan, omzetnya mencapai Rp 1,5 juta dalam sehari. Kalau penasaran rasanya, bisa langsung cicipi ya!  Cincau adalah agar-agar yang terbuat dari bahan alami. Yang banyak dijual di Suryakencana adalah cincau hijau. Mereka menggunakan daun cincau asli, jadi tak perlu khawatir soal kualitasnya. Sepanjang jalan Suryakencana, pasti tak akan sulit menemukan penjual es cincau kelapa. Es ini bisa melepaskan dahaga setelah lelah berkeliling di sana. Kami membeli dari salah satu penjual yang berada di Gang Aut. Satu gelasnya disajikan cincau, kelapa muda, es batu, santan, dan sirup gula merah. Dibanderol harga Rp 8.000 per gelas. Rasanya segar sekali, apalagi dinikmati di bawah terik matahari. Ketan Bakar Gang Aut juga jarang terekspos. Jajanan berbahan dasar ketan atau jadah ini dibakar lalu disajikan dengan topping serundeng kelapa atau oncom. Penjualnya menggunakan gerobak pikulan. Proses membakar ketannya juga masih sederhana karena menggunakan arang. Jadi aroma bakarannya terasa nikmat ketika ketan disantap. Kalau suka rasa manis gurih, topping serundeng kelapa bisa jadi andalan. Tapi kalau kamu pecinta rasa pedas gurih, topping oncom juaranya. Tapi kalau ingin keduanya, Anda juga bisa memintanya kepada penjual.  Es Durian Pakuan juga bisa jadi alternatif pelepas dahaga yang menyegarkan. Penjual es durian ini bisa kamu temui di sepanjang jalan Suryakencana. Bagi pecinta durian, hidangan es satu ini tak boleh dilewatkan begitu saja. Satu porsi es durian disajikan di dalam mangkuk plastik. Mereka menggunakan durian asli untuk campurannya. Terlihat dari warna kuning terang yang dihasilkan dari es tersebut. Jika ingin menikmatinya juga tak perlu merogoh kocek dalam karena harganya hanya Rp 15.000 per mangkuk. Rasa dan aroma duriannya menyengat. Sensasi manis legit juga akan membuatmu terlena. Baca Juga: Pencinta Mie,Ini Daftar 5 Mie Ayam Legendaris di Bogor "
23,https://food.detik.com/berita-boga/d-5234381/trik-hidup-hemat-hingga-penjelasan-dokter-soal-vitamin-nafsu-makan,Trik Hidup Hemat Hingga Penjelasan Dokter Soal Vitamin Nafsu Makan," Tanpa mengeluarkan uang sepeserpun, pria ini hidup hemat dengan mengandalkan voucher. Ada pula penjelasan dokter tentang vitamin nafsu makan. Kisah hidup pria asal Jepang ini menarik perhatian. Pasalnya ia bisa hidup hemat selama bertahun-tahun tanpa mengeluarkan uang tunai untuk kebutuhan sehari-hari, termasuk untuk makan. Bagaimana caranya? Bogor menjadi destinasi kuliner favorit. Ada banyak kafe hingga restoran yang menyuguhkan pemandangan alam. Tempatnya cocok untuk refreshing, sambil ngemil jajanan atau makan enak. Lewat cuitan di Twitter, seorang dokter memberikan 'surat cinta' untuk orang tua. Surat tersebut berisi penjelasan tentang vitamin penambah nafsu makan pada anak.  Adalah Kiriya Hiroshi, pria asal Jepang yang punya trik hidup hemat. Selama 36 tahun, ia memenuhi kebutuhan sehari-hari tanpa mengeluarkan uang tunai. Ia hanya mengandalkan voucher. Voucher itu digunakan untuk memberi kebutuhan sehari-hari termasuk juga untuk makan. Voucher itu didapatkan dari bermain saham. Kiriya sudah mulai investasi sejak usianya 35 tahun. Dari itulah, pria 77 tahun ini mendapat banyak keuntungan. Baca Juga : Trik Hemat Pria yang Hidup 36 Tahun Hanya Mengandalkan Voucher Bogor tak pernah lepas dari tujuan para pelancong, apalagi di musim liburan ini. Ada banyak destinasi kuliner dengan konsep menarik yang cocok buat refreshing. Salah satunya yang berkonsep outdoor dengan suguhan pemandangan alam. Pilihannya beragam, mulai dari Grand Garden Resto & Cafe, Kopi Daong, Kluwih Sunda Authentic, Gumati Café & Restaurant hingga De'Kendor Hambalang. Baca Juga : Di Bogor Ada 5 Kafe dan Resto Outdoor yang Asyik Buat Nyantai Banyak dari orang tua yang mengeluhkan anaknya susah makan. Hal tersebut membuat mereka meminta dokter untuk memberikan vitamin penambah nafsu makan pada anak. Inilah yang dialami oleh dokter Arifianto. Melalui Twitternya @dokterapin, ia memberikan 'surat cinta' kepada para orang tua yang minta vitamin penambah nafsu makan. Menurutnya, anak tidak perlu vitamin untuk doyan makan. Hanya sajikan makanan enak di saat mereka lapar. Baca Juga : Dokter Ini Berikan 'Surat Cinta' Untuk Orangtua yang Minta Vitamin Nafsu Makan"
24,https://food.detik.com/ayam/d-5233292/resep-ayam-bakar-rumahan-yang-gampang-dan-sedap,Resep Ayam Bakar Rumahan yang Gampang dan Sedap," Ayam bakar rumahan ini rasanya pedas gurih sedikit manis. Enak dimakan dengan sambal, nasi putih dan lalapan. Makin seru dimakan bareng keluarga. Ayam bakar tidak terlalu sulit dibuat. Rahasianya terletak pada bumbunya. Sebelum dipanggang ayam direndam bumbu sehingga meresap dan makan enak saat dipanggang. Untuk jenis ayam yang paling pas ayam negeri yang berdaging tebal dan juicy. Pastikan membakar ayam dengan panas yang cukup agar daging ayam benar-benar matang hingga bagian dalamnya. Pelengkap ayam bakar ini tentunya sambal yang sedap dan lalapan. Jika ingin membuat sendiri kamu tinggal mengikuti resep dan tips berikut ini. Bahan:• 1 ekor (1 kg) ayam negeri, potong 8 bagian• 1 buah jeruk nipis, ambil airnya• Bumbu Olesan:• 5 sdm minyak sayur• 1 sdm cabe merah giling• 3 sdm kecap manis• 2 sdm saus tiram• 2 sdt bawang putih parut halus• 1 sdt jahe parut• 1 sdt gula pasir• 1/2 sdt merica bubuk• 1 sdt garam• Pelengkap:• Sambal:• 8 buah cabe merah keriting• 5 buah cabe rawit merah• 5 butir bawang merah• 3 siung bawang putih• 1 buah tomat merah, potong-potong• 1 potong terasi• 1 sdt garam Cara membuat: 1. Cuci bersih potongan ayam lalu lumuri air jeruk nipis, diamkan sebentar.2. Bumbu Oles: Aduk semua bahan olesan hingga tercampur rata.3. Lumuri potongan ayam dengan Bumbu Oles sambil remas-remas hingga bumbu meresap. Diamkan selama 30 menit.4. Panaskan panggangan di atas bara api. Panggang potongan ayam di atas bara api hingga matang dan kecokelatan kedua sisinya lalu angkat.5. Sajikan dengan Sambal dan lalapan sesuai selera.6. Sambal : Goreng bahan sambal kecuali garam hingga sedikit layu. Angkat dan tiriskan.7. Tumbuk bahan sambal bersama garam hingga halus. Untuk 8 porsi Tips: 1. Untuk membuat ayam bakar rumahan ini sebaiknya dipakai ayam negeri yang beratnya sekitar 1 kg. Ayam negeri banyak mengandung air dan lemak sehingga jika ukuran terlalu kecil mudah gosong.2. Saat membakar ayam, atur agar bara api tak terlalu besar dan balik sesekali agar ayam kering dan matang.3. Ayam juga bisa dipanggang dengan panggangan gas portabel."
25,https://food.detik.com/info-kuliner/d-5234348/bikin-laper-segarnya-shabu-shabu-kuah-tomyum-dengan-daging-juicy,Bikin Laper! Segarnya Shabu-shabu Kuah Tomyum dengan Daging Juicy," Slurrrp! Ncess Nabati dan Asyraf Jamal kali ini berkuliner di kawasan Serpong. Mereka dimanjakan enaknya sajian shabu-shabu. Sulit sekali menolak serunya sensasi makan all you can eat. Shabu-shabu dengan aneka isian mulai daging, sayuran, bakso hingga mie bikin Ncess Nabati dan Asyraf tergoda datang ke resto all you can eat. Apa saja yang disantap? Perjalanan tim Bikin Laper kali ini menjajal makan di restoran all you can it dengan pilihan daging dan sayuran ala shabu-shabu. Kuahnya tomyam dan kolagen yang bikin makan jadi makin nikmat. ""Haiiii, kali ini kita mau makan shabu-shabu all you can it. Di sini ada dua kuah, kolagen dan tomyam. Yuk kita makan,"" celoteh Ncess Nabati. Sebelum makan, Ncess Nabati dan Asyraf lebih dulu memilih aneka pelengkap shabu-shabu mulai dari sayuran, aneka bakso dan pastinya irisan daging. Resto yang mereka datangi kali ini adalah Kitamura Shabu-shabu yang terkenal dengan paket makan sepuasnya mulai dari Rp 99 ribuan. Tak mau lama digoda aroma kuah segar, Ncess Nabati langsung saja memasukkan isian ke dalam kuah kaldu untuk dimasak hingga matang. Daging sapi pun tak ketinggalan dimasak lalu disantap. ""Udah lama nggak makan ginian, rasanya enak banget. Ini harus dimakan pakai sausnya. Ancaman!"" kata Ncess Nabati. Sayuran, aneka bakso dan mie yang dimasak pun bikin Asyraf tak berhenti ngunyah. ""Seger banget ini kuahnya. Pedes enak, dagingnya juga, sayurannya juga seger,"" ujar Asyraf. Lidah tak berhenti ngunyah sampai mulut kedua tukang makan ini penuh. Tampilan makanan shabu-shabu yang disantap pun tak kalah menggoda para penonton. Mau tau rekomendasi tempat makan lainnya? Jangan lupa saksikan Bikin Laper yang tayang setiap hari pukul 17.00 WIB hanya di Trans TV. Siap-siap lapar!"
26,https://food.detik.com/info-kuliner/d-5234218/mewahnya-dapur-dr-gladys-mirip-hotel-bintang-5,"Mewahnya Dapur dr. Gladys, Mirip Hotel Bintang 5"," Dokter Gladys dikenal sebagai dokter sekaligus pengusaha klinik. Rumahnya megah, dilengkapi dapur mewah mirip hotel bintang 5. Pengusaha klinik kecantikan asal Cianjur ini kerap membagikan foto dan video suasana di rumahnya. Setelah sempat membuat heboh netizen dengan ruang penyimpanan outfitnya, kini dr. Gladys menunjukkan area dapur di rumahnya. Dokter berhijab yang murah senyum ini ternyata punya dapur super luas dan dilengkapi dengan berbagai alat masak canggih. Setiap hari ada para pekerja yang sibuk meracik makanan untuk dikonsumsi dr. Gladys dan keluarganya. ""Selamat pagi semuanya. Pemandangan bangun tidur, turun ke bawah udah pada sibuk,"" kata dr. Gladys dalam video yang diunggah lewat Tiktok. Di sini dr. Gladys menunjukkan area dapur yang luas. Terlihat beberapa pekerja yang mengenakan seragam ala chef sudah sibuk meracik makanan. Dr. Gladys juga menjelaskan kalau di rumahnya memiliki dapur dengan area terpisah. Ada area dapur bersih dan area dapur kotor. Dapur bersih dijadikan tempat untuk menyiapkan makanan yang sudah siap diolah dan akan disajikan. Sementara area dapur kotor dijadikan tempat menyiapkan bahan mentah yang akan dimasak jadi hidangan. Pagi ini dr. Gladys sarapan dengan menu steak dilengkapi mashed potato, sayuran dan saus mushroom. Terlihat menu ini sedang ditata oleh salah satu chef pribadinya. Tampilan makanannya mirip seperti sajian ala restoran. Unggahan video ini langsung menyedot perhatian netizen. Video ini sudah dilihat lebih dari 3,2 juta kali dan mendapat ribuan komentar. Beberapa netizen bahkan menawarkan diri agar bisa bekerja di dapur dr. Gladys. ""Dapur kotornya aja bersih, gw dapur bersihnya kotor wkwkwk,"" kata netizen. ""Dok, beneran ada lowongan? saya lulusan jasa boga dan ada pengalaman kerja di hotel dan restaurant dan saya jg bisa dibidang pastryBakery, western food,"" tanya netizen yang berniat menjadi staf dapur Dr. Gladys. ""Dia makannya wortel aja dibuat heart shape, yg wortelnya dipotong acak adul mundur buat daftar kerjanya,"" pungkas netizen. Dr. Gladys kini memang dikenal sebagai dokter sukses. Selain klinik kecantikan yang punya banyak pasien, ibu 3 anak ini juga dikenal sebagai influencer. Bersama sang suami yang juga berprofesi sebagai dokter, dr. Gladys pernah menceritakan jalan hidupnya. Ia pernah hidup susah dan pas-pasan sebelum akhirnya sukses seperti saat ini. "
