,url,title,content
32,https://sport.detik.com/sport-lain/d-5227621/khabib-dan-justin-gaethje-habis-duel-saling-puji,"Khabib dan Justin Gaethje, Habis Duel Saling Puji"," Khabib Nurmagomedov mampu kalahkan Justin Gethje di UFC 254 Setelah pertarungan keras, keduanya saling melempar pujian! Khabib Nurmagomedov tumpaskan Justin Gaethje pada UFC 254 di Fight Island, Abu Dhabi, Minggu (25/10) dini hari WIB. Khabib menghempaskan Justin di ronde kedua. Petarung asal Dagestan itu bisa menyergap Justin Gaethje lewat sergapan setelah menerima low kicks. Khabib lantas melakukan triangle choke yang membuat Justin menyerah. Kedua petarung tersebut pun begitu respek dan saling menghormati. Sebelum bertarung, keduanya malah saling melempar pujian. Bahkan ketika pertarungan usai, Justin Gaethje menghampiri Khabib Nurmagomedov yang sedang bersimpuh. Ya, Khabib masih merasa sedih kehilangan sang ayah Abdulmanap Nurmagomedov yang tutup usia di bulan Juli karena penyakit jantung. Justin memeluk Khabib, menguatkannya. Khabib Nurmagomedov lalu tak lupa mengucap terima kasih kepada Justin Gaethje. Rupanya, keduanya sudah berteman lama. ""Terima kasih saudaraku. Saya tak akan pernah lupa tahun 2016 saat berusaha menurunkan berat badan,"" kata Khabib. ""Di luar octagon ini, kamu adalah orang yang sangat baik. Saya tahu semua hal tentang kamu, saya tahu bagaimana kamu memperlakukan orang-orang terdekatmu,"" lanjutnya. Khabib Nurmagomedov yang kini memutuskan pensiun dari UFC dengan rekor sempurna sebagai juara kelas ringan dan punya rekor kemenangan 28-0, memberikan motivasi ke Justin Gethje. Dia ingin melihat Justin lebih cemerlang lagi kariernya. ""Suatu hari ini akan terjadi (sambil menunjuk ke sabuknya seolah bilang kalau Justin bakal menjadi juara-red),"" ucap Khabib. ""Karena, kita semua tidak pernah tahu apa yang terjadi besok. Kita tak pernah tahu,"" tambah Khabib. Justin Gaethje kini punya rekor 22-3. Justin Gaethje juga memuji Khabib Nurmagomedov sebagai petarung terbaik di dunia. ""Dia adalah petarung terbaik di dunia. Siapa yang tidak tahu dengan hal itu,"" balas Justin. ""Khabib membuat ayahnya bangga,"" tutupnya. Respek!   Tonton video ""Janjinya Pada Sang Ibu, Jadi Alasan Khabib Nurmagomedov Pensiun"" di sini: [Gambas:Video 20detik]  "
33,https://sport.detik.com/sport-lain/d-5227610/presiden-ufc-kami-harus-buat-patung-khabib-nurmagomedov,Presiden UFC: Kami Harus Buat Patung Khabib Nurmagomedov," Khabib Nurmagomedov menutup karier di UFC dengan sempurna, tak pernah kalah. Presiden UFC, Dana White sampai bilang harus membuat patungnya. Khabib Nurmagomedov mampu mengalahkan Justin Gaethje pada UFC 254 di Fight Island, Abu Dhabi, Minggu (25/10) dini hari WIB. 'The Eagle' menghempaskan 'The Highlight' di ronde kedua. Khabib melakukan triangle choke yang membuat Justin Gaethje tak berdaya. Khabib mampu mempertahankan sabuk juara kelas ringan plus punya rekor kemenangan 29-0 alis tak pernah kalah! Presiden UFC, Dana White begitu melemparkan pujian kepada Khabib Nurmagomedov. Baginya, begitu beruntung para pecinta tarung bebas bisa menyaksikan pertandingan terakhir Khabib. ""Khabib seperti bukan Khabib yang biasanya. Dari cara dia berjalan, berat nafasnya, dan semuanya, wow. Kita semua adalah orang-orang yang beruntung bisa menyaksikan pertandingan terakhirnya,"" ujar Dana White. ""Khabib Nurmagomedov begitu luar biasa. Di ronde pertama dia nyaris menyelesaikannya dan di ronde kedua dia terus menekan lalu melakukan triangle choke. Dia tak pernah kalah di setiap rondenya, luar biasa,"" lanjutnya. Khabib Nurmagomedov sendiri sebenarnya masih dirundung duka. Tak ayal, Juli kemarin sang ayah tercinta Abdulmanap Nurmagomedov meninggal dunia akibat penyakit jantung. Khabib begitu emosional kala pertandingan selesai, Khabib sampai bersimpuh dan menangis. ""Setelah apa yang terjadi kepada ayahnya, dia masih bisa melakukan ini semua,"" ujar Dana. Dana White menambahkan, Khabib Nurmagomedov layak diberi titel petarung UFC terbaik sepanjang masa. Khabib begitu berbahaya di dalam octagon, serta begitu merendah di luar octagon. ""Dia pantas mendapatkan gelar petarung pound-for-pound terbaik. Sungguh, dia pantas menyandang status GOAT (Greatest of all time),"" kata Dana White. ""Kami harus membuat patungnya,"" tutup Dana."
34,https://sport.detik.com/sport-lain/d-5227595/khabib-nurmagomedov-pensiun-dari-ufc,Khabib Nurmagomedov Pensiun dari UFC," Khabib Nurmagomedov kalahkan Justin Gaethje dan mempertahankan sabuk juara kelas ringan UFC. Kini, 'The Eagle' pun pensiun dari dunia tarung bebas. UFC 254 menyajikan Khabib Nurmagomedov vs Justin Gaethje pada Minggu, 25 Oktober dini hari WIB di Fight Island, Abu Dhabi. Khabib 'The Eagle' pemegang sabuk juara kelas ringan bakal coba mempertahankan titel itu dari Justin 'The Highlight' selaku juara interm kelas ringannya. Khabib Nurmagomedov cuma butuh dua ronde dari lima ronde pertandingan. Petarung asal Dagestan itu melakukan triangle choke ke Justin! Khabib Nurmagomedov makin mengukuhkan diri sebagai juara kelas ringan UFC. Tak cuma itu, rekor kemenangannya bertambah dan tak ternoda, 29-0. Setelahnya, perasaan Khabib Nurmagomedov campuk aduk. Dirinya tentu senang bukan main, tapi lain sisi dirinya tak mampu membendung air mata karena kali ini Khabib bertarung tanpa adanya kehadiran sang ayah, Abdulmanap Nurmagomedov. Bahkan, Khabib juga mengeluarkan pernyataan mengejutkan. Dia pensiun dari UFC! ""Hari ini saya katakan, saya pensiun dari UFC,"" ujar Khabib. ""Setelah ayah saya meninggal, ibu saya bilang untuk tidak bertarung lagi. Saya bilang kepadanya, bahwa ini akan menjadi pertandingan terakhir. Saya harus memegang janji saya,"" lanjutnya. Khabib Nurmagomedov banyak mengucapkan terima kasih kepada seluruh rekan-rekan timnya. Dia pun berharap, UFC menjadikannya sebagai petarung terbaik sepanjang masa. ""Saya rasa saya pantas mendapat gelar petarung pound-for-pound terbaik dan tak terkalahkan sepanjang masa dari UFC. Saya pantas mendapatkannya,"" kata Khabib. ""Ini adalah akhir karier saya,"" tutupnya lalu meninggalkan sarung tangan UFC-nya di kanvas."
35,https://sport.detik.com/sport-lain/d-5227589/dan-khabib-nurmagomedov-menangis,Dan Khabib Nurmagomedov Menangis," Khabib Nurmagomedov mengalahkan Justin Gaethje di UFC 254. Air matanya tak terbendung, 'The Eagle' menangis sejadi-jadinya mengingat mendiang sang ayah. UFC 254 Khabib Nurmagomedov vs Justin Gaethje berlangsung pada Minggu, 25 Oktober pukul 03.45 WIB di Fight Island, Abu Dhabi. Khabib 'The Eagle' pemegang sabuk juara kelas ringan bakal coba mempertahankan titel itu dari Justin 'The Highlight' selaku juara interm kelas ringannya. Ronde pertama, Khabib Nurmagomedov meladeni permainan atas Justin Gaethje. Low kicks Justin juga cukup merepotkan Khabib. Khabib Nurmagomedov akhirnya mampu menumpaskan Justin Gaethje di ronde kedua 1 menit 34 detik. Petarung asal Dagesta itu melakukan triangle choke yang membuat Justin Gaethje tak berdaya.  [Gambas:Instagram]  Begitu wasit menghentikan pertarungan, Khabib Nurmagomedov tidak teriak-teriak atau berlari-lari kegirangan. Dia meminta timnya tenang, lalu bersimpuh. Khabib Nurmagomedov menangis...  [Gambas:Instagram]  Khabib Nurmagomedov tak kuasa menahan kesedihannya. Ya, bulan Juli lalu, dia ditinggalkan sang ayah Abdulmanap Nurmagomedov yang tutup usia akibat penyakit jantung. Khabib dikenal begitu dekat dengan mendiang ayahnya. Bahkan, ayahnya juga yang sudah mengajarkan Khabib bergulat sedari kecil. Mediang Abdulmanap begitu tegas dan keras dalam mendidik Khabib. Bukan cuma menjadi seorang petarung, tapi juga menjadi seorang pria. Khabib Nurmagomedov pun begitu mencintai mendiang ayahnya. Baginya, sosok Abdulmanap tidak akan pernah tergantikan oleh siapapun. Justin Gaethje pun merangkul Khabib Nurmagomedov dan mencoba menguatkannya. Seluruh tim UFC, memberikan tepuk tangan untuk menghibur Khabib. ""Alhamdulillah Tuhan memberiku segalanya. Terimakasih kepada tim saya dan ayah saya yang sudah bersama lebih dari 20 tahun (menemani karier Khabib di dunia tarung bebas-red),"" ujar Khabib selepas pertandingan. Justin Gaethje pun kembali menguatkan Khabib. Menurutnya, mendiang Abdulmanap pasti bangga dengan 'The Eagle'. ""Dia adalah pertarung terhebat di dunia. Ayahnya pasti bangga dengannya,"" kata Justin."
36,https://sport.detik.com/sport-lain/d-5227587/khabib-nurmagomedov-kalahkan-justin-gaethje,Khabib Nurmagomedov Kalahkan Justin Gaethje!," Khabib Nurmagomedov mempertahankan sabuk juara kelas ringan dari Justin Gaethje. Di ronde kedua, Khabib menyelesaikan duelnya dengan triangle choke. UFC 254 Khabib Nurmagomedov vs Justin Gaethje berlangsung pada Minggu, 25 Oktober dini hari WIB di Fight Island, Abu Dhabi. Khabib 'The Eagle' pemegang sabuk juara kelas ringan bakal coba mempertahankan titel itu dari Justin 'The Highlight' selaku juara interm kelas ringannya. Di ronde pertama, Khabib Nurmagomedov meladeni pertarungan pertarungan stand up Justin Gaethje. Khabib melancarkan beberapa jab dan tendangan ke badan. Justin Gaethje coba menjaga jarak dengan low kicks. Beberapa pukulan hook-nya juga cukup menyulitkan Khabib. Di akhir ronde pertama, Khabib bermain gulat. Dia menekan Justin sampai ke jaring dan mencoba menndominasi, tapi cuma 40 detik tersisa dan itu tidak cukup merepotkan Justin. Di babak kedua, Khabib Nurmagomedov langsung menekan Justin Gaethje ke jaring. Justin sempat kembali menyerang kakinya Khabib, Khabib terjatuh tapi langsung menggunakan momen itu untuk menyergap takedown Justin. Khabib awalnya ingin mengunci lengan Justin, Justin coba bertahan. Namun Khabib berpindah, tak terduga melakukan triangle choke. Triangle choke adalah teknik kuncian yang berbahaya. Khabib melakukannya dengan sempurna, meraih salah satu lengan Justin, melontarkan kaki di atas pundak Justin dan menciptakan segitiga dengan kakinya bak menguncinya. Justin Gaethje menyerah, berkali-kali melakukan tap. Khabib Nurmagomedov kembali mempertahankan sabuk juara kelas ringan UFC!  [Gambas:Instagram]  Khabib memenangi duelnya di ronde kedua 1 menit 34 detik. Rekor kemenangannya tak ternoda, menjadi 29-0! Setelah pertarungan, Khabib menangis. Tak ayal, kali ini dia merasakan kembali kemenangan tanpa didampingi ayah tercinta, Abdulmanap yang tutup usia di bulan Juli kemarin akibat penyakit jantung. Khabib Nurmagomedov layak menjadi petarung UFC terbaik sepanjang masa. Selamat 'The Eagle'!"
