,url,title,content
0,https://food.detik.com/foto-kuliner/d-5219693/santainya-taqy-malik-saat-makan-di-pesawat-dan-ngemil-kurma-muda,Santainya Taqy Malik Saat Makan di Pesawat dan Ngemil Kurma Muda,Jakarta - Pengusaha muda Taqy Malik resmi meminang Sherel Thalib. Pria yang sering bolak-balik ke Mekkah ini juga sering menunjukkan momen makannya.
1,https://food.detik.com/foto-kuliner/d-5219516/renald-ramadhan-saat-asyik-ngopi-dan-ngemil-di-lokasi-syuting,Renald Ramadhan Saat Asyik Ngopi dan Ngemil di Lokasi Syuting,Jakarta - Renald Ramadhan jadi sorotan karena ditangkap terkait narkoba. Pesinetron muda ini diduga menggunakan narkoba jenis ganja.
2,https://food.detik.com/info-kuliner/d-5220007/perjalanan-diet-daffa-hingga-sukses-turunkan-20-kilogram,Perjalanan Diet Daffa hingga Sukses Turunkan 20 Kilogram," Banyak kisah diet sukses yang menginspirasi. Salah satunya datang dari pria bernama Daffa yang berhasil menurunkan bobot badannya sampai 20 kilogram. Seperti apa trik dietnya? Kepada detikFood, pria yang akrab disapa Daf ini membagikan pengalamannya menjalani program diet. Diakui Daf, bukan hanya berat badan yang turun tapi juga ia merasa tubuhnya lebih sehat dan segar. Daf yang juga berbisnis soto Banjar ini mengaku berat badannya bisa susut hingga 20 kilogram dalam waktu 4 bulan. Kisahnya yang dibagikan lewat twitter pun sukses menarik banyak perhatian.  Kepada detikFood, Daf mengaku semasa SMA punya berat badan ideal. Berat badannya berkisar di angka 59-60 kilogram. Ia juga tak pernah punya pengalaman overweight sedari kecil. Padahal saat itu pola makannya bisa disebut tidak terlalu sehat. ""Pola makan sebelum ujian-ujian menuju SNMPTN itu sebenarnya ga sehat-sehat banget kok, malah suka nongkrong sama temen SMA. Mungkin karena diimbangi olahraga juga (karena pada saat itu ada ujian olahraga juga) jadi BB stabil,"" beber Daf. Berat badannya mulai melonjak setelah ia gagal lolos ujian masuk universitas negeri. Efeknya stress yang berdampak pada kacaunya pola makan. ""Disini, ibu saya berperan besar dalam menangani ini dengan cara mengajak saya untuk ngemall tiap hari (biar ngga sedih gitu) jadi mau ga mau tiap hari pasti makannya yang aneh2 dan kurang sehat,"" lanjut Daf.  Pelampiasan rasa sedih Daf juga mempengaruhi hobinya makan dessert. Ia menganggap dessert sebagai makanan wajib yang disantapnya setiap hari. Kandungan gula yang tinggi pada dessert ini turut andil menambah berat badan Daf. Sampai akhirnya, hanya dalam waktu sebentar saja beratnya naik hingga 70 kilogram. Bahkan pernah mencapai titik tertinggi di angka 80 kilogram. ""Karena pada saat itu saya tidak terlalu memperhatikan badan, prinsip saya pada saat itu ""yang penting bahagia"" dan menurut saya bahagiaku ada di makanan. Jarang banget makan makanan sehat pokoknya,"" beber Daf.  Penampilan Daf yang berubah drastis dalam waktu singkat ini membuat teman-temannya pangling. Tak sedikit yang bahkan menjauhi Daf karena tampilan fisiknya. Tak hanya itu, ia juga mengalami berbagai masalah kesehatan mulai dari susah buang air besar hingga kondisi wajah yang berjerawat. Dari sini, Daf berkomitmen untuk memulai diet dengan memperbaiki pola makannya. ""Kalau faktor luar sih karena sempat dibully secara tidak langsung oleh teman- teman yang kaget karena saya naik drastis, dan pada saat itu tidak ada yang mau berteman dengan saya. akhirnya saya sadar kalo ""good looking"" itu memang dibutuhkan dalam hal apapun.""   Daf mengaku berat badannya yang berlebih ini menimbulkan gejolak dari dalam diri untuk lebih ingin hidup sehat dan kembali ke berat badan awal. ""Yang memotivasi buat diet sih intinya pengen aja balik ke BB awal, karena lama-lama makin aneh bentuk badan ini dan juga mulai terlihat beberapa strechmark di area badan,"" kata Daf. Tentu tidak mudah bagi Daf untuk mengembalikan berat badannya, ia sadar betul soal usaha yang harus ditempuhnya. Beberapa kali Daf sempat merasa putus asa tetapi ia selalu sadar akan pentingnya kesehatan ""Pernah beberapa kali pengen give up aja sama diet, karena ngerasa belum ada hasil. Tapi saya balik lagi karena sudah berkomitmen diawal, dan ini masih awal perjalanan jadi tidak seharusnya saya berhenti."" Terbiasa makan dengan bebas tanpa pantangan tentu membutuhkan kontrol diri ketika semua harus dibatasi. Ada kalanya orang yang diet mengalami cranky atau bahkan perubahan mood secara tiba-tiba karena kesal tak bisa makan apa yang menjadi kesukaannya. Bagi Daf, diet yang dijalaninya ini tidak membuat ia uring-uringan. Daf punya siasat mengatasinya dengan cara cheating setiap akhir pekan. Ia bebas makan apapun saat akhir pekan. Namun di hari biasa, ia hanya bisa mengonsumsi 2 sendok makan nasi dengan banyak lauk sayuran. ""Jujur pada saat itu yang selalu aku tunggu yaitu cheating day, karena saya memberi kebebasan untuk diri sendiri agar bisa cheating di tiap weekend. jadi setidaknya ada batasan dan kebebasan untuk diri saya sendiri,"" beber Daf. Yang harus ditekankan yakni komitmen untuk mencapai tujuan. Daf bersyukur memiliki badan yang mudah beradaptasi dengan pola makan yang dijalani. Ia pun sampai saat ini mengaku merasa tubuhnya jauh lebih sehat dan bugar. "
3,https://food.detik.com/info-kuliner/d-5219728/5-momen-seru-kakek-nenek-inggris-saat-cicip-makanan-indonesia,5 Momen Seru Kakek Nenek Inggris Saat Cicip Makanan Indonesia," Wanita Indonesia yang tinggal di Inggris ini mengajak mertuanya untuk mencicipi makanan Indonesia. Begini momen seru mereka! Banyak orang Indonesia yang menetap di luar negeri dan membagikan aktivitas mereka lewat konten video yang diunggah ke YouTube. Seperti wanita bernama Yuni ini melalui channel YouTube YuniLeisure. Ia membagikan aktivitasnya di Inggris bersama sang suami dan keluarga kecilnya. Mulai dari berbelanja ke pasar, memasak, hingga mengajak mertuanya yang sudah lansia mencicipi aneka makanan khas Indonesia yang dibuatnya. Makanan yang telah dicicip sang mertua sangat banyak. Di antaranya seperti sate ayam, gado-gado, hingga bihun goreng. Sate merupakan makanan khas Indonesia yang banyak tersebar di Indonesia dan jenisnya beragam. Salah satu yang populer adalah sate ayam. Berupa potongan daging ayam yang ditusuk dan dipanggang di atas arang panas. Setelah itu disajikan dengan saus kacang yang manis gurih. Tak hanya itu diberikan juga taburan bawang merah goreng dan acar timun. Nah, sate ayam yang jadi favorit banyak orang Indonesia ini dicicipi oleh kakek nenek dari Inggris berikut. Tapi saat itu kakek nenek Inggris ini tak menikmatinya dengan saus kacang, melainkan dengan sambal. Mertua perempuan Yuni ini mengaku kalau ia suka sate ayam dengan sambal tomat. Baca Juga: Pertama Kali Cicip Sambal Terasi dan Snack Indonesia, Ini Komentar NCT  Bihun goreng juga makanan yang umum ada di Indonesia. Berupa mie beras yang digoreng dengan campuran sayur atau daging. Yuni membuat sendiri bihun goreng nya dan disajikan untuk mertuanya yang merupakan orang Inggris. Tak hanya bihun goreng yang disajikan oleh Yuni. Ada juga telur dadar goreng gaya Indonesia. Bukan telur dadar ala Barat atau yang biasa disebut omelet. Kakek dan Nenek Inggris ini tampak lahap menyantap bihun goreng dengan campuran tomat. Walaupun baru pertama kali menyantap bihun, tapi kakek nenek ini sangat menyukainya. Bahkan mereka melahap bihun goreng sampai habis tak tersisa.  Mie goreng instan yang populer di Indonesia adalah dari merek Indomie. Mie instan ini bahkan populer di berbagai negara. Walaupun sudah tinggal di Inggris, tapi mie instan favoritnya tetap Indomie. Ia pun meminta mertuanya untuk mencicipi Indomie rasa mie goreng. Indomie goreng tersebut diolah lagi dengan campuran wortel, kacang polong, selada bokor, dan sosis. Kakek dan nenek Inggris ini pun akhirnya mencicipi Indomie goreng untuk pertama kalinya. Sang kakek mengatakan kalau rasanya enak. ""Enak, hmm nggak bisa ngomong angkat lengan aja hihi,"" ujarnya. Nasi bakar juga sangat populer di Indonesia. Berupa nasi gurih yang ditambahkan campuran seperti ayam, ikan teri, olahan ikan, dan lainnya. Dibungkus daun pisang lalu dibakar. Tapi, kali ini Yuni membuatnya dengan isian bayam, kacang polong, wortel, dan potongan tomat. Untuk lauknya, Yuni memasak sate ayam polos. Nasi bakar ini juga pertama kali dicicipi oleh kakek dan nenek Inggris. Tapi sayangnya sang nenek tak begitu menyukainya, ia mengatakan kalau lebih menyukai bihun goreng. Namun sang kakek menyukainya, bahkan mengapresiasi masakan menantunya itu. ""Enak.. selalu menyenangkan datang ke sini Yuni,"" ujar sang kakek yang bernama Bry. Gado-gado merupakan makanan Indonesia berupa aneka sayuran rebus yang disajikan dengan saus kacang. Banyak yang mengatakan kalau gado-gado adalah salad dari Indonesia. Untuk itu Yuni membuatkannya untuk sang mertua. Ia harap mertuanya itu suka karena salad sudah biasa disantap oleh mereka. Gado-gadonya dibuat dari sayuran kentang, wortel, selada, timun, dan taoge. Ada juga tambahan telur rebus. Lalu saus kacangnya Yuni buat dari selai kacang Skippy yang direbus dengan air panas. Untuk lauknya ia membuat tempe goreng tepung. Walaupun sajiannya berbeda dengan salad yang ada di Inggris, tapi kakek Bry dan nenek Di nampak menikmatinya. Mereka mengatakan, ""Sangat enak Yuni, terima kasih. Iya berbeda, tapi kami menikmatinya,"" ujar mereka. Baca Juga: 5 Momen Seru Bule Barcelona Pertama Kali Cicip Makanan Indonesia "
4,https://food.detik.com/info-kuliner/d-5219552/5-pilot-alih-profesi-jadi-penjual-dan-pengantar-makanan-saat-pandemi,5 Pilot Alih Profesi Jadi Penjual dan Pengantar Makanan Saat Pandemi," Penerbangan dibatasi selama masa pandemi, banyak pilot yang alih profesi. jadi penjual mie ayam sampai jadi pengantar makanan untuk menyambung hidup. Semenjak pandemi Corona menyebar ke seluruh dunia, hampir semua penerbangan dibatasi membuat banyak pilot kehilangan pekerjaan. Ada beberapa pilot yang justru beralih profesi dari keahlian mereka. Beberapa di antaranya memutuskan untuk memulai bisnis makanan kecil-kecilan seperti mie ayam. Lalu ada juga pilot yang alih profesi menjual kue dan dessert untuk membantu usaha sang istri. Selain berjualan makanan, banyak juga pilot yang mengisi waktu luang mereka sebagai pengantar makanan. Dilansir dari berbagai sumber berikut lima kisah pilot yang alih profesi menjadi penjual dan pengirim makanan.  1. Pilot Jualan Mie Ayam Seorang pilot bernama Megah Putra Perkasa sempat viral beberapa waktu yang lalu karena kisah insipiratifnya. Ia merupakan pilot yang terdampak pandemi Corona, namun ia tak putus asa apalagi menyerah. Megah memutuskan untuk beralih profesi menjadi penjual mie ayam untuk menambah penghasilannya. Lewat Instagramnya, ia mulai memasarkan mie ayam rumahan buatannya. Jika dulu ia sibuk memegang kendali pesawat, kini ia mahir meracik mie dan menggunakan alat masak lainnya. Kisah perjuangannya ini berbuah manis, satu bulan berjualan di rumah, kini ia berhasil membuka gerai pertamanya di ruko yang ada di BSD, Tangerang. Baca Juga: Demi Bertahan Hidup, Pilot Ini Banting Setir Jualan Mie Ayam  2. Bantu Jualan Dessert Seorang pilot asal Malaysia bernama Syed membagikan pengalamannya setelah alih profesi dari pilot menjadi penjual dessert. Syed merupakan salah satu pilot yang terdampak saat pandemi. Ia sudah tidak digaji semenjak bulan Maret oleh maskapai penerbangannya, akhirnya ia memutuskan untuk berhenti bekerja. Selain itu ia mulai membantu istrinya berjualan dessert dan aneka kue buatan rumah. Selain membantu sang istri berjualan makanan, Syed juga membiasakan hidup sederhana. Ia mulai mengurangi pengeluarannya dan fokus mengembangkan usaha makanannya bersama sang istri.  3. Jualan Dim Sum Online Makanan online masuk ke dalam salah satu usaha yang paling diminati sejak pandemi Corona membatasi aktivitas orang-orang di luar rumah. Peluang ini kemudian dikembangkan oleh pilot asal Filipina. Pilot asal Filipina bernama Ralph Ricardo dan sang istri yang juga merupakan seorang pramugari, memutuskan untuk beralih profesi dan berjualan dim sum online untuk menyambung hidup mereka. ""Jika kami tidak terbang artinya kami tidak digaji. Saat ini penerbangan sangat dibatasi selama pandemi, akhirnya kami harus mencari jalan lain untuk menambah penghasilan sehari-hari,"" jelas Ricardo.  4. Pilot Pesawat Jet Antar Makanan Kisah yang satu ini datang dari Thailand, di mana seorang pilot pesawat jet komersial memutuskan untuk alih profesi menjadi pengantar makanan. Selama masa pandemi berlangsung, penghasilannya menurun drastis. Karenanya pilot bernama Kritee Youngfuengmont ini, terpaksa mencari usaha lain untuk bertahan hidup dan memenuhi kebutuhan sehari-harinya. Akhirnya ia memilih pekerjaan sebagai pengantar makanan. Ia tak ambil pusing dan terus menjalani pekerjaan barunya ini walaupun sebelumnya ia memiliki pekerjaan bergengsi. Baca Juga: Pilot Pesawat Jet Ini Tak Gengsi Jadi Pengantar Makanan Demi Uang  5. Pengantar Makanan di Tengah Pandemi Kisah selanjutnya datang dari Malaysia, seorang pilot bernama Anwar Ajid harus kehilangan pendapatannya setelah ia dirumahkan sejak awal masa pandemi. Pilot yang sudah menerbangkan pesawat lebih dari 10 tahun ini akhirnya memutuskan untuk beralih profesi. Kini Anwar menekuni pekerjaan barunya sebagai pengantar makanan. Ia tidak gengsi atau malu dengan pekerjaannya yang sekarang. Menurutnya ia harus mencari uang segiat mungkin karena istri dan anaknya di rumah. Sambil mengantar makanan, Anwar juga rajin melamar pekerjaan di berbagai perusahaan."
5,https://food.detik.com/info-kuliner/d-5219431/ngidam-burger-five-guys-netizen-indonesia-ini-terbang-ke-singapura,"Ngidam Burger 'Five Guys', Netizen Indonesia Ini Terbang ke Singapura"," Ngidam makanan memang sulit ditahan. Seperti netizen Indonesia ini yang rela terbang ke Singapura bersama ibunya demi burger Five Guys. Saat seseorang sudah jatuh cinta dengan suatu makanan, berbagai cara akan mereka lakukan demi mencicipi kembali makanan itu. Tapi bagaimana jika makanan itu sulit dijangkau? Ada yang lokasinya di luar kota atau luar negeri. Banyak orang mungkin mengubur rasa ngidam makanan itu, tapi ada tidak dengan netizen TikTok, Willy Giovanni. Ia mengunggah video berjudul ""Beli burger check"" pada September 2020. Videonya viral hingga sudah ditonton lebih dari 24 ribu kali saat berita ini ditulis. Video singkat ini menceritakan perjalanan singkat Willy dan ibunya ke Singapura demi beli burger. ""Jadi waktu itu mamaku kangen FIVE GUYS BURGER! Kebetulan di Singapore baru aja buka,"" tulis Willy. Ia diminta sang ayah untuk menemani ibunya. Mereka menginap dua hari satu malam di Singapore Marriott Tang Plaza Hotel. ""Biar hemat hotel,"" lanjutnya. Tak langsung beli burger, hari pertama Willy menemani ibunya belanja tas branded warna pink. Ia memperlihatkan bagaimana ibunya sangat bahagia. Barulah esok paginya merek makan Five Guys Burger. Di Singapura gerai burger asal Amerika Serikat ini berlokasi di Plaza Singapura. Baca Juga: 5 Gerai Burger Paling Enak dan Terkenal di Amerika  Terlihat Willy memesan setangkup burger dan segelas milkshake. Burgernya menggugah selera dengan patty tebal dan irisan dua tomat segar serta potongan bawang bombai di atasnya. Kegiatan Willy berlanjut hingga ke malam hari. ""Malamnya belanja di Changi bentar terus pulang Indo. Siapa yang doyan FIVE GUYS BURGER juga?,"" tutup netizen yang tinggal di Surabaya ini. Netizen ramai mengomentari unggahan Willy. Kebanyakan menyetujui betapa nikmatnya Five Guys Burger. Salah satunya issawest yang menulis, ""Five guys ga ada obat."" Lalu ada juga netizen J yang bilang, ""Milkshakenya the best."" Five Guys Burger sendiri merupakan salah satu restoran burger mendunia. Sejarah merek ini berawal dari tahun 1986 di Virginia. Konsepnya berupa restoran cepat saji yang menyajikan burger dan kentang goreng. Menu yang ditawarkan adalah burger Amerika klasik seperti burger dengan keju dan bacon panggang. Keistimewaan lain, pengunjung bisa memilih semua topping burger di sini gratis. Tak heran Glenn Alinskie dan Chelsea Olivia menyebut Five Guys Burger sebagai yang terenak di Amerika. Baca Juga: Cicipi 6 Burger Hits di AS, Glenn Alinskie dan Chelsea Ungkap yang Terenak "
6,https://food.detik.com/info-kuliner/d-5219744/dari-arab-martabak-jadi-jajanan-populer-sepanjang-masa,"Dari Arab, Martabak Jadi Jajanan Populer Sepanjang Masa"," Diadaptasi dari kuliner Arab, martabak jadi jajanan favorit sepanjang masa. Disukai semua kalangan, baik yang manis maupun yang gurih. Rasanya yang enak dengan pilihan isian dan topping beragam membuat martabak tak pernah kehilangan penggemarnya di sini. Banyak sejarah menarik seputar perkembangan martabak yang sudah eksis sejak dulu. Baca Juga: Martabak Alam Jaya: Mantul! Martabak Manis dan Telur yang Legendaris Meski belum diketahui pasti kapan pertama kali martabak diciptakan, tapi awal mulanya berasal dari wilayah Arab dan Timur Tengah. Saat itu muncul hidangan Mutabbaq yang memiliki arti 'dilipat'. Dulu Mutabbaq disebut juga sebagai omelette gulung dengan potongan sayuran di dalamnya. Adonan kulit muttabaq yang terbuat dari tepung atau telur ditambah dengan isian yang royal. Isian Muttabaq ini memang tak jauh dari campuran daun bawang, daging cincang yang dikocok dengan telur. Karena rasanya yang enak, dan pengaruh kuliner Arab yang menyebar. Akhirnya hidangan yang satu ini sering disebut sebagai pancake Arab ini populer di Asia Tenggara. Seperti Indonesia, Malaysia, Singapura, Thailand sampai Brunei. Tentunya setiap negara memiliki versi mutabbaq yang berbeda. Di Indonesia sendiri, makanan yang satu ini lebih dikenal dengan nama martabak. Jenisnya lebih variatif karena hampir setiap daerah memiliki jenis dan racikan martabak yang berbeda. Mulai dari martabak manis gaya Bangka, atau martabak telur gaya Aceh atau Padang semuanya memiliki penggemar masing-masing. Kisah dibalik penyebaran martabak telur dan martabak manis di Indonesia juga berbeda. Contohnya martabak telur yang awalnya dipopulerkan oleh seorang pemuda asal Tegal bernama Ahmad bin Abdul Karim. Saat itu Ahmad pergi merantau ke Semarang untuk berjualan di tahun 1930. Ia kemudian menciptakan martabak yang rasanya disesuaikan dengan selera orang Jawa. Sementara untuk martabak manis, awalnya martabak ini dipopulerkan di Bangka Belitung dengan sebutan Hok Lo Pan. Berbeda dengan martabak telur yang erat dengan kuliner Arab, kalau martabak manis dibuat oleh orang keturunan Tionghoa di Bangka. Seiring dengan berjalannya waktu, martabak menjelma menjadi jajanan kaki lima yang populer. Seperti martabak legendaris Encek yang terkenal di Bogor. Kemudian ada juga Martabak Sinar Bulan di Muara Karang yang disebut sebagai martabak terenak di Jakarta, dan jadi langganan para artis dan food vlogger. Kalau mau coba martabak telur yang klasik dan legendaris ada Martabak AA di Jakarta Selatan yang usianya hampir menyentuh angka 40 tahun. Tak hanya yang legendaris, beberapa tahun terakhir mulai banyak gerai martabak kekinian dan premium yang bertebaran di berbagai kota. Karena dari sisi bisnis menguntungkan. Gerai martabak modern ini tak hanya menyajikan martabak manis dan telur saja, tapi juga memadukan makanan hingga aneka topping untuk menghasilkan martabak dengan sentuhan baru. Di ulasan khusus kali ini, detikFood akan membahas tentang ragam martabak dari yang klasik hingga kekinian. Mulai dari cara membuat martabak sederhana di rumah. Rekomendasi martabak hits di berbagai kota, sampai pilihan martabak legendaris yang wajib untuk dicoba. Ikuti terus semua artikelnya di detikFood minggu ini ya! Baca Juga: Martabak AA: Ngemil Martabak Manis dan Telor Klasik yang Ada Sejak 1981"
7,https://food.detik.com/online-food/d-5219453/moro-bakeshop-empuk-lembut-roti-sobek-hingga-semir-dari-resep-1967,Moro Bakeshop: Empuk Lembut Roti Sobek hingga Semir dari Resep 1967," Kalau kangen roti-roti klasik atau jadul, gerai roti online ini bisa jadi pilihan. Tersedia roti sobek, bluder, hingga semir yang dibuat dari resep tahun 1967. Tren kue dan roti memang silih berganti. Terkadang ada pengaruh dari kreasi di luar negeri yang akhirnya digandrungi orang-orang Indonesia. Seperti halnya Korean garlic cheese bread yang viral selama masa pandemi Corona. Roti ini terasa gurih dengan siraman saus bawang putih dan taburan keju. Lalu ada juga Japanese milk bun yang mirip roti kasur Indonesia. Ciri khasnya berwarna pastel cantik lalu diberi isian manis di tengahnya. Namun terlepas dari munculnya tren-tren roti baru atau kekinian, roti jadul khas Indonesia tak pernah surut penggemar. Roti ini selalu dicari karena rasanya ngangenin. Moro Bakeshop hadir membawa konsep roti jadul itu, namun dengan sentuhan kekinian. Disebut jadul karena semua roti masih dibuat menggunakan resep dari tahun 1967. Dihubungi detikFood (19/10), salah satu pendiri Moro Bakeshop yaitu Angel bercerita kalau bakery ini berawal dari toko roti Moro Seneng di Muntilan, Jawa Tengah. Cucu pemilik toko roti itu, Wilianto Arif Pramono ingin memperkenalkan pada orang-orang Jakarta bagaimana cita rasa roti sesungguhnya. Berupa roti jadul yang dibuat tanpa pengawet dan tidak instan. Angel, Wilianto, dan seorang rekannya lagi kemudian mendirikan Moro Bakeshop di Jakarta pada tahun 2019. Bakery ini punya gerai offline di Kelapa Gading. Moro Bakeshop menawarkan ragam roti jadul dengan menu unggulan roti sobek, roti semir, roti bluder, roti pisang, sampai roti jepit. Lalu ada juga bolu mocha nouggat, bolu keju, dan donat sobek. Untuk harga per buahnya mulai dari Rp 12 ribu saja. Selain itu, ada juga roti sobek ukuran loaf yang jadi primadona. Harganya Rp 70 ribu untuk varian manis dan Rp 73 ribu untuk varian asin. detikFood tertarik mencicipi Roti Sobek Loaf Cokelat Keju (Rp 70 ribu) dan Roti Semir (Original dan Chocolate Hazelnut) seharga masing-masing Rp 12 ribu. Tak ketinggalan Roti Bluder (Peanut Keju dan Srikaya) seharga masing-masing Rp 12 ribu dan Bolu Mocha Nouggat Slice (Rp 23 ribu).  Roti sobek loaf berukuran lumayan besar karena terdiri dari 6 bagian yang bisa disobek. Terlihat serat-serat roti begitu tipis dan halus. Untuk tekstur rotinya sangat lembut, fluffy, dan empuk ketika digigit. Tercecap rasa gurih butter yang enak pada adonan rotinya. Lalu ketika disobek, terlihat limpahan isian cokelat dan keju. Untuk cokelatnya lumayan manis dan creamy. Sementara kejunya khas roti jadul yang ada sedikit rasa manisnya. Sementara roti semir adonannya mirip seperti roti sobek. Hanya saja bentuknya mirip bun burger yang bisa dibelah bagian tengahnya. Populer dengan sebutan bagelen basah. Varian original berisi butter spread yang gurih agak manis. Lalu untuk chocolate hazelnut terasa mirip Nutella, namun tidak terlalu pekat. Cocok untuk pencinta kacang cokelat. Roti bluder juga tak kalah enak. Di Moro Bakeshop, roti bentuk piramida ini memiliki adonan yang lebih kasar dan berserat. Pada varian peanut keju dibuat dari selai kacang yang creamy dan keju yang gurih. Sedangkan varian srikaya terasa manis creamy, namun manisnya tak bikin eneg. Terakhir ada Bolu Mocha Nouggat Slice yang tak kalah enak. Berupa bolu gulung empuk yang dilapisi selai cokelat. Lalu di permukannya diolesi krim mocha dan diberikan irisan kacang tanah sangrai. Seluruh roti masih dibuat dengan resep dan cara tradisional. Angel menuturkan untuk roti sobek, proses pembuatannya bisa memakan waktu 8 jam. ""Pertama penghitungan bahan-bahan, adonin bahannya, lalu ke proses pengembangan adonan. Nah pengembangan adonan ini yang menghabiskan waktu sampai 6 jam sendiri,"" kata Angel. Hal inilah yang jadi kunci tekstur roti begitu lembut. Sementara untuk roti semir, Angel menjelaskan, ""Roti semir pakai adonan mirip roti sobek. Kalau robek itu isian, kalau si semir pakai butter atau chocolate spread."" Semua varian roti jadul ini paling bagus disimpan di suhu ruang, tak usah dimasukkan ke dalam kulkas. Roti bisa tahan 2-3 hari. Saat ini Moro Bakeshop bisa menjual 30-40 loaf roti sobek setiap hari. Khusus varian ini, pemesanannya harus pre order karena roti sobek dibuat fresh. ""Kalau yang satuan, sehari bisa total-total lebih dari 100 buah,"" tutur Angel. Menurutnya roti jadul disukai banyak orang karena bisa menjangkau selera orang tua dan anak muda. Nah, kalau tertarik beli, Moro Bakeshop bisa dibeli langsung di gerainya atau via online. Tersedia via layanan ojek online atau situs marketplace ternama. Ingin tempat makan dan produk Anda di-review oleh detikFood? Kirimkan email ke foodreview@detik.com. Moro BakeshopJl. Musik Raya No.B26, Kelapa Gading, Jakarta UtaraInstagram: morobakeshopWhatsApp: 087877331443Tersedia di situs marketplace"
