,url,title,content
0,https://health.detik.com/sexual-health/d-5217755/nggak-perlu-gelap-gelapan-ini-keuntungan-bercinta-dengan-lampu-menyala,"Nggak Perlu Gelap-gelapan, Ini Keuntungan Bercinta dengan Lampu Menyala"," Banyak pasangan yang menginginkan sesi bercinta di kamar dengan lampu yang redup. Banyak yang merasa lebih pede saat bercinta di ruangan yang gelap sebab tak ingin 'kekurangannya' dilihat oleh pasangan. Mulailah keluar dari zona nyamanmu. Bercinta di ruangan yang terang justru bisa bikin momenmu dengan pasangan semakin panas. Mengutip Women's Health, berikut keuntungan dari bercinta dengan lampu yang menyala: Pasangan yang terbiasa mematikan lampu saat bercinta, takkan bisa merasakan serunya memadu kasih di luar kebiasaan. Misalnya, melakukan morning sex atau bercinta di ruangan terbuka. Selain meningkatkan kepercayaan diri, beberapa orang rela menjaga bentuk tubuhnya demi mendapatkan pujian dari sang kekasih. Dengan bercinta di bawah terangnya lampu, kamu bisa memamerkan keindahan bentuk tubuhmu di hadapan pasangan. Setiap pasangan akan lebih mudah terangsang secara visual ketimbang verbal, terutama bagi para pria. Meski demikian, sentuhan dan stimulasi verbal juga tak kalah penting. Setiap orang pasti ingin menyaksikan momen-momen ketika pasangannya tengah mencapai klimaks saat bercinta. Sebab, hal ini dapat meningkatkan rasa percaya diri seseorang karena berhasil memuaskan pasangannya di ranjang. Bagi pasangan yang suka improvisasi, nyalakan lampu kamar dan letakkan sebuah cermin di depan tempat tidur. Hal ini dapat membuat kamu dan pasangan bisa melihat aksi bercinta versi kalian. Menurut pakar, cara ini dapat memberikan kepuasan lebih bagi keduanya. Kalau berani, rekam saja sekalian asal jangan sampai menyebar."
1,https://health.detik.com/berita-detikhealth/d-5217759/potongan-tongkat-swab-covid-19-tertinggal-di-dalam-paru-paru-wanita-ini,Potongan Tongkat Swab COVID-19 Tertinggal di dalam Paru-paru Wanita Ini," Seorang wanita kembali mengalami cedera saat melakukan tes Corona. Kali ini, bagian dari tongkat usap tes Corona itu tertinggal di paru-parunya. Awalnya wanita asal Inggris ini yang merupakan pasien laringektomi akan segera dipulangkan dari rumah sakit. Tetapi, ia diharuskan untuk menjalani tes Corona. Dikutip dari Mirror, karena wanita berusia 51 tahun ini tidak bisa bernapas lewat hidung atau mulut, maka perawat harus mengambil sampelnya dari bagian tenggorokannya. Caranya, ia harus menjalani operasi trakeostomi dengan mengangkat tengkoraknya untuk mengambil sampel tes. Naasnya, tongkat usap swab tes itu patah selama prosedur dilakukan dan tersangkut di paru-paru. Saat di rontgen, petugas medis tidak bisa melihatnya dengan jelas. Dari CT Scan tersebut juga terlihat adanya beberapa pembengkakan di bagian paru-parunya. Untuk melihat potongan tongkat swab itu, dokter harus memasukkan kamera ke dalam organ tubuhnya dan mengeluarkannya dengan tindakan endoskopi. Kasus yang terjadi di Rumah Sakit Universitas Leicester ini disorot oleh British Medical Journal. Dalam laporan tersebut, penulis mengatakan bahwa saat ini belum ada panduan terkait bagaimana prosedur tes Corona untuk pasien yang tidak bisa diambil sampelnya dari saluran napas bagian atas. ""Kasus di atas menyoroti potensi bahaya saat mengambil mukosa dari tracheostomy. Kekhawatiran ini meningkatkan kemungkinan adanya akan terjadinya kesalahan manusia lainnya saat melakukan prosedur ini,"" tulis peneliti."
2,https://health.detik.com/berita-detikhealth/d-5217747/iuran-bpjs-kesehatan-kelas-1-3-bagaimana-jika-tidak-mampu-bayar,"Iuran BPJS Kesehatan Kelas 1-3, Bagaimana Jika Tidak Mampu Bayar?"," Badan Penyelenggara Jaminan Sosial atau BPJS Kesehatan telah menetapkan iuran baru yang diterapkan per 1 Juli 2020. Besaran iuran BPJS Kesehatan ditetapkan berdasarkan Perpres Nomor 64 Tahun 2020. ""Dalam kondisi pandemi, risiko sakit akan semakin memperburuk kondisi ekonomi masyarakat. Pemerintah berusaha memastikan peserta tetap dalam kondisi aktif,"" kata Kepala Humas BPJS Kesehatan M Iqbal Anas Ma'ruf dikutip dari situs BPJS Kesehatan.   1. Kelas 1 BPJS Kesehatan Rp 150 ribu 2. Kelas 2 BPJS Kesehatan Rp 100 ribu 3. Kelas 3 BPJS Kesehatan Rp 42 ribu. Untuk kelas tiga, peserta hanya membayar Rp 25.500 dan sisanya sebesar 16.500 ditanggung pemerintah untuk tahun 2020. Besar iuran BPJS Kesehatan yang baru diterapkan per 1 Jui 2020 untuk peserta Pekerja Bukan Penerima Upah (PBPU) dan Bukan Pekerja (BP). Peserta tidak perlu khawatir jika merasa terbebani dengan iuran BPJS Kesehatan, hingga tidak mampu bayar. Masyarakat bisa turun kelas sesuai kemampuan bayar iuran BPJS Kesehatan. ""Untuk peserta kelas 1 dan kelas 2, apabila peserta merasa tidak mampu membayar dengan skema iuran yang baru, BPJS Kesehatan akan memfasilitasi penyesuaian atau pindah kelas sesuai dengan kemampuannya,"" kata Iqbal.   1. Melalui Care Center BPJS Kesehatan 1500 400 2. Melalui mobile customer service 3. Melalui aplikasi Mobile JKN 4. Datang langsung ke kantor BPJS Kesehatan.   Iqbal berharap masyarakat punya perlindungan sosial termasuk jaminan kesehatan dengan status kepesertaan aktif. Kondisi ini menjamin perlindungan kesehatan dan pembiataan saat masyarakat sakit. Pemerintah ingin memastikan pelayanan kesehatan kepada peserta JKN-KIS tidak terhambat, meski tengah mengalami pandemi COVID-19. BPJS Kesehatan tentunya terus memperbaiki dan meningkatkan layanan pada peserta."
3,https://health.detik.com/berita-detikhealth/d-5217696/hasil-swab-pertama-negatif-tapi-kedua-positif-kok-bisa-ini-penjelasannya,"Hasil Swab Pertama Negatif Tapi Kedua Positif, Kok Bisa? Ini Penjelasannya"," Tes usap atau swab jadi cara untuk menentukan apakah seseorang tertular COVID-19 atau tidak. Tingkat keakuratan tes swab juga lebih tinggi daripada metode pemeriksaan lainnya. Hanya saja, ada kasus di mana hasil swab pertama negatif lalu selang beberapa hari setelahnya dia dinyatakan positif COVID-19 saat menjalani tes kedua. Seperti yang dialami oleh pembalap Valentino Rossi. Sebelum dipastikan positif, Rossi sempat menjalani 2 tes dengan hasil yang berbeda. Tes pertama hasilnya negatif, tetapi yang kedua hasilnya positif COVID-19. Apa sih yang menyebabkan hasil tes Corona bisa berbeda? Pakar biologi molekuler Ahmad Rusdan Handoyo Utomo, PhD, mengatakah hal ini tergantung pada natural history kasusnya. Kemungkinan di awal paparan sekitar 2-3 hari atau pasca paparan, infeksi pada pasien belum terdeteksi. ""Di awal paparan dengan pasien (2-3 hari) pertama mungkin belum terdeteksi, namun bisa menjadi posisi setelah 5-7 hari pasca paparan,"" jelas Ahmad saat dihubungi detikcom, Jumat (16/10/2020). ""Beda lagi kasusnya pasien suspek sesak nafas, di pcr positif. Lalu setelah dirawat menjadi negatif,"" lanjutnya. Ahmad mengatakan, 'shopping hasil PCR' atau tes berulang kali di lab dan di hari yang berbeda dianggap tidak lazim. Menurutnya, selama tes PCR dilakukan di lab PCR yang kredibel tidak perlu di tes ulang. Namun, jika kasus tersebut sudah menunjukkan gejala klinis dan data lab (CT Scan, darah, dan lainnya) menunjukkan gejala COVID-19, harus dipastikan kembali. ""Maka harus dipastikan sampling berulang, kalau perlu dari sumber sampel yang berbeda, seperti sputum dan feses di samping swab rongga napas atas,"" kata Ahmad."
4,https://health.detik.com/berita-detikhealth/d-5217616/ini-prediksi-terbaru-terkait-pemberian-vaksin-covid-19,Ini Prediksi Terbaru Terkait Pemberian Vaksin COVID-19," Pusat Pengendalian dan Pencegahan Penyakit Amerika Serikat (CDC) memposting prediksi bahwa vaksin untuk virus Corona akan tersedia pada akhir tahun ini. Dalam situs resminya, CDC mengungkapkan kemungkinan di tahap awal, pasokan vaksin akan terbatas jumlahnya. Tetapi, jumlah pasokan ini akan meningkat dalam beberapa minggu atau bulan pasca vaksin Corona tersebut rilis. ""Tujuannya agar semua orang bisa mudah mendapatkan vaksin COVID-19 dengan segera setelah tersedia dalam jumlah yang besar,"" kata CDC pada situs resminya yang dikutip dari CNN International, Sabtu (17/10/2020). ""Rencananya adalah dengan menyediakan beberapa ribu tempat vaksinasi, sehingga tidak ada yang harus bepergian jauh untuk divaksinasi, apakah itu di tempat praktik dokter, apotek ritel, rumah sakit. atau pusat kesehatan yang memenuhi persyaratan,"" lanjutnya. Di Amerika Serikat, CDC hanya membantu dalam mendistribusikan vaksin. National Institutes of Health membantu mengembangkan dan menguji vaksin, sementara Food and Drug Administration (FDA) akan memberikan otorisasi atau persetujuan penggunaan darurat. Menurut direktur National Institute of Allergy and Infectious Disease, Anthony Fauci, kemungkinan vaksin Corona ini akan tersedia secara luas pada April mendatang. Ia juga mengingatkan agar para ilmuwan segera mendapatkan data soal keamanan dan efektivitas vaksin yang saat ini dikembangkan di November- Desember tahun ini. Fauci memprediksi, pada tahap awal ini vaksin mungkin baru tersedia beberapa juta dosis. ""Jika pasokan terbatas, beberapa kelompok mungkin akan diprioritaskan untuk mendapatkan vaksin COVID-19 terlebih dahulu,"" tulis CDC."
5,https://health.detik.com/berita-detikhealth/d-5217525/sebaran-virus-corona-indonesia-17-oktober-dki-jabar-tertinggi-kasus-baru-4301,"Sebaran Virus Corona Indonesia 17 Oktober: DKI-Jabar Tertinggi, Kasus Baru 4.301"," Pemerintah melaporkan 4.301 kasus baru COVID-19 yang terkonfirmasi pada hari Sabtu (17/10/2020). Total kasus terkonfirmasi saat ini sudah mencapai 357.762 kasus semenjak virus Corona mewabah di Indonesia. DKI Jakarta lagi-lagi menjadi provinsi dengan penambahan kasus paling tinggi sebanyak 974 kasus, disusul Jawa Barat sebanyak 500 kasus baru per 17 Oktober. Dikutip dari laman covid19.go.id, pada hari ini ada sebanyak 4.048 kasus sembuh, sementara kasus kematian Corona sebanyak 84 orang. Berikut detail sebaran 4.301 kasus baru Corona di Indonesia pada Sabtu (17/10/2020): "
6,https://health.detik.com/berita-detikhealth/d-5217513/update-corona-indonesia-17-oktober-tambah-4301-positif-357762,"Update Corona Indonesia 17 Oktober: Tambah 4.301, Positif 357.762"," Jumlah kasus positif virus Corona COVID-19 di Indonesia bertambah 4.301 kasus. Total kasus positif tercatat 357.762, sembuh 281.592, meninggal 12.431 Sementara itu jumlah pemeriksaan dalam sehari tercatat sebanyak 158.700 spesimen. Jumlah suspek mencapai 43.305 Detail perkembangan virus Corona di Indonesia pada Sabtu (17/10/2020), adalah sebagai berikut: 1. Kasus positif bertambah 4.301 menjadi 357.762 2. Pasien sembuh bertambah 4.048 menjadi 281.592 3. Pasien meninggal bertambah 84 menjadi 12.431 Sebelumnya pada Jumat (16/10/2020), jumlah kasus positif virus Corona COVID-19 tercatat 353.461 kasus, sembuh 277.544, dan meninggal 12.347 kasus."
7,https://health.detik.com/berita-detikhealth/d-5217488/kfc-senopati-disanksi-ingat-lagi-protokol-kesehatan-di-tempat-makan,"KFC Senopati Disanksi, Ingat Lagi Protokol Kesehatan di Tempat Makan"," Pemerintah Provinsi DKI Jakarta menyegel restoran siap saji KFC di kawasan Senopati, Jakarta Selatan. Restoran tersebut dinilai telah melanggar ketentuan PSBB masa transisi soal kapasitas pengunjung yang makan di tempat atau dine in. ""KFC baru buka. Kemarin siang, jelang Ashar, rame. Protokol kesehatan nggak jalan. Cerita pemilik, hari itu hujan, baru buka, orang pada mau masuk. Katanya begitu,"" ucap Camat Kebayoran Baru Tommy Fudihartono saat dihubungi, Sabtu (17/10/2020). ""Di (aturan) Pergub kan kapasitas 50 persen,"" ujarnya."
8,https://health.detik.com/berita-detikhealth/d-5217439/terpopuler-sepekan-15-gejala-corona-versi-who-dari-paling-umum-sampai-berat,Terpopuler Sepekan: 15 Gejala Corona Versi WHO dari Paling Umum sampai Berat," Sepekan ini diramaikan soal gejala virus COVID-19 oleh Organisasi Kesehatan Dunia (WHO). Dikutip dari laman resminya, gejala Corona yang dialami biasanya bersifat ringan dan muncul secara bertahap. Pada umumnya, gejala COVID-19 mulai muncul sekitar lima hingga enam hari setelah terjadi pajanan virus. ""Tetapi, waktu kemunculan gejala ini dapat berkisar 1 hingga 14 hari,"" ungkap WHO. Menurut WHO, sekitar 80 persen orang yang terinfeksi COVID-19 berhasil pulih tanpa perlu perawatan yang khusus. Sekitar 1 dari 5 orang yang terinfeksi menderita sakit parah dan kesulitan untuk bernapas. Ada tiga tipe gejala COVID-19 versi WHO, mulai yang paling umum sampai berat."
9,https://health.detik.com/detiktv/d-5217395/kasus-corona-italia-meningkat-otoritas-kesehatan-minta-pemblokiran,"Kasus Corona Italia Meningkat, Otoritas Kesehatan Minta Pemblokiran"," Otoritas kesehatan Italia mengungkapkan keadaan pandemi Corona di sana. Dalam minggu ini, ada kenaikan angka yang cukup drastis. Menurut ahli virologi, bila dalam waktu 2 minggu tidak melakukan pemblokiran area setempat maka dikhawatirkan pandemi Corona di Italia tidak dapat terkontrol. Otoritas kesehatan Italia mengungkapkan keadaan pandemi Corona di sana. Dalam minggu ini, ada kenaikan angka yang cukup drastis. Menurut ahli virologi, bila dalam waktu 2 minggu tidak melakukan pemblokiran area setempat maka dikhawatirkan pandemi Corona di Italia tidak dapat terkontrol."
10,https://health.detik.com/berita-detikhealth/d-5217371/ahli-sebut-pikun-bisa-jadi-gejala-covid-19,Ahli Sebut Pikun Bisa Jadi Gejala COVID-19," Saat seseorang terinfeksi Corona, berbagai gejala khas mulai dirasakan pasien tersebut. Mulai dari batuk, demam, dan gejala khas lainnya. Namun, pada pasien yang berusia lanjut atau lansia gejala yang muncul justru berbeda. Gejala yang terlihat lebih mengacu pada perubahan perilaku. Staf Medis Departemen Ilmu Penyakit Dalam Rumah Sakit Cipto Mangunkusumo, dr Soedjono mengatakan pasien lansia yang ia tangani justru tidak menunjukkan gejala khas COVID-19 di awal pemeriksaan. ""Kalau lansia ini biasanya hanya kehilangan nafsu makan saja, tidak khas sama sekali tahu-tahu mereka sudah positif,"" jelasnya dalam siaran langsung melalui kanal YouTube BNPB, beberapa waktu lalu. dr Soedjono mengatakan, perubahan perilaku yang dialami para pasien lansia ini juga bisa disertai dengan pikun. Hal ini bisa menandakan bahwa adanya penyakit berat di belakangnya. Ia memberikan beberapa contoh perubahan perilaku yang bisa muncul, seperti yang tenang menjadi agresif hingga menolak untuk mengikuti rutinitas keseharian. Selain itu, Ketua SMF Pulmonologi RSPI Sulianti Saroso dr Adrian Rusli mengatakan banyak juga pasien yang tidak mengalami gejala penyakit pernapasan sama sekali. ""Misalnya saja leukositnya tidak tinggi, tetapi merasa panas,"" ujarnya."
11,https://health.detik.com/berita-detikhealth/d-5217318/terpopuler-sepekan-usia-muda-tak-dapat-vaksin-covid-19-hingga-2022,Terpopuler Sepekan: Usia Muda Tak Dapat Vaksin COVID-19 Hingga 2022," Beberapa waktu lalu Organisasi Kesehatan Dunia (WHO) menyebut orang muda yang sehat tidak mungkin mendapat vaksin Corona sampai tahun 2022. Soumya Swaminathan, Kepala ilmuwan WHO mengatakan ini dilakukan karena imunisasi akan diprioritaskan untuk orang tua dan kelompok rentan lainnya terlebih dahulu. Seperti petugas kesehatan, pekerja garda terdepan, dan orang tua kemungkinan akan ditawari vaksin COVID-19 terlebih dahulu, meskipun rincian siapa saja yang menjadi prioritas masih dirampungkan oleh WHO. Terlebih hingga saat ini belum ada satupun vaksin COVID-19 yang dianggap aman dan efektif oleh WHO, Uni Eropa atau Amerika Serikat. ""Orang cenderung berpikir bahwa pada tanggal 1 Januari atau 1 April, saya akan mendapatkan vaksin, dan kemudian semuanya akan kembali normal,"" jelas Swaminathan. ""Tidak akan berhasil seperti itu,"" tambahnya. Selain itu, Swaminathan mengatakan bahwa dunia diharapkan memiliki setidaknya satu vaksin COVID-19 yang aman dan efektif pada 2021, tetapi akan tersedia dalam jumlah yang terbatas. Saat ini sudah ada 10 vaksin virus Corona di seluruh dunia sedang dalam uji klinis tahap akhir. ""Kebanyakan orang setuju bahwa ini dimulai dengan petugas kesehatan dan petugas garis depan, tetapi bahkan kemudian Anda perlu menentukan siapa di antara mereka yang memiliki risiko tertinggi dan kemudian orang tua dan seterusnya,"" jelas Swaminathan, dikutip dari laman CNBC. ""Akan ada banyak panduan yang keluar, tapi saya pikir rata-rata orang, orang muda yang sehat mungkin harus menunggu hingga 2022 untuk mendapatkan vaksin,"" pungkasnya."
12,https://health.detik.com/berita-detikhealth/d-5217262/fakta-fakta-golongan-darah-o-yang-disebut-lebih-kebal-corona,Fakta-fakta Golongan Darah O yang Disebut lebih Kebal Corona," Belum lama ini dua studi terbaru memperkuat bukti golongan darah tertentu berkaitan dengan rentan tidaknya seseorang terpapar COVID-19. Perlu diketahui, sebuah studi sebelumnya menyebut golongan darah O lebih 'kebal' COVID-19. Lagi-lagi, studi terbaru menyatakan hal yang sama. Golongan darah O dinilai memiliki kemungkinan yang sangat kecil terpapar dari COVID-19. Bahkan jika terinfeksi COVID-19, golongan darah O disebut tidak berisiko mengalami sakit parah. Dirangkum detikcom, berikut beberapa fakta unik golongan darah O: Golongan darah O sendiri diketahui memiliki jumlah protein yang lebih rendah dalam membantu pembekuan darah. Hal ini berarti lebih kecil kemungkinan seseorang untuk mengidap pembekuan darah. Meskipun demikian, golongan darah O pun tidak menjamin seseorang terhindar dari pembekuan darah. Golongan darah di berbagai negara berbeda-beda tergantung dari etnis yang mendominasinya. Namun, secara umum golongan darah O diketahui menjadi yang terbanyak di dunia. Dalam sebuah riset beberapa waktu lalu pernah mengungkap terdapat 35 hingga 40 persen orang di dunia memiliki golongan darah O rhesus positif atau O+. Seorang ahli entomologi medis dari University of Florida Dr Jonathan Day menyebut orang yang memiliki golongan darah O lebih rentan digigit nyamuk. Sebab, orang yang memiliki golongan darah O mengeluarkan bahan kimia dari kulit yang dapat menarik nyamuk. ""Beberapa orang memproduksi lebih banyak bahan kimia tertentu di kulitnya. Dan beberapa dari bahan kimia tersebut, seperti asam laktat, menarik untuk nyamuk. Ada juga bukti bahwa satu golongan darah O menarik nyamuk lebih banyak daripada yang lain (A atau B),"" katanya."
13,https://health.detik.com/detiktv/d-5217248/tips-bersihkan-makanan-takeaway-agar-aman-dari-corona,Tips Bersihkan Makanan Takeaway Agar Aman dari Corona," Pola hidup bersih di tengah pandemi Corona sangat penting, termasuk dalam menjaga kebersihan makanan yang dibeli di luar, baik dari restoran maupun kaki lima. Berikut tips bersihkan makanan takeaway agar aman dari Covid-19! Pola hidup bersih di tengah pandemi Corona sangat penting, termasuk dalam menjaga kebersihan makanan yang dibeli di luar, baik dari restoran maupun kaki lima. Berikut tips bersihkan makanan takeaway agar aman dari Covid-19!"
14,https://health.detik.com/detiktv/d-5217247/tips-bersihkan-makanan-takeaway-agar-aman-dari-corona,Tips Bersihkan Makanan Takeaway Agar Aman dari Corona," Pola hidup bersih di tengah pandemi Corona sangat penting, termasuk dalam menjaga kebersihan makanan yang dibeli di luar, baik dari restoran maupun kaki lima. Berikut tips bersihkan makanan takeaway agar aman dari Covid-19! Pola hidup bersih di tengah pandemi Corona sangat penting, termasuk dalam menjaga kebersihan makanan yang dibeli di luar, baik dari restoran maupun kaki lima. Berikut tips bersihkan makanan takeaway agar aman dari Covid-19!"
15,https://health.detik.com/berita-detikhealth/d-5217241/kasus-covid-19-muncul-terus-china-tes-9-juta-warganya-dalam-5-hari,"Kasus COVID-19 Muncul Terus, China Tes 9 Juta Warganya dalam 5 Hari"," Pemerintah China melakukan tes COVID-19 kepada sekitar 9 juta penduduknya di kota Qingdao. Melansir BBC, langkah ini dilakukan setelah ditemukannya selusin kasus yang terkait dengan rumah sakit yang merawat pasien COVID-19 dari luar negeri. Dalam sebuah pernyataan yang diposting ke situs media sosial China Weibo, Komisi Kesehatan Kota Qingdao mengatakan enam kasus baru dan enam kasus asimtomatik telah ditemukan. Semua kasus terkait dengan rumah sakit yang sama. Komisi Kesehatan Nasional menyatakan pihak berwenang telah menyelidiki infeksi yang ditemukan pada delapan penderita di Rumah Sakit Paru Kota Qingdao dan satu anggota keluarga. Mereka juga mengatakan seluruh kota kemungkinan akan diperiksa dalam 5 hari. Ma Lixin, wakil kepala dinas kesehatan provinsi, sebelumnya pada hari itu mengatakan bahwa kasus COVID-19 di rumah sakit muncul karena desinfeksi yang tidak tepat di ruang CT Scan. Pengujian massal yang kerap dilakukan China telah berhasil menekan tingkat infeksi tetap rendah di negara tersebut. Sebelumnya, otoritas China juga menguji 11 juta warga Wuhan di awal Maret."
16,https://health.detik.com/berita-detikhealth/d-5217182/who-dexamethasone-masih-satu-satunya-obat-efektif-untuk-pasien-covid-19,WHO: Dexamethasone Masih Satu-satunya Obat Efektif untuk Pasien COVID-19," Organisasi Kesehatan Dunia (WHO) menyatakan sampai saat ini, dexamethasone masih satu-satunya obat yang terbukti efektif melawan COVID-19 untuk pasien gejala parah. Direktur Jenderal WHO Tedros Ghebreyesus mengatakan hasil sementara dari Uji Coba Terapi Solidaritas WHO menemukan bahwa obat remdesivir dan interferon, memiliki sedikit atau tidak ada efek dalam mencegah kematian terkait virus corona atau mengurangi waktu di rumah sakit. ""Untuk saat ini, dexamethasone kortikosteroid masih satu-satunya terapi yang terbukti efektif melawan COVID-19, untuk pasien dengan penyakit parah,"" kata Tedros dikutip dari Anadolu Agency, Sabtu (17/10/2020). Tedros mengatakan, Solidarity Trial adalah uji coba terkontrol acak terbesar di dunia untuk terapi COVID-19, yang melibatkan hampir 13.000 pasien di 500 rumah sakit di 30 negara. Sebelumnya WHO menghentikan percobaan obat hidroksiklorokuin pada bulan Juni dan kombinasi lopinavir dan ritonavir pada bulan Juli, dengan alasan bahwa kedua terapi tersebut hanya membawa sedikit penurunan pada kematian pasien COVID-19 yang dirawat di rumah sakit."
17,https://health.detik.com/berita-detikhealth/d-5217143/diet-gagal-melulu-mungkin-ini-penyebabnya,Diet Gagal Melulu? Mungkin Ini Penyebabnya," Salah satu upaya untuk menurunkan berat badan adalah diet. Namun, tak sedikit orang yang justru gagal dalam menjalankan program diet. Rupanya, bukan hanya apa makanan yang dikonsumsi saja, melainkan ada banyak faktor yang memengaruhi kegagalan diet seseorang. Dikutip dari laman Lifehack, berikut faktor-faktor yang memengaruhi kegagalan diet seseorang: Tidur memainkan peran penting dalam kesehatan fisik dan mental. Tidur juga membantu menjaga keseimbangan yang sehat dari hormon yang membuat kamu merasa lapar (ghrelin) atau kenyang (leptin). Ketika tidak cukup tidur, tingkat ghrelin kamu akan naik dan tingkat leptin akan turun. Hal ini membuat kamu merasa lebih lapar daripada saat kamu cukup istirahat. Jadwal makan yang tidak teratur memiliki efek negatif bagi kesehatan. Misalnya, meningkatkan risiko obesitas, diabetes, hipertensi, dan peradangan. Selain itu, jadwal makan yang berantakan bisa menyebabkan kamu terus-terusan makan karena kamu tidak mencatat waktu dan makanan apa saja yang sudah kamu makan sebelumnya. Menghitung kalori secara akurat memanglah sulit karena hanya bisa dilakukan oleh para ahli gizi. Namun, bukan berarti kamu makan tanpa memikirkan kalori yang ada. Kamu bisa memperkirakan kalori apa saja yang kamu makan, Misalnya, ketika kamu makan dengan porsi besar, perhatikanlah jenis makanan yang ada di piringmu. Asupan gizi seimbang harus disertai dengan protein, karbohidrat, dan serat. Banyak orang yang berekspektasi ingin cepat-cepat menurunkan berat badan dengan bobot yang besar dalam waktu singkat. Namun, dalam menjalankannya, banyak dari mereka yang justru gagal karena tidak memiliki komitmen yang kuat. Dalam menjalankan diet harus dibutuhkan komitmen yang kuat."
