,url,title,content
16,https://food.detik.com/info-kuliner/d-5222597/cuti-bersama-oktober-2020-ini-ide-masak-di-rumah-yang-harus-dicoba,"Cuti Bersama Oktober 2020, Ini Ide Masak di Rumah yang Harus Dicoba"," Memasuki akhir Oktober 2020, pegawai negeri ataupun swasta dapat menikmati libur nasional dan cuti bersama. Libur panjang di akhir Oktober ini dimulai dari tanggal 28 Oktober hingga akhir pekan pada tanggal 1 November 2020. Di libur panjang bulan ini, mungkin beberapa masyarakat ada yang bepergian ke luar kota. Dan masyarakat yang lainnya yang tidak merencanakan pergi, bisa membuat masakan enak di rumah dan dinikmati bersama keluarga.   Siomay menjadi camilan enak yang bisa dibuat sendiri di rumah. Siomay ikan dibuat dengan campuran ikan tenggiri fillet dan dipadu dengan tepung kanji. Resep Siomay Ikan Bahan: • 15 lembar kulit pangsit• Adonan Isi:• 500 g fillet daging tenggiri• 1 butir telur ayam• 2 sdm tepung kanji• 2 sdm daun bawang iris halus• 2 siung bawang putih, parut• 1/2 sdt merica bubuk• 1 sdm kaldu jamur• 1 sdt garam• Saus Kacang:• 1 sdm air jeruk limau• 250 ml air• Giling halus:• 100 g kacang tanah goreng• 2 siung bawang putih• 3 buah cabe merah keriting• 1 sdt gula pasir• 1 sdt garam Cara membuat: 1. Cincang halus daging ikan tenggiri.2. Campur dengan telur, tepung kanji, merica, kaldu jamur, bawang putih dan daun bawang iris. Aduk hingga benar-benar kalis.3. Ambil selembar kulit pangsit, taruh 1 sdm adonan ikan di tengahnya. Lipat keliling sisi kulitnya sambil tekan dengan jempol dna telunjuk hingga padat.4. Susun di atas loyang atau wadah tahan panas.5. Kukus dalam kukusan panas selama 30 menit.6. Angkat, sajikan hangat dengan saus kacangnya.7. Saus : Campur bumbu kacang yang digiling halus dengan air lalu masak di atas api kecil hingga mendidih dan kental. Angkat dan dinginkan.8. Saat akan disajikan tambahkan air jeruk limau, aduk rata.  Masih belum berani mengajak keluarga makan di restoran? Tentu kita bisa mengolah hidangan spesial di rumah. Hmm, rasanya seenak buatan resto lho. Yuk bikin! Resep Kepiting Asam Manis Bahan:• 2 ekor @500 g kepiting hidup/segar• Saus:• 2 sdm minyak sayur• 2 siung bawang putih, cincang halus• 20 g bawang bombay, cincang• 1 cm jahe, cincang halus• 400 ml air• 3 sdm saus tomat• 2 sdm saus cabe botolan• 2 sdm serbuk jeruk konsetrat• 1 sdt gula pasir• 1 sdt garam• 1 sdt tepung kanji, larutkan dengan sedikit air Cara membuat: 1. Matikan kepiting lalu lepaskan ikatan talinya. Lepaskan batoknya dan potong menjadi dua serta potong kaki-kakinya. Cuci bersih dan tiriskan.2. Panaskan minyak banyak dalam wajan. Goreng kepiting sebentar hingga berubah warna. Tiriskan.3. Saus:4. Panaskan 3 sdm minyak, tumis bawang putih, bawang bombay dan jahe hingga wangi.5. Tuangi air, masukkan saus tomat, saus cabe, serbuk jeruk, garam dan gula. Masak hingga mendidih.6. Tuangkan larutan kanji, aduk hingga mendidih dan kental.7. Masukkan kepiting goreng, aduk sebentar hingga mendidih lalu angkat.  Menghindari rasa bosan saat cuti bersama dan libur nasional dengan membuat camilan enak di rumah. Mango sticky rice bisa jadi pilihan camilan yang enak dan mengenyangkan. Resep Mango Sticky Rice Bahan: • 1 kg beras ketan yang bagus kualitasnya• 800 ml santan segar• 150 g gula pasir• 1 sdt garam• 1 lembar daun pandan, potong-potong• Topping:• 250 ml santan kental• 1/4 sdt garam• 1 lembar daun pandan, potong-potong• 1 sdt tepung beras, larutkan dengan sedikit air• Pelengkap:• 2-3 buah mangga arumanis, kupas• 2 sdm biji wijen sangrai/kacang hijau kupas sangrai Cara membuat: 1. Cuci bersih beras ketan hingga bening airnya. Rendam air dingin selama minimal 3 jam lalu tiriskan hingga agak kering.2. Kukus beras ketan dalam kukusan panas hingga setengah matang lalu angkat.3. Rebus santan, daun panda dan garam hingga mendidih. Matikan api.4. Tambahkan santan panas sedikit-sedikit dalam ketan sambil aduk hingga rata dan santan meresap.5. Kukus ketan kembali hingga matang dan lunak. Angkat.6. Topping: Rebus santan bersama daun pandan dan garam hingga mendidih.7. Tuangi larutan tepung beras, aduk hingga kental lalu angkat.8. Taruh ketan di salah satu sisi piring saji.9. Kupas mangga taruh di sisinya.10. Kucuri ketan dengan santan kental lalu taburi wijen/biji kacang hijau sangrai.  Sajian mie dengan kuah tom yum khas Thailand bisa jadi pilihan menu keluarga saat libur cuti bersama. Isian mienya bisa seafood ataupun ayam. Rasanya gurih dan segar. Mie Tom YumBahan: • 250 g mie beras kering• 250 g udang sedang, kupas, sisakan ekornya• 250 g cumi-cumi bersih, iris melintang 1cm• 250 g fillet ikan kakap/tenggiri, iris kasar• 10 butir bakso ikan sedang • Kuah:• 1 liter kaldu seafood/air• 3 lembar daun jeruk purut• 2 cm jahe, memarkan• 2 batang serai, memarkan• 2 cm lengkuas, memarkan• 4 buah cabe rawit merah, iris kasar• 1 sdm cabe giling• 5 akar daun ketumbar, tumbuk halus• 100 ml saus ikan• 50 ml air jeruk nipis• 1 sdt gula pasir• 2 sdt garam • Pelengkap:• daun selada• daun ketumbar• telur rebus, belah Cara membuat: 1. Rebus mie beras dengan air mendidih hingga lunak. Angkat dan tiriskan.2. Didihkan kaldu seafood/air, lalu masukkan jahe, serai, daun jeruk, lengkuas, cabe rawit, cabe giling, akar daun ketumbar, saus ikan, air jeruk nipis, gula dan garam.3. Masukkan bakso ikan, udang, cumi dan ikan. Didihkan beberapa saat lalu angkat.4. Taruh mie beras di mangkuk lalu siram kuah berikut isiannya.5. Sajikan dengan daun selada, daun ketumbar dan telur rebus.  Sedang ingin menikmati pasta yang creamy? Salah satu ide masak di rumah adalah membuat creamy mushroom pasta. Bahan:150 g angel hair kering120 g jamur champignon, iris tipis2 siung bawang merah, cincang2 siung bawang putih, cincang20 g mentega150 ml krim segar Cara Membuat:1. Rebus angel hair dalam air mendidih hingga lunak lalu tiriskan.2. Sementara itu panaskan mentega, tumis bawang putih dan bawang merah hingga layu dan wangi.3. Masukkan jamur, aduk-aduk hingga layu dan kecokelatan.4. Masukkan krim, didihkan.5. Beri merica dan garam secukupnya.6. Masukkan angel hair, aduk hingga rata lalu angkat.Sajikan hangat dengan daun basil segar. Nah dari semua ide masak di rumah untuk mengisi waktu libur cuti bersama dan nasional, mana yang paling Anda suka?  "
17,https://food.detik.com/info-kuliner/d-5222876/tentara-ini-borong-habis-telur-gulung-jualan-anak-sekolah,Tentara Ini Borong Habis Telur Gulung Jualan Anak Sekolah," Seorang tentara yang juga dikenal sebagai youtuber tak sengaja bertemu penjual telur gulung yang masih berseragam SMA. Semua telur gulungnya diborong ludes. Tentara yang eksis lewat channel youtube Jambul Ijo ini bertemu penjual telur gulung saat berkendara di jalan. Ketika diperhatikan ternyata penjualnya masih mengenakan seragam sekolah dan memang masih duduk di bangku kelas 2 SMK. Penjual telur gulung bernama Asmad ini mengendarai motor yang bagian belakangnya dimodifikasi agar bisa menampung gerobak telur gulung. Asmad sempat kaget saat dihampiri dua orang tentara berseragam. Tentara ini membeli seluruh telur gulung yang jadi stok dagangan Asmad. Total ada sekitar 20 telur gulung yang dibeli. Dalam video berdurasi 13 menit ini, Asmad sibuk membuat telur gulung. Sambil memasak, ia juga mengatakan kalau dirinya bercita-cita menjadi tentara. Mendengar ungkapan ini, sang tentara langsung menghujani Asmad dengan motivasi. Mereka menyarankan Asmad untuk mulai berlatih fisik serta berdoa dan meminta restu orang tua. Setiap hari berjualan telur gulung, Asmad mengaku mendapat penghasilan sekitar Rp 75.000- Rp 120.000 per hari. Jumlah ini belum dipotong untuk membeli bahan baku. Asmad berjualan selepas pulang sekolah sampai malam hari. Selang satu tahun setelah video pertama dibuat, kini Asmad masih berjualan telur gulung. Ia sekarang sudah kelas 3 SMK, yang artinya tinggal selangkah lagi menuju tes ujian masuk calon tentara. Saat ditemui Jambul Ijo, Asmad sedang berlatih fisik. Ia baru saja berlari keliling lapangan sebanyak 6 putaran. Badannya kini tampak lebih kekar dan berotot. Asmad tak main-main soal cita-citanya menjadi tentara. Bocah remaja yang tinggal di Jember ini tinggal selangkah lagi mewujudkan cita-citanya. Saat pandemi corona seperti sekarang, Asmad bisa berjualan sejak pagi hingga siang hari. Lalu lanjut lagi sore selepas ashar. Meski waktu jualannya lebih lama tapi penghasilannya anjlok. Jika biasanya ia bisa membawa pulang uang Rp 100 ribu maka kali ini hanya sekitar Rp 50 ribu saja. Kegigihan Asmad menjadi tulang punggung keluarga ternyata mendapat banyak apresiasi dari netizen. Ribuan komentar membanjiri unggahan video. ""Orang miskin nggak boleh malu, bahasanya dalem banget. Saya pernah ngalami hal kayak gini, bahkan saat saya daftar jadi anggota TNI banyak yang ngetawain. Alhamdulillah berkat restu orang tua, sekali tes saya bisa mengabdikan diri untuk Negara,"" ujar satu netizen. ""Saya langsung nangis pas dia bilang 'orang miskin nggak usah malu'. Semangat dek, semoga cita-citamu nanti tercapai,"" sahut netizen lain."
18,https://food.detik.com/info-kuliner/d-5222848/borong-makanan-dari-penjual-yang-sepi-pelanggan-pria-ini-banjir-pujian,"Borong Makanan dari Penjual yang Sepi Pelanggan, Pria Ini Banjir Pujian"," Seorang pria mengaku diberikan sejumlah uang untuk membeli makanan dari para pedagang kaki lima. Aksi kebaikan ini mendapat pujian dari banyak netizen. Sebuah video singkat yang dibagikan akun instagram @dagelanojol sukses menarik simpati masyarakat. Dalam video ini, seorang pria curhat baru saja diberikan uang dalam jumlah banyak oleh sang bos. Bos dari pria yang menyembunyikan identitasnya ini berpesan agar uang tersebut digunakan untuk membeli makanan di pinggir jalan. Makanan yang dijual oleh pedagang kecil dan terdampak pandemi corona. Tak bisa dipungkiri, para pedagang makanan ini merasakan betul pendapatannya menurun karena daya beli masyarakat yang juga ikut menurun. Beberapa pedagang bahkan sempat bercerita soal kesulitannya menutupi kebutuhan harian. Dalam video tampak pria ini menyambangi beberapa penjual makanan untuk membelinya. Ada mie ayam, es liang teh, siomay, pecel dan es teh manis dari kios sederhana di pinggir jalan. ""Tiba-tiba beberapa penjual berterimakasih udah diborong dan cerita kalau dagangannya sepi banget dan kesulitan menghidupi keluarganya dengan pendapatannya di masa pandemi,"" tulis pria ini dalam videonya. Setelah menghabiskan uang untuk membeli makanan, sang bos lantas menyuruh pria ini untuk membagikan pada orang yang membutuhkan. Jadilah kumpulan ojol dan para pekerja di jalanan yang ketiban rejeki nomplok. Mereka merasa senang dan mengucapkan terima kasih karena mendapat makanan gratis. Bagi sebagian besar orang, pandemi seperti ini sangat menyiksa. Bahkan mencari uang untuk sekedar makan pun terasa sangat sulit. Video yang diunggah pada 21 Oktober ini langsung menyita perhatian. Setidaknya sudah ada lebih dari 13 ribu orang yang menyaksikan video ini. ""Bos yang peduli dan anak buah yang amanah, panjang umur kebaikan,"" kata satu netizen. ""Itulah salah satu cara bersedekah dan membangkitkan perekonomian. Walaupun kecil dampaknya tapi jika semua orang berkecukupan melakukan hal tersebut akan lebih besar efeknya,"" pungkas netizen lainnya."
19,https://food.detik.com/detiktv/d-5223761/korea-selatan-dilanda-krisis-kimchi,Korea Selatan Dilanda Krisis Kimchi!,Korea Selatan sedang menghadapi cuaca ekstrem. Panen sawi putih berkurang. Harga sawi putih di sana pun naik drastis. Akibatnya terjadi krisis kimchi.
20,https://food.detik.com/info-kuliner/d-5223622/jualan-es-teh-saat-pandemi-mahasiswi-ini-raup-rp-21-juta-tiap-bulan,"Jualan Es Teh Saat Pandemi, Mahasiswi Ini Raup Rp 21 Juta Tiap Bulan"," Saat pandemi Corona, banyak orang berbisnis kuliner. Mahasiwi ini pilih jualan es teh hingga bisa raup Rp 21 juta tiap bulan. Ini kisahnya. Mahasiswi yang baru lulus biasanya melamar kerja ke beberapa perusahaan, tapi Fatin Joe dari Malaysia pilih jalan berbeda. Mahasiswi 23 tahun ini pilih jualan es teh yang merupakan minuman favoritnya. ""Saya suka teh ais (es teh) dan begitu juga keluarga saya,"" ujarnya seperti dikutip dari World of Buzz (22/10). Ketika masa PSBB pertama di bulan Maret, Fatin akhirnya mulai belajar bikin es teh sendiri, alih-alih selalu beli dari luar. ""Setelah PSBB berakhir, saya mulai jualan es teh dalam kemasan botol karena saya ingin orang-orang merasakan es teh homemade buatan saya,"" lanjutnya. Tak cukup sampai di situ, Fatin kemudian terpikir peluang merekrut agen dan distributor untuk mendistribusikan bisnisnya yang bernama Teatin.KL ini. Saat ini bisnis es teh botolannya sukses dengan penjualan 20-50 botol per hari. Jika dikalkulasikan, ia bisa meraih omzet RM 6.000 atau sekitar Rp 21 juta per bulan. Menariknya, Fatin tak hanya sibuk jualan es teh tapi juga magang untuk studi praktiknya. Ia berhasil melakukan keduanya bersamaan karena manajemen waktu yang baik. ""Ketika saya pulang kerja, saya mulai bikin pesanan sekitar 20-50 botol es teh. Saya juga yang memasarkannya di media sosial saat ada waktu luang di akhir pekan. Tak ada alasan untuk saya berhenti,"" lanjutnya. Baca Juga: Mahasiswa Ini Sukses Jadi Tukang Sayur dengan Omzet Rp 180 Juta Per Bulan  Es teh yang Fatin jual merupakan minuman tradisional Malaysia. Berupa racikan teh dan susu yang kental. Fatin menjualnya dalam kemasan botol ukuran 330 ml. Ia mengklaim produknya dibuat dengan teh asli dan tidak memakai pemanis buatan. Di balik kesuksesannya sebagai pengusaha es teh, Fatin ternyata mendapat cibiran. ""Banyak orang bilang saya menyia-nyiakan gelar saya karena berjualan es teh,"" ucapnya. Tapi ia pilih tidak ambil pusing. Fatin berpendapat, ""Tidak masalah pekerjaan apa yang kamu lakukan, yang terpenting adalah memiliki passion untuk bisnis kamu. Kamu bisa mengembangkan bisnis itu dengan pengetahuan yang kamu pelajari di sekolah dan universitas."" Di saat pandemi Corona seperti ini, menurut Fatin tak masalah ketika seseorang coba cara lain untuk menghasilkan uang lebih. Ke depannya Fatin ingin semakin serius berbisnis es teh. ""Saya harus lebih mendorong diri saya lagi dan tidak menyerah. Abaikan apa yang dikatakan pembenci dan terus melangkah,"" katanya. Fatin juga memberi tips untuk mahasiswa dan mahasiswi yang baru lulus. Terutama untuk mereka yang sedang merasa tertekan karena 'terpaksa' kerja atau belum tau mau mengarah kemana. Mulai dari mengidentifikasi passion atau minat yang kamu miliki. ""Cobalah menyesuaikan diri dalam satu hal yang bisa membuat kamu dan keluarga bahagia."" ""Jangan pernah menyerah meski hasilnya tidak sebaik yang kamu harapkan. Temukan diri kamu lalu temukan karirmu. Tidak ada alasan bagimu untuk berhenti,"" sarannya. Baca Juga: Salut! 5 Mahasiswa Ini Sukses Jualan Makanan Beromzet Ratusan Juta "
21,https://food.detik.com/info-sehat/d-5222643/berapa-bungkus-mie-instan-yang-boleh-dimakan-sehari-ini-kata-dokter,Berapa Bungkus Mie Instan yang Boleh Dimakan Sehari? Ini Kata Dokter," Mie instan digemari karena rasa gurihnya. Namun dalam sehari berapa bungkus yang boleh dikonsumsi? Begini jawaban dokter. Mie instan jadi makanan favorit banyak orang, bahkan beberapa di antara mereka bisa makan mie instan lebih dari satu bungkus dalam sehari. Namun apakah kebiasaan ini baik untuk kesehatan? Dokter Dion Haryadi melalui akun TikToknya, dionharyadi, menjawab pertanyaan banyak orang mengenai batas konsumsi mie instan dalam sehari. ""Satu hari saya boleh makan berapa banyak mie instan?"" buka dr. Dion di awal. Ia menjelaskan, ""Mie instan rasanya enak banget. Pernah mikir nggak 'ini enaknya karena apa ya?'. Ya karena bumbunya, sodium."" Dalam satu bungkus mie instan bisa mengandung 800-1.400 mg sodium. ""Nah satu harinya kita hanya disarankan hanya mengonsumsi kurang lebih 2.500 mg sodium. Jadi kalau kamu makan 2 atau 3 bungkus mie instan sehari, kamu sudah menghabiskan jatah sodium harianmu,"" kata dokter berkacamata ini. Belum lagi asupan sodium atau garam dari makanan dan camilan-camilan lain Bukan tidak mungkin, jumlah asupan sodium seseorang melonjak di atas 2.500 mg dalam sehari. Baca Juga: Mahasiswa Ini Tewas karena Makan Mie Instan Tiap Malam!  dr. Dion mengingatkan bahwa konsumsi sodium yang tinggi terutama bisa menyebabkan hipertensi atau penyakit tekanan darah tinggi. ""Yang kemudian dapat menyebabkan penyakit jantung, ginjal, dan seterusnya,"" tutupnya. Dikutip dari Healthline (21/10), konsumsi mie instan setiap hari juga tidak disarankan karena makanan ini rendah nutrisi. Beberapa penelitian telah menemukan kaitan antara sering konsumsi mie instan dengan pola makan keseluruhan yang buruk. Selain itu, mie instan juga mengandung monosodium glutamate (MSG) yang efek konsumsinya masih jadi kontroversi. Ada yang menyebut tak masalah konsumsi MSG, namun ada pula yang bilang MSG kurang baik untuk kesehatan. Ada penelitian yang menemukan konsumsi MSG berlebih bisa menyebabkan berat badan naik, tekanan darah tinggi, pusing, hingga mual. Selain itu MSG juga bisa berdampak negatif untuk kesehatan otak. Alasan lain untuk tidak menjadikan mie instan sebagai makanan pokok adalah karena produk ini rendah serat dan protein. Karenanya bisa bikin cepat merasa lapar usai menyantapnya. Dihubungi detikFood, ahli gizi Leona Victoria Djajadi pernah mengungkap berapa batas maksimal konsumsi mie instan. Ia menyarankan dalam sebulan maksimal makan 4 bungkus mie instan saja atau sekitar 1 kali seminggu. Ini penjelasannya. Baca Juga: Mie Instan Boleh Dimakan Tiap Hari? Ini Saran Ahli Gizi "
22,https://food.detik.com/tahu-dan-tempe/d-5221975/resep-tahu-campur-surabaya-yang-ngangeni,Resep Tahu Campur Surabaya yang Ngangeni," Tanggal tua tetap bisa mengobati kangen dengan tahu campur Surabaya ini. Rasanya gurih manis dengan sambal petis yang khas. Cocok dimakan selagi udara dingin. Tahu campur Surabaya merupakan jajanan kaki lima favorit. Tak seperti tahu campur dari berbagai daerah, tahu campur ini memakai kuah dan daging sapi. Ditambah sambal petis yang pedas manis. Ciri khas yang lain memakai lento alias perkedel singkong yang gurih empuk. Satu porsi tahu campur ini isinya komplet. Karena memakai lontong dan mie, dijamin kenyang dan puas makan tahu campur ini. Meski banyak yang jual, bagi penggemar tahu campur Surabaya ini bisa meracik sendiri. Bahannya mudah didapat, harganya relatif murah dan yang penting makannya puas. Ikuti cara pembuatannya berikut ini. Bahan:• 3 buah tahu putih besar• 500 g mie kuning• 100 g tauge, seduh hingga layu• 4 buah lontong, potong-potong• Kuah:• 500 g daging sandung lamur sapi, potong-potong• 2 liter air• 30 g gula merah• 4 sdm kecap manis• 1 cm lengkuas• 2 lembar daun jeruk• 1 batang serai, memarkan• Haluskan:• 3 siung bawang putih• 5 butir bawang merah• 2 cm kunyit• 1/2 sdt merica butiran• 1/2 sdt jinten• 1 sdm garam• Sambal Petis:• 10 buah cabe rawit hijau• 5 sdm petis udang• 1/2 sdt garam• 250 ml air hangat• Pelengkap:• bawang merah goreng• lento• kerupuk udang/kanji Cara membuat: 1. Kuah: Rebus daging sandung lamur dalam air hingga daging empuk.2. Tumis bumbu halus hingga wangi dan matang. Tambahkan lengkuas, serai dan daun jeruk. Aduk hingga layu.3. Angkat, masukkan ke dalam rebusan daging, tambahkan gula merah dan kecap. Jika perlu tambahkan air.4. Masak hingga mendidih dan bumbu meresap. Angkat.5. Goreng tahu hingga setengah kering, potong-potong.6. Penyajian: Taruh selada di piring, beri potongan lontong, mie kuning dan tauge.7. Tuangi kuah berikut potongan dagingnya.8. Taburi bawang merah goreng. Sajikan dengan Sambal Petis dan kerupuk. Untuk 4 porsi Tips: 1. Tahu campur khas Surabaya ini paling enak dimakan hangat. Daging yang sedikit berlemak paling cocok untuk kuahnya.2. Jika suka, lento atau perkedel singkong bisa dibuat sendiri. Haluskan singkong kukus lalu campur dengan sedikit kelapa parut. Aduk dengan bumbu halus berupa bawang merah, bawang putih, ketumbah dan garam. Bentuk bulat lonjong dan goreng kering."
23,https://food.detik.com/berita-boga/d-5223564/cara-baru-makan-bakso-dan-ashanty-yang-cicip-nasgor-rp-15-juta,"Cara Baru Makan Bakso dan Ashanty yang Cicip Nasgor Rp 1,5 Juta"," Biasanya makan bakso menggunakan mangkuk, kali ini ada cara baru makan bakso menggunakan gelas cup. Dan Ashanty yang coba seporsi nasi goreng harga Rp 1,5 juta. Warung bakso di Kuningan, Jawa Barat menyajikan bakso versi praktis. Wadahnya bukan mangkuk tapi gelas plastik yang bisa dibawa kemana-mana, seperti gelas minuman. Kemudian ada Ashanty yang mencicip nasi goreng mahal di Bali. Seporsi nasi goreng ini dibanderol dengan harga Rp 1,5 juta. Sesuai dengan harganya, nasi goreng ini hadir dengan pelengkap super komplet. Dan terakhir ada minuman diet yang membantu melancarkan metabolisme. Dengan minuman ini program diet bisa lebih berpotensi sukses.  Kios Bakso Urat Kaki Lima yang satu ini hadir dengan wadah nyentrik. Kalau biasanya bakso disajikan menggunakan mangkuk maka di sini disajikan dengan wadah gelas plastik. Penyajian gaya baru ini terinspirasi dari jajanan pentol yang mudah dimakan sambil berjalan. Seperti bakso lainnya, dalam gelas ini berisi mie, bakso dan sayuran pelengkap. Tak ketinggalan juga kuah hangatnya. Baca juga : Bukan Pakai Mangkok, Ini Cara Baru Makan Bakso yang Praktis  Wajar kalau makan menu hotel yang harganya lebih tinggi dari harga di pasaran. Tapi nasi goreng ala hotel yang dicicip Ashanty ini harganya mahal bukan main. Seporsinya Rp 1,5 juta. Wow! Ashanty penasaran dengan rasa nasgor yang ditawarkan Hanging Gardens of Bali yang berlokasi di Ubud. Nasgor ini tampil istimewa dengan pelengkap daging kepiting, scallop, udang balado, ayam dan beberapa lauk pendamping lainnya. Baca juga : Ashanty Cicip Nasi Goreng Rp 1,5 Juta, Gimana Ya Rasanya?  Saat diet, bukan hanya faktor makanan saja yang perlu diperhatikan tapi juga minuman. Beberapa minuman ampuh meningkatkan metabolisme yang dampaknya membantu mempercepat proses diet. Minuman yang harus banyak dikonsumsi tentu saja air mineral, selain itu ada juga teh hijau, air lemon, teh jahe hingga air cuka apel. Masing-masing air minum ini punya khasiat kesehatan. Dan yang terpenting, hindari minum minuman yang mengandung tinggi gula. Baca juga : 7 Minuman untuk Diet Terbaik yang Bisa Tingkatkan Metabolisme"
