,url,title,content
10,https://food.detik.com/info-kuliner/d-5234912/begini-cara-menentukan-harga-jual-kue-untuk-bisnis-ala-thomaz-law,Begini Cara Menentukan Harga Jual Kue untuk Bisnis ala Thomaz Law," Bagi penjual kue apalagi pemula kerap kebingungan dalam menentukan harga jual kue. Berikut tips penting yang dibagikan baker Thomaz Law. Sekarang ini banyak penjual kue yang muncul karena berawal dari hobi mereka membuatnya. Namun karena mereka tergolong pemula, banyak yang bingung dalam menentukan harga jual produk kuenya. Ada yang melihat dari harga kue penjual lain, namun ada juga yang menentukan harga sembarangan tanpa memikirkan modal dan lainnya. Menurut Thomaz Law, baker muda yang telah sukses menjalankan bisnis kue klasik, sebenarnya tak sulit dalam menentukan harga jual kue. Kuncinya hanya satu menurut Thomaz Law, yaitu jangan ingin tahu harga jual kue milik orang lain. Baca Juga: Thomaz Law, 'King of Marmer Cake' yang Jatuh Cinta pada Kue Klasik Indonesia  ""Jangan pernah mau tahu harga kue orang lain, kita sebagai penjual. Karena ketika kita kepengin tahu harga kue orang lain, itu akan menjadi mindset di otak kita,"" ujar Thomaz Law lewat Instagram pribadinya @lawthomaz (29/10). Thomaz Law juga menjelaskan kalau hal tersebut sudah menjadi mindset, maka nantinya harga tersebut yang jadi patokan saat menentukan harga jual yang kita pakai. Padahal seharusnya harga jual kue tersebut bisa ditentukan sendiri sesuai dengan modal yang kita gunakan. Pada prinsipnya, penjual kue sebenarnya bebas menentukan harga. Menurut Thomaz Law 'King of Marmer Cake', selama kue tersebut layak dijual bisa diberikan harga berapapun itu. ""Kue yang udah kamu bikin itu hasil karya kamu. Dan pantes sepantes-pantesnya kamu mau jual berapa. Mau kamu jual setinggi apapun selagi masih ada yang beli jalanin,"" lanjutnya. Sebagai contoh kamu mengetahui harga marmer cake yang dijual Thomaz Law adalah Rp 200 ribu. Namun setelah melihat resepnya, ternyata modal yang digunakan Thomaz Law berkisar di Rp 140 ribu dengan keuntungan Rp 60.000. Saat kamu mengikuti skema harga tersebut dimana harga jual kue orang lain, maka kamu nantinya tidak akan mendapatkan keuntungan. Karena setiap orang memiliki modal dan keuntungan yang berbeda. Jadi, yang harus kamu lakukan adalah hitung sendiri modal awal dan tenaga yang kamu gunakan saat proses pengerjaan. Setelah itu barulah kamu bisa menentukan harga kue untuk dijual. Baca Juga: Resep Marmer Cake Super Lembut ala Thomaz Law "
11,https://food.detik.com/sayur/d-5234645/resep-semur-jengkol-pedas-yang-dijamin-bikin-nagih,Resep Semur Jengkol Pedas yang DIjamin Bikin Nagih," Jengkol yang renyah gurih enak dilah jadi semur jengkol pedas. Tambahan cabe bikin rasanya gurih pedas dan selalu bikin nambah saat dikunyah. Aroma khas jengkol tak disukai sementara orang. Tetapi jika bisa mnegolahnya jengkol bisa jadi lauk enak. Rasa renyah dan nutty nya cocok dipadukan dengan bumbu pekat. Di jawa Barat jengkol dijadikan lalapan dan ditumis. Di Sumatera Barat dikenal sebagai jariang yang enak dibuat rendang hingga balado. Masyarakat Betawi punya semur jengkol yang legit gurih. Kali ini semur jengkol khas Betawi diolah dengan bumbu sedikit pedas. Rasanya manis, gurih dan pedas. Kuahnya kental hingga pas dimakan dengan nasi hangat. Enak juga untuk lauk nasi uduk atau lontong sayur. Kalau sudah ngiler ingin menyantap semur jengkol yang sedap, ikuti petunjuk resep dan tips berikut ini. Bahan: • 500 g jengkol segar• 5 sdm minyak sayur• 100 ml kecap manis• 3 cm kayu manis• 2 lembar daun salam• 3 cm lengkuas, memarkan• Bumbu Halus:• 5 buah cabe merah keriting• 7 butir bawang merah• 4 siung bawang putih• 1/2 sdt merica butiran• 4 butir kemiri• 1/4 butir pala• 2 sdt gula pasir• 1 sdm garam Cara membuat: 1. Cuci bersih jengkol. Lalu didihkan air dalam panci. Masukkan jengkol. Rebus hingga jengkol lunak. Tiriskan.2. Jika jengkol besar, geprek atau memarkan jengkol hingga agak pipih.3. Bumbu Halus: Giling atau tumbuk bumbu hingga halus.4. Tumis Bumbu Halus hingga harum dan matang.5. Tambahkan daun salam dan lengkuas, aduk hingga layu.6. Masukkan jengkol, aduk hingga rata. Angkat, pindahkan ke panci.7. Tuangi air hingga jengkol terendam. Tambahkan kecap dan kayu manis.8. Masak dengan api kecil hingga jengkol lunak dan kuah mengental. Angkat dan dinginkan. Untuk 10 porsi Tips: 1. Untuk membuat semur jengkol pilih jengkol yang tidak terlalu muda karena akan lembek teksturnya. Juga jangan terlalu tua karena akan sangat keras.2. Jengkol bisa dibeli segar dengan kulit ari atau yang sudah direbus. Sebaiknya rebus jengkol dengan air bersih, bisa ditambahkan beberapa lembar daun salam agar jengkol tak beraroma terlalu tajam."
12,https://food.detik.com/info-kuliner/d-5234856/ada-air-di-bulan-apa-bisa-diminum-ya,"Ada Air di Bulan, Apa Bisa Diminum Ya?"," Penemuan air di bulan, menimbulkan banyak pertanyaan lucu dari netizen. Salah satunya mereka menanyakan apakah air di bulan bisa diminum. Pada tanggal 26 Oktober lalu, Badan Penerbangan dan Antariksa Amerika Serikat (NASA) mengkonfirmasi bahwa ada air di bulan. Baca Juga: Pakai Fase Bulan, Restoran Terbaik di Dunia Ini Sajikan Makanan Alami  Lewat Twitter (30/10), Jim Bridenstine selaku perwakilan NASA, menyampaikan penemuan besar ini di Twitter. Ia mengatakan bahwa ada jejak air di bulan yang terkena sinar matahari. Meski begitu NASA masih belum bisa memastikan apakah air ini bisa digunakan sebagai sumber daya. Namun penemuan ini tetap sangat besar dan membuat banyak orang penasaran. Terutama para netizen di Twitter yang bertanya-tanya bagaimana tampilan air di bulan. Ada juga yang iseng bertanya apakah air dibulan bisa diminum. ""Jika bulan saja bisa menghidrasi dirinya sendiri, mengapa manusia sulit sekali minum air putih agar tidak dehidrasi?"" komen salah satu netizen. ""Air sudah ditemukan di bulan, pertanyaannya apakah air itu bisa kita minum?"" tanya netizen. ""Jika air dibulan bisa diminum, kira-kira bagaimana rasanya? Saya penasaran dengan rasa air putih di luar bumi,"" tulis netizen lainnya. Tak hanya rasa penasaran pada rasa air di bulan, banyak juga netizen yang bercanda bahwa air itu bukan berasal dari bulan. ""Nampaknya penemuan air ini bukan berasal dari bulan. Tapi air ini ditemukan karena salah satu astronot yang mendarat di bulan, lupa membawa botol minuman mereka,"" canda netizen. ""Tetap penasaran, apakah air yang mereka temukan adalah air biasa. Atau bisa diubah menjadi sparkling water?""canda netizen lainnya. Sampai sekarang penemuan air di bulan ini masih diteliti lebih dalam. NASA belum bisa mengkonfirmasi apakah air itu aman untuk diminum manusia atau tidak. Selain penemuan air di bulan, sebelumnya netizen juga sempat heboh dengan cuitan pengusaha Elon Musk. Elon mengatakan bahwa ia berencana untuk ngopi di Mars. Tentunya hal ini mendapatkan banyak candaan dan kritik dari netizen. Baca Juga: Netizen Kritik Elon Musk yang Mau Ngopi di Planet Mars "
13,https://food.detik.com/info-kuliner/d-5233736/di-ancol-kamu-bisa-makan-dengan-suasana-laut-di-5-tempat-ini,Di Ancol Kamu Bisa Makan dengan Suasana Laut di 5 Tempat Ini," Kangen suasana laut kamu bisa jalan-jalan ke Ancol. Di sana juga ada tempat-tempat makan dengan suasana dan panorama laut yang indah. Terletak di pesisir Jakarta bagian utara, Ancol sejak dulu terkenal sebagai tempat wisata yang paling populer di dalam kota sejak dulu. Tak hanya dipenuhi dengan taman rekreasi saja, tapi banyak tempat makan enak di sekitar Ancol. Setiap tempat makan ini tentunya menawarkan suasana dan konsep yang berbeda. Misalnya suasana romantis di restoran The Pier by Kalaha, dengan pemandangan laut lepas. Kemudian Ancol Jimbaran Resto di Pantai Karnaval, cocok bagi yang sedang rindu suasana makan seafood di Bali. Tak ketinggalan Nyiur Resto yang ada di Putri Duyung Hotel, dihiasi dengan kolam renang bentuk kapal dan hamparan laut Ancol. Baca Juga: 5 Tempat di Jakarta Utara Ini Punya Olahan Seafood Segar Mantap  1. Nyiur Resto Ancol Restoran yang satu ini letaknya berada di dalam Putri Duyung Hotel. Ketika masuk ke dalam restoran, pengunjung akan disambut dengan pemandangan keren dari kolam renang bentuk kapal yang ada di sana. Di bagian luarnya terdapat saung-saung kecil yang nyaman untuk tempat bersantai. Dari kolam renang yang Instagenic, pengunjung bisa bersantap sambil menikmati semilir angin pantai di sana. Menu makanan yang ditawarkan cukup beragam, tapi menu andalannya merupakan hidangan tradisional. Seperti Empal Gepuk, Tongseng, Nasi Goreng Kambing, hingga Mie Goreng Jawa. Kisaran harga makanannya mulai dari Rp 45.000. Nyiur RestoPutri Duyung Hotel.Ancol, Jakarta Utara.Telp: (021) 2601680 2. The Pier by Kalaha Tak jauh dari Nyiur Resto, ada restoran The Pier by Kalaha yang terkenal dengan suasana romantisnya. Restoran yang satu ini mengambil konsep interior modern dengan ruang semi outdoor. Pengunjung bisa menikmati makanan atau sekedar ngopi dengan pemandangan pantai. Untuk menu makanan yang disajikan lebih ke arah Western. Terbagi ke dalam beberapa menu seperti makanan pembuka, makanan utama, aneka daging panggang sampai hidangan penutup. Salah satu menu andalannya ada Kepiting Saus Singapura, Beef Sirloin Steak, Tuna Sandwich hingga Steamed Mussels. Kisaran harganya dari Rp 50.000. The Pier by KalahaTaman Impian Jaya Ancol, Putri Duyung.Jl. Lodan Timur No. 7, Ancol, Jakarta Utara.Telp: 021 64716691 3. Ancol Jimbaran Resto Lokasinya di sekitar Pantai Karnaval Ancol. Restoran seafood gaya Jimbaran ini jadi obat kangen bagi orang-orang yang rindu makan seafood di pinggir pantai.Konsepnya hampir sama dengan restoran seafood di Jimbaran, Bali. Menu makanan yang ditawarkan juga cukup lengkap dan tak hanya fokus ke aneka seafood saja. Seperti menu sayur Uraban ala Jimbaran yang diracik dengan bumbu Bali. Lalu ada juga Udang Jerubung Bakar Bali yang gurih. Di sini tersedia aneka olahan seafood dari cumi, lobster, ikan laut sampai kepiting. Kisaran harganya dimulai dari Rp 30.000. Ancol Jimbaran RestoJl. Pantai Karnaval Ancol No.7.Ancol, Jakarta Utara.Telp: (021) 6401040 4. Columbus Cafe Buat yang cari tempat makan keren di wilayah Ancol dengan harga terjangkau, di sini tempatnya. Mampir ke Dermaga Cinta, ada Columbus Cafe yang berdiri tepat di tepi pantai. Di sini pengunjung bisa asyik bersantai melihat pemandangan laut di sore hari. Untuk menu makanan yang ditawarkan cukup beragam, dan konsepnya mirip seperti warung roti bakar. Menu andalannya ada Chicken Chop Fried Rice with Ebi Furai, Roti Bakar Bulls Eye, Fish Burger Fries, Banana Chcoco Cheese, hingga Beef Baked Rice. Kisaran harganya dimulai dari Rp 20.000. Columbus CafeTaman Impian Jaya Ancol, Dermaga Cinta.Ancol, Jakarta Utara.Telp: 081290905476 5. Batavia Marina Kalau restoran yang satu ini letaknya di luar Taman Impian Jaya Ancol, tapi masih di sekitar sana. Tepatnya di Komplek Pelabuhan, Sunda Kelapa. Restoran ini terkenal menawarkan sensasi mewah bersantai dengan suasana kapal pesiar. Di bagian luar restoran terdapat barisan yacht yang mengapung di sana. Untuk menu makanannya di Batavia Marina, menggabungkan hidangan Indonesia dengan Western. Salah satu menu andalannya ada aneka pizza dan pasta, Sate Ayam Marina, Gurame Selera, Sate Maranggi, Buncis Szechuan hingga Nautical Salmon Steak. Kisaran harganya mulai dari Rp 50.000. Batavia MarinaKomplek Pelabuhan Sunda Kelapa.Jl. Raya Baruna No. 9, Ancol, Jakarta Utara.Telp: +62216915599 Baca Juga: 5 Restoran di Ancol yang Punya Menu Seafood Enak "
14,https://food.detik.com/info-kuliner/d-5234527/bikin-geram-terjadi-lagi-youtuber-mukbang-daging-kucing,Bikin Geram! Terjadi Lagi YouTuber Mukbang Daging Kucing," Bikin geram, YouTuber di Thailand ini bikin konten mukbang ASMR daging kucing. Aksinya banyak dikecam netizen. YouTuber memang kerap melakukan hal ekstrem demi kontennya. Seperti pada konten mukbang misalnya. Tak jarang YouTuber yang nekat makan hewan-hewan tak lazim termasuk hewan peliharaan. Dalam beberapa kasus yang viral, ada YouTuber yang pernah mukbang kelelawar, ular, marmut, hingga bayi tikus. Dan yang tak kalah bikin geram ada yang mukbang daging kucing. Baca Juga : 5 Mukbang Ekstrem YouTuber Indonesia, Makan Kelelawar hingga Tikus! Seperti yang dilakukan oleh YouTuber dengan channel bernama VI ASMR di Thailand. Sesuai dengan namanya, YouTuber tersebut memang menawarkan konten mukbang dengan efek suara ASMR. Channel YouTube VI ASMR sudah mulai aktif sejak dua tahun yang lalu. Awalnya, konten mukbang ASMR dilakukan dengan mengonsumsi makanan normal. Mulai dari buah-buahan, seafood, mie dan aneka sayuran lainnya. Namun, ia lantas berubah haluan dengan mengonsumsi hewan-hewan ekstrem. Salah satunya adalah daging kucing. Tak hanya sekali, bahkan ada video mukbang lainnya di mana ia juga makan daging kucing. Mengenaskannya lagi, kucing tersebut dimasak secara utuh tanpa dipotong-potong. Dalam sebuah videonya, daging kucing itu disajikan dengan bumbu serai. ""ASMR kucing kukus dengan serai rasanya enak,"" tulisnya di judul video. Selain dikukus, ia juga pernah mukbang daging kucing yang digoreng. Bahkan saat dimakan terdengar suara kriuk-kriuk renyah yang membuat netizen semakin miris menyaksikannya. Video itu menjadi viral di media sosial dan menuai kritik tajam. Hampir 2.000 netizen yang mengecam aksi mukbang ekstremnya tersebut, khususnya para pencinta hewan. ""Stop makan kucing. Kucing itu hewan peliharaan yang menyenangkan bukan untuk dijadikan makanan,"" tulis netizen. ""Gue sebagai pecinta kucing sakit hati bangat ngeliatnya. Tolong semuanya report aja semua vidoenya,"" tulis netizen lainnya. ""Video mukbang ini gak pantas untuk ditampilkan. Report aja videonya,"" tulis netizen di kolom komentar. Banyak netizen yang mengomentari jika makan daging hewan ekstrem jadi penyebab virus Corona dan virus lainnya. Mereka juga berharap video sejenis ini tak ditayangkan lagi oleh Youtube. Selain mukbang daging kucing, YouTuber tersebut juga mukbang hewan-hewan ekstrem lainnya. Ia pernah mukbang daging anjing, ular, kodok dan reptil lainnya. Baca Juga : Momen Seru Ssoyoung, Wanita Cantik yang Hobi Mukbang Makanan Ekstrem"
15,https://food.detik.com/info-kuliner/d-5234485/demi-bantu-orang-miskin-restoran-ini-jual-makanan-seharga-rp-200,"Demi Bantu Orang Miskin, Restoran Ini Jual Makanan Seharga Rp 200"," Untuk memberi makan orang miskin, restoran di India ini menjual makanan seharga Rp 200 per porsi. Dalam sehari bisa menghabiskan hingga 1.000 porsi. Bersedekah bisa dengan cara apapun. Seperti yang dilakukan oleh restoran Shyam Rasoi Nangloi yang berada di Bahooto Wali Gali, New Delhi, India. Restoran tersebut menawarkan paket makan lengkap dengan harga murah, yaitu 1 Rupee atau setara dengan Rp 200. Itu dilakukan untuk membantu orang miskin yang kelaparan. Baca Juga : Jual Makanan Rp 200, Nenek Ini Bantu Orang yang Membutuhkan Dilansir dari India Times (27/10) restoran tersebut merupakan milik seorang pria bernama Parvin Kumar Goyal. Parvin sudah dua bulan menjalankan restoran beramalnya tersebut. Paket makanan murah itu awalnya ditujukan untuk orang miskin yang kelaparan saja. Namun, Parvin juga mempersilahkan masyarakat dari berbagai lapisan lainnya. Restorannya selalu ramai setiap hari di jam makan siang, sekitar pukul 11.00 hingga 13.00. Saking ramainya bahkan antrean sampai mengular hingga ke luar restoran. Paket makanan tersebut berisi berbagai jenis makanan. Ada nasi, roti, soya pulao, paneer, kedelai, dan halwa. Menu makanannya akan berubah setiap hari. Dalam sehari Parvin bisa menghabiskan paket makanan hingga ribuan porsi. Parvin sangat bersyukur karena bisa membantu meringankan beban orang lain, dengan cara memberi makan. ""Setiap hari kami memberi makan 1.000 hingga 1.100 orang di sini. Selain itu, kamu juga memberikan parcel ke daerah terdekat,"" ujar Parvin. Paket tersebut berisi bahan makanan untuk dibagikan ke 2.000 masyarakat di beberapa daerah, seperti daerah Inderlok dan Sai Mandir di India. Untuk menjalankan program sedekahnya tersebut, Parvin dibantu dengan sumbangan dari para donatur. Ada yang memberi sumbangan berupa uang, makanan hingga tempat untuk restorannya. ""Kami mendapatkan sumbangan dari orang-orang. Kemarin seorang wanita tua datang memberi sumbangan. Lalu ada yang memberi kami gandum. Ada juga yang membantu lewat pembayaran digital,"" tutur Parvin. Parvin tak sendirian, tetapi dibantu dengan enam orang dari timnya. Mereka diberi upah sekitar Rp 80.000 tergantung pada penjualan. Penduduk setempat dan mahasiswa pun banyak yang membantu aksi sosialnya ini. Baca Juga :5 Penjual Makanan Ini Tawarkan Harga Seribuan Demi Bantu Orang Susah"
16,https://food.detik.com/info-kuliner/d-5234006/sajikan-menu-pizza-wellington-gordon-ramsay-dikritik-pedas,"Sajikan Menu Pizza Wellington, Gordon Ramsay Dikritik Pedas!"," Gordon Ramsay sajikan menu baru untuk restorannya berupa Pizza Wellington. Sayangnya kreasi ini malah menuai kritik pedas dari netizen. Wah, kenapa ya? Gordon Ramsay merupakan selebriti chef yang terkenal di dunia. Ia merupakan juri dalam program masak Master Chef. Sosoknya dikenal tegas dan sering mengkritik para peserta dengan ucapan pedas. Gordon Ramsay juga memiliki beberapa usaha restoran. Salah satunya Union Street Cafe yang ada di Southwark, London. Lewat akun Instagramnya @gordonramsay (27/10), Gordon Ramsay mengenalkan menu baru untuk restorannya tersebut. Yaitu Pizza Wellington. Sebelumnya Beef Wellington memang jadi menu andalan restoran milik Gordon Ramsay tersebut. Berupa daging sapi seberat 400 gram yang dibalut olahan jamur dan ham lalu dibungkus dengan puff pastry. Baca Juga: Gordon Ramsay Beri Kritik Pedas untuk Tutorial Masak di TikTok, Apa Katanya?  Kemudian dipanggang selama 15-20 menit dengan suhu 200°C. Sampai puff pastry menjadi cokelat keemasan. Namun sebelum disajikan, Beef Wellington tersebut harus didiamkan terlebih dahulu selama 10 menit. Ketika disajikan Beef Wellington tersebut diiris dan terlihat juicy. Disajikan dengan mashed potato dan sayuran. Harganya dibanderol $57-$101 (Rp 841 ribu-Rp 1,4 juta). Gordon Ramsay juga memiliki menu Lobster Wellington yang dibanderol harga $70 (Rp 1 jutaan). Potongan lobsternya sangat tebal dan dibungkus puff pastry. Dilansir Mirror (27/10), kini menu barunya adalah Pizza Wellington. Harganya sekitar $62 (Rp 913 ribu). Tapi menu baru ini malah menuai kritik pedas dari netizen. Karena tampilannya bukan seperti pizza melainkan Beef Welligton pada umumnya. Ternyata alasan Gordon Ramsay menggunakan kata 'pizza' pada menunya tersebut karena yang digunakan untuk membungkus adalah adonan pizza. Bukanlah puff pastry yang biasanya disajikan pada Beef Wellington. Pada unggahannya di Instagram, Gordon menuliskan keterangan, ""Kami punya beef, kami punya lobster, sekarang kami kenalkan pizza wellington,"" tulisnya. Karena melihat tak ada yang berbeda antara tampilan Beef Wellington dengan Pizza Wellington ini, banyak netizen jadi kesal. Banyak komentar negatif membanjiri unggahannya tersebut. ""Apa aku terlewat? Ini terlihat seperti beef wellington pada umumnya,"" tulis netizen. ""Dimana pizzanya? Ini hanya menggunakan adonan pizza bukan puff pastry kan?"" sahut netizen lain. ""Tolonglah Gordon, jangan menyematkan kata pizza di nama makanan tersebut karena tidak ada hubungannya sama sekali,"" komentar netizen lainnya. Baca Juga: Gordon Ramsay Dikritik Tajam karena Sajikan Steak Mini dan Kentang Goreng Keasinan "
17,https://food.detik.com/resto-dan-kafe/d-5234586/medja-restaurant-ada-iga-bakar-dan-ayam-gairah-sedap-di-resto-hits-bogor,Medja Restaurant: Ada Iga Bakar dan Ayam Gairah Sedap di Resto Hits Bogor," Bogor punya banyak kafe dan restoran kekinian yang layak dikunjungi. Salah satunya Medja Restaurant yang menawarkan makanan enak dan suasana asri. Pilihan kuliner di Bogor tak hanya menu-menu ikonik dan klasik saja, tapi banyak juga kafe dan restoran kekinian yang menawarkan pengalaman bersantap istimewa. Suasananya bikin betah dengan pilihan makanan beragam. Salah satu restoran baru berkonsep keluarga yang ramai dikunjungi adalah Medja Restaurant. Lokasinya ada di Jalan Pajajaran Indah V No. 6, Baranangsiang, Bogor. Baca Juga: Martabak Kiky : Lembut Wangi Martabak Hijau Langganan Jokowi  Restoran ini menghadirkan suasana yang sejuk. Terdapat area indoor serta outdoor yang cukup luas. Di tengah-tengah restoran terdapat kolam panjang yang membuat suasananya makin sejuk. Pada bagian indoor, terdapat area nyaman dengan cahaya lampu temaram. Area ini cocok untuk pengunjung yang mau makan dalam suasana lebih formal. Terdapat juga area yang lebih privat namun harus reservasi terlebih dahulu. Sementara outdoor-nya cukup luas. Cocok untuk mereka yang datang bersama keluarga besar. Banyak juga spot foto menarik di sekeliling restoran. Biasanya para pengunjung berfoto di depan pintu penghubung antara area indoor dan outdoor. Ada juga yang berfoto di tepi kolam. Tak hanya suasana asyik yang ditawarkan oleh Medja Restaurant, tapi juga beragam menu makanan yang bisa memanjakan lidah. Penasaran, detikFood menyambangi restoran yang selalu ramai hingga selalu banyak antrean. Karena masih dalam masa PSBB dan pemberlakuan protokol kesehatan, pihak Medja Restaurant mengurangi kapasitas pengunjung hingga 50%. Oleh karenanya banyak pengunjung yang antre di bagian depan restoran. Lama antrenya bisa memakan waktu 30-60 menit atau lebih. Bagi para pengunjung yang sudah makan juga diberikan batasan waktu yaitu hanya 2 jam.  Kami akhirnya memilih area outdoor karena lebih santai dan bisa merasakan suasana sejuk serta asri. Untuk makanan, kami tertarik mencicipi menu Indonesia di sini yang konon jadi andalan. ""Kami menyajikan hidangan Nusantara. Ada berbagai macam dari berbagai daerah, tapi tentunya kita menginovasi sedikit dengan ciri khas Medja Restaurant,"" ujar Tedjo selaku Assistant Manager Medja Restaurant. Kami memesan beberapa menu andalan Medja Restaurant. Seperti Iga Sapi Bakar, Ayam Gairah, Mie Goreng Balacan, Es Kopi Medja, hingga Wedang Latte. Semua hidangan disajikan dengan tampilan yang cantik. Untuk satu porsinya terbilang besar, bisa dimakan 2-3 orang. Iga Sapi Bakar (Rp 112.000) tampak menggugah selera. Berupa iga sapi yang dibakar dengan bumbu manis lalu disajikan dengan mashed potato dan bayam yang dimasak dengan saus krim. Untuk iga sapi bakar, rasaya enak dengan sentuhan manis yang pas. Hanya saja teksturnya masih sedikit alot dan banyak lemak. Sepertinya akan lebih enak jika iga sapinya dibuat lebih empuk dan tak memiliki banyak lemak. Iga sapi terasa nikmat dipadukan mashed potato dan bayam saus krim. Kamipun mencoba mencicipinya dengan nasi putih hangat, ternyata juga tak kalah sedap. Ayam Gairah (Rp 64.000) tak kalah menggoda. Dibuat dari potongan ayam tanpa tulang yang digoreng menggunakan balutan tepung. Lalu dimasak kembali dengan sambal gairah khas Medja yang pedas. Tekstur ayamnya memang tak renyah, tapi empuk dan pas ketika dinikmati dengan sambalnya yang nendang. Menurut kami, menu ini cocok dipadukan dengan nasi putih hangat. Mie Goreng Belacan (Rp 52.000) juga tak ketinggalan kami cicipi. Biasanya yang dimasak dengan sambal balacan adalah kangkung, tapi di Medja Restaurant dikreasikan dengan mie goreng. Mie digoreng dengan bumbu balacan atau terasi udang, kemudian ditambahkan potongan ayam, ati ampela, tahu, dan sayuran seperti sawi hijau, tauge, dan potongan tomat. Penyajiannya menggunakan kerupuk dan acar timun wortel.  Medja Restaurant juga punya beragam minuman. Mulai dari teh, jus, hingga mocktail. Menu andalannya, yaitu Es Kopi Medja dan Wedang Latte. ""Minuman kita punya Es Kopi Medja. Es kopi susu ditambah dengan brown sugar syrup dan topping macchiato creamnya,"" kata Tedjo menjelaskan minuman andalan ini. Es Kopi Medja (Rp 28.000) disajikan dalam gelas berukuran sedang. Rasanya tak terlalu pahit dengan sensasi manis dari sirup brown sugarnya yang pas. Lalu untuk Wedang Latte (Rp 28.000), sensasinya cukup unik. Karena terasa paduan kopi, jahe, dan susu. Ada sensasi hangat dari jahe dengan sensai dingin es batu.Toppingnya pandan macchiato berwarna hijau muda dengan taburan sagu mutiara Medja Restaurant tentu saja memberlakukan protokol kesehatan yang cukup ketat. Ada beberapa staf yang akan mengarahkan untuk cuci tangan dan pengukuran suhu. Di ruang tunggunya juga dilengkapi dengan air humidifier. Jadi kelembaban udara tetap terjaga. Beberapa kursi juga diberikan tanda silang atau tulisan agar tidak diduduki. Hand sanitizer juga tersebar di setiap meja makan. Ingin tempat makan dan produk Anda di-review oleh detikFood? Kirim email ke foodreview@detik.com. Medja RestaurantJalan Pajajaran Indah V No. 6, Baranangsiang, Bogor(0251) 8385841Jam buka: 11.00-2O.30 WIB Baca Juga: Baku Sayang: Ayam Tinorangsak hingga Garopa Woku Sedap Buat Makan Siang "
