,url,title,content
15,https://food.detik.com/info-sehat/d-5219069/7-tanda-tubuh-kelebihan-asupan-gula-yang-patut-kamu-waspadai,7 Tanda Tubuh Kelebihan Asupan Gula yang Patut Kamu Waspadai," Tanda tubuh kelebihan gula ini sebenarnya mudah terlihat, namun kerap tak disadari. Seperti jerawat di dagu dan merasa cepat lapar. Gula sering kali dikonsumsi terlalu banyak oleh seseorang. Jenisnya ada yang alami dan olahan. Keduanya terkandung dalam banyak makanan yang kita makan sehari-hari. Mengonsumsi terlalu banyak gula tidak baik untuk tubuh. Pasalnya gula bisa memicu sindrom metabolik klasik seperti gula darah tinggi, tekanan darah tinggi, dan obesitas. Untuk batas konsumsi harian gula, Kementerian Kesehatan Indonesia menyarankan tak lebih dari 50 gram per hari. Jumlah ini setara 5-9 sendok teh (sdt) gula. Lalu bagaimana cara mengetahui jika tubuh kamu sudah kelebihan gula? 7 tanda yang dirangkum Eat This, Not That (19/10) ini bisa jadi indikatornya: 1. Alami masalah pencernaanBeberapa penelitian menunjukkan konsumsi gula berlebih bisa menurunkan keragaman bakteri sehat di usus dalam waktu seminggu. Hal ini berisiko menimbulkan masalah pencernaan. ""Terlalu banyak konsumsi gula pasir tidak akan berefek bagus jika kamu sedang mencoba menambah bakteri sehat di sistem pencernaan,"" tutur ahli gizi Brigitte Zeitlin. Hal senada dikonfirmasi ahli gizi lain, Karen Ansel. Ia menyebut biasanya orang yang banyak makan gula, kurang makan serat. Sehingga mereka berisiko alami masalah pencernaan. 2. Muncul jerawat di area mulut dan dagu Tanda tubuh kelebihan gula selanjutnya ternyata bisa dilihat dari jerawat. Posisinya biasanya ada di sekitar mulut dan dagu. Ansel mengatakan secara teori gula meningkatkan produksi hormon androgen yang terkait dengan jerawat hormonal. Biasanya jerawat ini muncul di sekitar area garis rahang. ""Jika kamu bermasalah dengan jerawat dan tidak tahu kenapa, coba kurangi asupan gula sehari-hari untuk mengatasinya,"" kata Ansel.  3. Jadi mudah marahKamu merasa jadi mudah marah, emosi, atau mengalami suasana hati buruk belakangan? Bisa jadi karena kamu sudah terlalu banyak konsumsi gula. Beberapa penelitian mengaitkan gula dengan gangguan suasana hati, termasuk depresi. Pasalnya gula bisa mengacaukan neurotransmitter di otak yang bertugas mengatur hal itu. Zeitlin mengatakan cara terbaik untuk menstabilkan gula darah dan suasana hati adalah dengan mengonsumsi lebih banyak makanan yang lama dicerna. Seperti bijian utuh, serat, dan protein. Baca Juga: Tak Disangka! 7 Makanan dan Minuman Ini Ternyata Tinggi Gula  4. Tidak bisa tidur nyenyak di malam hari Tanda tubuh kelebihan gula selanjutnya adalah kamu sulit tidur nyenyak di malam hari. ""Asupan gula akan memberi dorongan energi dengan menaikkan gula darah, yang selalu membuat ritual tidur jadi sulit,"" ujar Zeitlin. Ia menambahkan, di kasus lain gula juga bisa membuat kamu mengantuk karena pelepasan serotonin. Tapi kualitas tidur kamu tidak akan memuaskan. ""Kamu mungkin tidak akan bangun dengan perasaan baik, karena gula darah turun pada malam hari,"" jelas Ansel. Untuk menghindarinya, jangan makan makanan manis paling tidak dua jam sebelum kamu tidur. 5. Keriput muncul lebih cepatCoba perhatikan wajahmu. Jika muncul keriput padahal kamu belum tua, bisa jadi karena konsumsi terlalu banyak gula. Sebab pola makan tinggi gula terbukti bisa mempercepat penuaan kulit. Hal ini karena terlalu banyak gula bereaksi dengan protein di aliran darah hingga membentuk Advanced Glycation Endproducts (AGEs), yang pada akhirnya merusak protein struktural dalam kolagen kulit dan elastin yang membuat kulit kenyal. ""Diet tinggi gula pasti bisa membuat kulit lebih cepat keriput, membuat kamu terlihat lebih tua. Membatasi gula bisa membuat perbedaan,"" kata Ansel.  6. Pengin dessert usai makan malamTanda tubuh kelebihan gula ini juga perlu kamu waspadai yaitu selalu pengin makan manis atau dessert usai makan malam. Gula sendiri merupakan bahan makanan yang memang bikin ketagihan. Zeitlin menjelaskan, ""Gula meningkatkan hormon perasaan senang. Nah, karena otak kamu merasa senang, otak akan menginginkannya kembali."" 7. Selalu lapar Sudah makan tapi masih merasa lapar dan lapar lagi? Bisa jadi kamu sudah terlalu banyak makan gula dan kurang asupan serat atau protein yang mengenyangkan. ""Gula bisa membuat gula darahmu naik dan turun dengan cepat, jadi kamu merasa lebih lapar dan menginginkan lebih banyak gula untuk memuaskannya,"" kata Zeitlin. Untuk menghindarinya, fokus pada asupan makanan sehat. Kurangi makanan mengandung gula dan perbanyak konsumsi sumber serat, lemak sehat, dan protein tanpa lemak. Kombinasi makanan tersebut akan membuat kamu kenyang lebih lama. Baca Juga: Pertama di Dunia, Indonesia Punya Gula Pasir Berbahan Sorgum "
16,https://food.detik.com/info-kuliner/d-5219065/unik-resto-padang-ini-sajikan-makanan-di-conveyor-belt-mirip-sushi,Unik! Resto Padang Ini Sajikan Makanan di Conveyor Belt Mirip Sushi," Conveyor belt biasanya digunakan restoran sushi saat menyajikan makanannya, tapi kali ini juga digunakan sebuah restoran Padang yang ada di Surabaya. Rumah makan khas Minang atau kerap disebut rumah makan Padang banyak tersebar di Indonesia. Makanan yang disajikan sudah pasti hidangan khas Minang dengan bumbu kaya rempah dan santan. Biasanya hidangan-hidangan itu disajikan di atas piring yang ditumpuk berjajar ke atas di dalam etalase. Lalu nanti pelanggannya tinggal memilih makanan apa yang diinginkan. Ada juga rumah makan Padang yang menyajikan beragam menu di atas meja ketika pengunjung makan langsung di tempat. Pelanggan bebas memilih dan setelah selesai makan tinggal menyebutkan menu apa saja yang habis disantap. Baca Juga: Terdampak Corona, Restoran Padang Ini Punya Siasat Untuk Jaga Omzet  Namun sebuah resto Padang di Surabaya memilih cara penyajian unik. Pihaknya memanfaatkan conveyor belt atau ban berjalan yang biasanya digunakan restoran sushi. Conveyor belt memudahkan pelanggan memilih menu yang diinginkan karena beragam pilihannya akan diputar berkeliling (rotating plate). Jika tertarik, pelanggan bebas mengambil piring hidangan dan bayar sesuai jenis piringnya. Adalah restoran Aroma Padang yang memiliki konsep unik tersebut. Lokasinya ada di Royal Plaza Surabaya lantai LG. Tak akan susah mencarinya karena namanya cukup besar. Kalau ingin makan di sini, kamu tinggal pilih tempat duduk. Lalu ambil lauk-lauk yang diinginkan di atas conveyor belt. Menunya sangat beragam dan pasti membuat bingung saat memilihnya. Ada aneka gulai, mulai dari ayam hingga otak sapi. Ada juga rendang, udang pete, perkedel, sayur daun singkong, hingga sambal hijau. Harganya dibanderol per lauk, mulai dari Rp 6.000-Rp 30.000-an. Cara unik menggunakan conveyor belt ini dilakukan oleh Aroma Padang saat masa pandemi. Selain unik, cara ini dirasa lebih higenis dan sesuai dengan protokol kesehatan social distancing. Baca Juga: Kocak! Netizen Ini Dikira Gelandangan saat Makan di Restoran Padang "
17,https://food.detik.com/info-kuliner/d-5217363/5-idol-kpop-ini-punya-selera-makan-aneh-kayak-apa-ya,"5 Idol Kpop Ini Punya Selera Makan Aneh, Kayak Apa Ya?"," Idol Kpop ini jadi sorotan lantaran selera makannya yang aneh. Ada yang doyan nasi campur biskuit hingga makan daging pakai saus cokelat! Idol Kpop menorehkan banyak cerita yang selalu menarik disimak. Terlepas dari prestasi mereka di bidang menyanyi dan tari, idol Kpop ini punya sisi lain yang belum banyak diketahui. Misalnya tentang selera makan aneh yang dimiliki 5 idol Kpop ini. Ada Kang Daniel sampai Yeri dari girlgroup Red Velvet yang masuk dalam daftar. Dilansir dari Kstarlive (3/7), berikut 5 idol Kpop yang punya selera makan aneh: 1. Kang DanielPenyanyi 23 tahun ini punya selera makan aneh. Sebab Kang Daniel suka ngemil irisan bawang bombai beku. Sebelumnya ia akan memotong-motong bawang bombai, memasukkannya dalam freezer, lalu menikmatinya sebagai snack. Untuk makanan favorit lain, idol jebolan Produce 101 Season 2 ini ternyata pencinta es krim. Pilihan rasa favoritnya adalah chocolate mint yang manis menyegarkan. Baca Juga: 5 Idol Kpop Pencinta Es Krim Cokelat Mint, Ada Kang Daniel dan IU  2. Tzuyu Dari girl group TWICE, ada Tzuyu yang menarik perhatian dengan pola makannya. Dalam sebuah wawancara ia mengakui suka makan nasi pakai cookies atau biskuit. Wanita 21 tahun ini bahkan tak menyangka kalau rasanya enak. Tzuyu sendiri adalah artis Kpop yang coba jadi seorang vegetarian. Belum lama ini ia fokus mengonsumsi sumber nabati saja dan tidak mengonsumsi daging merah. Baca Juga: Tzuyu 'TWICE' dan Song Il Gook, Idol Korea yang Merupakan Vegetarian  3. Hani Ahn Hee-yeon alias Hani adalah anggota girl group Korea Selatan EXID. Wanita cantik ini adalah pencinta makanan asin. Ia bahkan pernah membawa stok garam di tasnya. Hani lalu akan menaburkan garam ke makanan apapun yang sedang ia lahap. Mulai dari mie instan, pizza, hamburger, dan banyak lainnya. 4. Yeri Idol Kpop selanjutnya yang punya selera makan aneh adalah Yeri dari Red Velvet. Ia pencinta daging seperti banyak orang Korea lain, tapi Yeri memakannya tidak dengan saus gurih. Yeri suka makan daging panggang dengan saus cokelat. Ia mencampurkan saus manis ini dengan gochujang untuk memberikan aksen rasa manis. Baca Juga: Menu Diet Yeri Red Velvet, Tetap Enak Walaupun Sehat  5. KeiTerakhir ada Kei dari Lovelyz's yang punya selera makan aneh. Wanita 25 tahun ini suka makan jokbal alias kaki babi yang populer di Korea. Hanya saja Kei melahap Jokbal sambil minum susu, di saat kebanyakan orang lain makan jokbal ditemani soju atau bir."
18,https://food.detik.com/info-kuliner/d-5217329/minuman-khas-banten-yang-langka-tapi-enak,Minuman Khas Banten yang Langka Tapi Enak," Banten memiliki makanan dan juga minuman khas. Makanan dari daerah paling barat Pulau Jawa ini masih mudah ditemui, tetapi minuman khas Banten terbilang langka yang menjual. Padahal rasanya enak. Banten dikenal tidak hanya dengan keindahan alamnya tetapi juga kulinernya yang memanjakan lidah. Jika Anda berkunjung ke Banten untuk melihat pantai pesisirnya yang cantik, maka cobalah mencari beberapa jajanan minuman khas Banten ini.     Mungkin saat berada di Banten, Anda bisa menemui minuman yang satu ini. Sirup yang dibuat dari bunga rosella ini tidak hanya enak tapi juga sehat. Bunga rosella memiliki kandungan yang baik untuk kesehatan. Bunga yang berwarna merah mengandung vitamin C, vitamin B3 (niasin) dan vitamin B9 (folat). Bunga ini juga mengandung zat besi, kalsium, seng, natrium, fosfor, magnesium dan juga kalium. Sirup rosella dinikmati dengan mencampurkan air dan juga es batu. Paling enak dinikmati saat siang hari. Resep sirup rosella: Bahan:150 gr bunga rosella kering700 gr gula pasir1/2 sdt garam7 gelas air Cara membuat:- Cuci bunga rosella kering hingga bersih dan masukkan ke dalam panci- Tambahkan 7 gelas air dan masak dengan api sedang- Tambahkan gula pasir dan garam- Masak hingga air menyusut- Angkat ampasnya dan jantukan masak hingga sirupnya mengental- Tunggu dingin dan masukkan dalam botol   Minuman khas Banten bernama es sekemu ini adalah satu minuman khas Banten yang terdiri dari kelapa muda dan potongan buah sawo. Selain kedua buah tersebut, es sekemu juga ditambahkan dengan beberapa bahan seperti biji selasih, air kelapa dan sirup gula. Resep es sekemu: 1 buah kelapa muda, keruk lebar5 buah sawo matang, potong1 sdm selasih, rendam300 ml air kelapaEs batu secukupnya Sirup pandan:150 gram gula pasir150 ml air2 lembar daun pandan2 tetes warna hijau tua Cara membuat:- Sirup rebus gula pasir, air, daun pandan dan pewarna hijau dengan api kecil hingga mendidih. Angkat dan dinginkan.- Tuang sirup ke dalam gelas. Tambahkan kelapa, potongan sawo dan selasih- Tambahkan air kelapa dan es batu Kedua minuman khas Banten ini bisa juga Anda buat sendiri di rumah ya. Selamat mencoba! "
19,https://food.detik.com/info-kuliner/d-5218376/bukan-kue-kini-muncul-tren-babi-panggang-isi-uang-untuk-ulang-tahun,"Bukan Kue, Kini Muncul Tren Babi Panggang Isi Uang untuk Ulang Tahun"," Bukan lagi kue isi uang, kini muncul tren terbaru merayakan ulang tahun dengan babi panggang yang diisi oleh uang tunai di Singapura. Tren money cake atau kue ulang tahun berisi kejutan uang tunai di dalamnya memang masih digemari. Tapi kini di Singapura orang-orang mulai beralih ke alternatif baru yang cukup menarik. Baca Juga: Restoran Kembalikan Uang Rp 24 Juta yang Ditemukan dalam Kue Ultah Pengunjung Dilansir dari Mothership (18/10), selain money cake kini ada babi panggang isi uang yang digunakan untuk merayakan ulang tahun di sana. Nama babi panggang ini disebut sebagai 'money pulling roasted pig', yang artinya tarik uang dalam babi panggang. Lewat video yang diunggah Facebook SG Buffet King, toko '888 Money Pulling Roasted Pig' diklaim sebagai pionir babi panggang isi uang pertama di Singapura. Sebelumnya toko ini sudah terkenal membuat babi panggang selama 30 tahun. Cara membuat babi panggang isi uang ini sama seperti babi panggang lainnya. Daging babi yang sudah dibersihkan dipanggang di atas arang panas. Kemudian babi dipanggang secara tradisional, kemudian diolesi dengan saus Hoi Sin yang gurih racikan toko 888. Setelah daging babi matang, bagian dalamnya diisi dengan lembaran uang tunai yang dilapisi plastik tipis. Nantinya orang-orang bisa dengan mudah menarik uang tunai tersebut tanpa mengotori daging babinya. Banyak orang yang kini mengganti kue ulang tahun mereka dengan babi panggang. Mereka percaya bahwa babi panggang dengan uang di dalamnya bisa membawa panjang umur hingga kemakmuran. Selain itu dalam kepercayaan masyarakat Tionghoa, babi dianggap sebagai simbol kelimpahan. Ini juga biasa digunakan oleh orang keturunan Tionghoa untuk berdoa hingga menunjukkan rasa syukur mereka kepada dewa. Untuk kisaran yang ditawarkan toko 888, babi panggang spesial ini memiliki berat sekitar 4 kg sampai 5 kg dan bisa dipesan online. Untuk harga babi panggangnya termasuk uang tunai kisaran harganya SGD 188 (Rp 2 juta), untuk jumlah uang yang diinginkan bisa sesuai pesanan dari pembeli. Bisa juga pesan babi panggang tanpa uang tunai dengan harga SGD 168 (Rp 1,8 juta). ""Ini lebih menarik dari money cake, di dalam babi panggang isinya ada uang,"" komen salah satu netizen. ""Saya pasti terkejut sekaligus senang jika mendapatkan babi panggang berisi uang tunai,"" tulis netizen lainnya. Baca Juga: Mewah! Ini Dia Kreasi Kue Uang Sungguhan yang Lagi Ngetren"
20,https://food.detik.com/mie-dan-pasta/d-5218195/resep-spaghetti-mentai-yang-gurihnya-mantap,Resep Spaghetti Mentai yang Gurihnya Mantap," Spaghetti mentai merupakan sajian pasta ala Jepang yang populer. Meskipun pakai sentuhan rasa Jepang, pasta ini tetap enak dimakan hangat tanpa taburan keju. Saus mentai atau mentaiko belakangan ini populer dipadukan dengan salmon, nasi atau dengan sushi. Aslinya saus ini dibuat dari telur ikan cod, tetapi kini dipakai telur ikan terbang atau tobiko. Kreasi pasta ala Jepang dikenal dengan sebutan wafu. Fusion Italia dan Jepang ternyata menghasilkan pasta dengan rasa unik. Seperti tambahan taburan nori panggang atau katsuobushi. Kalau kamu tergoda membuat pasta dengan rasa Jepang, spaghetti mentai ini bisa kamu coba. Gurihnya mentai bisa menggantikan keju yang biasa jadi paduan spaghetti. Bikin yuk! Bahan: • 250 g spaghetti• 2 liter air• 1 sdt garam• 3 sdm minyak sayur• 2 siung bawang putih, cincang halus• 5 ekor udang ukuran besar, iris kasar• Suas Mentai:• 300 ml mayones Jepang botolan• 2 sdm saus tomat• 3 sdm saus cabe botolan• 1/2 sdt merica bubuk• 1/2 sdt garam• 1 sdt air jeruk nipis/lemon• Taburan:• 2 lembar nori, gunting kasar Cara membuat: 1. Didihkan air dengan garam lalu masukkan spaghetti, rebus hingga sapghetti lunak. Tiriskan.2. Saus Mentai: Aduk semua bahan saus hingga tercampur rata.3. Tumis bawang putih hingga wangi. Masukkan udang, aduk hingga kaku.4. Masukkan pasta, aduk hingga tercampur rata.5. Bubuhi garam dan merica lalu aduk dan angkat.6. Campur pasta dengan saus mentai hingga rata.7. Taruh di piring saji, taburi nori.8. Sajikan segera. Untuk 2 porsi Tips: 1. Spaghetti bisa diganti dengan jenis pasta lain seperti fettucine, makaroni atau pasta spiral.2. Untuk spaghetti mentai, jumlah saus bisa disesuaikan dengan selera. Jika kurang gurih bisa ditambahkan keju parut sebagai taburannya."
21,https://food.detik.com/berita-boga/d-5218950/pria-turun-bb-20-kg-hingga-cara-kupas-nanas-tanpa-pisau,Pria Turun BB 20 Kg hingga Cara Kupas Nanas Tanpa Pisau," Pria di Surabaya ini berhasil turunkan berat badan 20 kg tanpa diet menyiksa. Ada juga cara kupas nanas tanpa pisau dan kisah sukses penjual bakso rujak di Majalengka. Jalani diet untuk turunkan berat badan biasanya menyiksa, tapi pria di Surabaya ini buktikan sebaliknya. Ia bisa tetap makan enak sambil menurunkan bobot tubuhnya sebanyak 20 kg. Di Majalengka ada kuliner bakso unik yang tengah hits. Bakso dicampur kuah rujak buah yang rasanya asam segar. Produk ini merupakan inovasi pedagang mie dan ayam bakar, Asep Samprana. Mengupas nanas ternyata bisa tanpa pisau atau alat bantu apapun. Seorang netizen di Facebook membagikan caranya. Nanas hanya perlu dibentur-benturkan ke lantai agar daging buahnya terpisah. Berikut deretan berita terpopuler detikFood yang menarik perhatian pembaca sepanjang akhir pekan kemarin (19/10). Melalui Twitter @dff21, Daf membeberkan cara diet tanpa menyiksa ala dirinya. Sebelumnya bobot tubuh Daf mencapai 80 kg, namun kini stabil di angka 60 kg. Sebelumnya Daf mencoba berbagai jenis diet, namun tidak berhasil. Akhirnya ia mengombinasikan semua diet tersebut menjadi versinya sendiri. Inspirasinya datang dari diet kalori dan air putih. Seperti apa ya pola makannya? Baca Juga: Sukses Turun BB 20 Kilo, Pria Ini Beberkan Tips Diet Tanpa Menyiksa   Asep Samprana merupakan pedagang makanan di Majalengka yang kena imbas pandemi Covid-19. Ia pilih berjualan menu baru untuk memikat pelanggan. Pilihannya jatuh pada bakso kuah rujak. Inovasi menu ini rupanya disukai masyarakat Majalengka. Banyak yang tertarik mencoba paduan bakso dengan kuah rujak buah yang menyegarkan. Menu ciptaan Asep ini sekarang laris manis, bahkan bisa laku 150 porsi sehari! Baca Juga: Kisah Asep Samprana Sukses Jualan Rujak Bakso di Masa Pandemi Netizen di Facebook, John Nonny menunjukkan cara praktis kupas nanas tanpa pisah. Ia meminta temannya untuk mempraktikkan cara tersebut. Kuncinya ada pada membentur-benturkan dan menggulingkan nanas ke lantai atau permukaan cukup keras. Dengan begitu, secara otomatis daging buah nanas akan terlepas dari kulitnya. Simak cara kupas nanas tanpa pisau seperti berikut. Baca Juga: Pria Ini Bagikan Tips Kupas Nanas Tanpa Pisau, Gimana Caranya?"
22,https://food.detik.com/berita-boga/d-5218368/bertahan-saat-pandemi-parkiran-dejafoo-sajikan-makanan-dengan-konsep-food-truck,Bertahan Saat Pandemi 'Parkiran Dejafoo' Sajikan Makanan dengan Konsep Food Truck," Dengan konsep food truck, pengunjung bisa makan dan minum di area outdoor. Tetap terapkan protokol kesehatan, Parkiran Dejafoo menjadi daya tarik baru. Usaha kecil menengah (UKM) yang terdampak akibat virus Corona (COVID-19), saat ini terus bergeliat bangkit. Dengan berinovasi untuk terus bertahan, mereka membuat konsep Parkiran Dejafoo (Deretan Jajanan Foodtruck) di kawasan Kebon Dalem Purwokerto, Kabupaten Banyumas. Sajian aneka makanan dan minuman di food truck, bisa jadi pilihan bagi mereka yang bosan nongkrong dengan suasana kafe atau restoran. Konsep food truck dengan suasana outdoor berupa deretan mobil VW Combi. Konsep ini terbukti berhasil menarik pengunjung yang datang untuk sekedar makan dan minum atau berswafoto. Menurut Nino Bayu Pamungkas, salah satu pencetus Parkiran Dejafoo jika konsep berjualan ini merupakan ide dari beberapa teman-teman food truck Purwokerto yang terdampak akibat COVID-19. Pasalnya sejak pandemi, usaha mereka yang mengandalkan acara-acara rutin, semuanya terhenti. ""Ini sebenarnya ide dari temen temen food truck Purwokerto semuanya, yang tadinya kita itu jualan sendiri-sendiri, atau cuma keluar jualan kalau ikut event event aja, kayak misal event konser atau pesanan dari pemerintahan atau acara pesta. Tapi karena ada pandemi semua acara distop,"" kata Nino saat berbincang dengan detikcom, Sabtu (17/10/2020) malam. Berangkat dari situ, mereka akhirnya bersatu untuk bangkit dan tidak terus mengeluh dengan keadaan. Hingga akhirnya, dengan memanfaatkan deretan pertokoan yang sudah tutup di kawasan Kebon Dalem, Kecamatan Purwokerto Timur, mereka membuka Dejafoo. ""Jadi kita semua bareng-bareng bagaimana buat konsep baru usaha sendiri dengan konsep acara yang tetep sesuai protokol kesehatan, berinovasi lebih baik. Bangkitlah tidak cuman dirumah aja, jadi tetep survive tidak cuman diam dirumah aja dan tidak nunggu keadaan lebih baik, intinya kita keluar dari zona nyaman,"" jelasnya. Konsep ini sendiri diakuinya terbilang baru di Kota Purwokerto. Kebanyakan, jajanan dengan menggunakan konsep food truck ini banyak terdapat di kota kota besar seperti Yogyakarta dan Jakarta. ""Konsep ini sebenarnya baru pernah ada di Purwokerto, mungkin di kota kota besar sudah pernah ada. Kita juga ngikutin temen-temen Jogja, temen-temen Jakarta yang meskipun juga sama keadaannya lagi pandemi, tetep berusaha, tetap keluar dari zona nyaman supaya bisa ngelanjutin hidup,"" ujarnya. Dari beberapa kendaraan yang terparkir di Dejafoo, masing-masing menyajikan menu makanan dan minuman yang berbeda-beda. Diantaranya kendaraan VW Combi yang dimodifikasi menjadi tempat menyajikan kopi, atau VW Combi dan mobil box yang dimodifikasi menjadi tempat penyajian makanan dan minuman. Walaupun ditempat terbuka, namun proses pengolahan makanan dan minumannya semua dilakukan di dalam mobil. Parkiran Dejafoo ini sendiri mulai terparkir setiap harinya pukul 15.00 WIB -23.00 WIB. ""Kita nyajiin dari berbagai menu, tidak hanya satu menu, ada menu tradisional Indonesia ada dari western juga ada minumannya juga kopi dan susu murni juga ada,"" ujarnya. Salah satu pelanggan Dejafoo, Poppy Reza mengatakan jika konsep yang ditawarkan ini sangat menarik minat pengunjung. Apalagi warna warni beberapa kendaraan tua serta lampu outdoor yang dikonsep sedemikian rupa menambah daya tarik tersendiri. ""Sangat menarik sekali, karena ini baru pertama di Purwokerto, soalnya yang kayak gini adanya di kota-kota besar. Nah di Purwokerto ini konsepnya street food gini, asik banget, karena kan menyatu aja, natural sama jalanan. Ini konsep yang lagi dicari diusia muda, tua bisa semua nongkrong,"" kata Poppy. Menurutnya untuk dapat masuk ke lokasi parkiran Dejafoo ini, pengunjung juga diwajibkan menggunakan masker dan cuci tangan terlebih dahulu. Selain itu tempat duduk yang tersedia pun dibatasi dan saling jaga jarak. ""Setahuku kalau mau masuk sini itu wajib pakai masker dan jaga jarak juga. Selama nongkrong disini juga ada menu menu susu, kopi, terus ada sandwich, burger dan itu enak enak banget,"" ujarnya. Selain Poppy, ada juga Yeni, warga Purwokerto yang kebetulan penasaran dengan Parkiran Dejafoo dari beberapa temannya. Yeni pun mengaku jika konsep yang ditawarkan lumayan menarik dan harga makanan serta minuman yang disajikan juga sangat terjangkau. ""Konsepnya lumayan bagus, terus buat kaum yang muda dan tua bisa masuk sini semua. Di sini itu juga tempatnya nyaman, harganya terjangkau, deket dengan kota juga. Apalagi disini juga semuanya itu harus sesuai dengan protokol kesehatan, tahu sini itu dari temen ke temen,"" tuturnya."
